root@lamp-ubuntu-s-1vcpu-1gb-tor1-01:~# tcpdump -i eth0 port 22
tcpdump: verbose output suppressed, use -v or -vv for full protocol decode
listening on eth0, link-type EN10MB (Ethernet), capture size 262144 bytes
06:00:04.502568 IP lamp-ubuntu-s-1vcpu-1gb-tor1-01.ssh > cpee0dbd127d1d4-cme0dbd127d1d2.cpe.net.cable.rogers.com.65116: Flags [P.], seq 2549502253:2549502361, ack 777892485, win 501, length 108
06:00:04.502765 IP lamp-ubuntu-s-1vcpu-1gb-tor1-01.ssh > cpee0dbd127d1d4-cme0dbd127d1d2.cpe.net.cable.rogers.com.65116: Flags [P.], seq 108:144, ack 1, win 501, length 36
06:00:04.502962 IP lamp-ubuntu-s-1vcpu-1gb-tor1-01.ssh > cpee0dbd127d1d4-cme0dbd127d1d2.cpe.net.cable.rogers.com.65116: Flags [P.], seq 144:252, ack 1, win 501, length 108
06:00:04.503127 IP lamp-ubuntu-s-1vcpu-1gb-tor1-01.ssh > cpee0dbd127d1d4-cme0dbd127d1d2.cpe.net.cable.rogers.com.65116: Flags [P.], seq 252:288, ack 1, win 501, length 36
06:00:04.508489 IP lamp-ubuntu-s-1vcpu-1gb-tor1-01.ssh > cpee0dbd127d1d4-cme0dbd127d1d2.cpe.net.cable.rogers.com.65116: Flags [P.], seq 288:516, ack 1, win 501, length 228
06:00:04.508621 IP lamp-ubuntu-s-1vcpu-1gb-tor1-01.ssh > cpee0dbd127d1d4-cme0dbd127d1d2.cpe.net.cable.rogers.com.65116: Flags [P.], seq 516:552, ack 1, win 501, length 36
06:00:04.508776 IP lamp-ubuntu-s-1vcpu-1gb-tor1-01.ssh > cpee0dbd127d1d4-cme0dbd127d1d2.cpe.net.cable.rogers.com.65116: Flags [P.], seq 552:756, ack 1, win 501, length 204
06:00:04.508894 IP lamp-ubuntu-s-1vcpu-1gb-tor1-01.ssh > cpee0dbd127d1d4-cme0dbd127d1d2.cpe.net.cable.rogers.com.65116: Flags [P.], seq 756:792, ack 1, win 501, length 36
06:00:04.509046 IP lamp-ubuntu-s-1vcpu-1gb-tor1-01.ssh > cpee0dbd127d1d4-cme0dbd127d1d2.cpe.net.cable.rogers.com.65116: Flags [P.], seq 792:1004, ack 1, win 501, length 212
06:00:04.512240 IP cpee0dbd127d1d4-cme0dbd127d1d2.cpe.net.cable.rogers.com.65116 > lamp-ubuntu-s-1vcpu-1gb-tor1-01.ssh: Flags [.], ack 288, win 510, length 0
06:00:04.512301 IP lamp-ubuntu-s-1vcpu-1gb-tor1-01.ssh > cpee0dbd127d1d4-cme0dbd127d1d2.cpe.net.cable.rogers.com.65116: Flags [P.], seq 1004:2504, ack 1, win 501, length 1500
06:00:04.512516 IP lamp-ubuntu-s-1vcpu-1gb-tor1-01.ssh > cpee0dbd127d1d4-cme0dbd127d1d2.cpe.net.cable.rogers.com.65116: Flags [P.], seq 2504:2700, ack 1, win 501, length 196
06:00:04.512659 IP lamp-ubuntu-s-1vcpu-1gb-tor1-01.ssh > cpee0dbd127d1d4-cme0dbd127d1d2.cpe.net.cable.rogers.com.65116: Flags [P.], seq 2700:2736, ack 1, win 501, length 36
06:00:04.512828 IP lamp-ubuntu-s-1vcpu-1gb-tor1-01.ssh > cpee0dbd127d1d4-cme0dbd127d1d2.cpe.net.cable.rogers.com.65116: Flags [P.], seq 2736:2948, ack 1, win 501, length 212
06:00:04.512963 IP lamp-ubuntu-s-1vcpu-1gb-tor1-01.ssh > cpee0dbd127d1d4-cme0dbd127d1d2.cpe.net.cable.rogers.com.65116: Flags [P.], seq 2948:2984, ack 1, win 501, length 36
06:00:04.513133 IP lamp-ubuntu-s-1vcpu-1gb-tor1-01.ssh > cpee0dbd127d1d4-cme0dbd127d1d2.cpe.net.cable.rogers.com.65116: Flags [P.], seq 2984:3196, ack 1, win 501, length 212
06:00:04.513258 IP lamp-ubuntu-s-1vcpu-1gb-tor1-01.ssh > cpee0dbd127d1d4-cme0dbd127d1d2.cpe.net.cable.rogers.com.65116: Flags [P.], seq 3196:3232, ack 1, win 501, length 36
06:00:04.513414 IP lamp-ubuntu-s-1vcpu-1gb-tor1-01.ssh > cpee0dbd127d1d4-cme0dbd127d1d2.cpe.net.cable.rogers.com.65116: Flags [P.], seq 3232:3444, ack 1, win 501, length 212
06:00:04.513539 IP lamp-ubuntu-s-1vcpu-1gb-tor1-01.ssh > cpee0dbd127d1d4-cme0dbd127d1d2.cpe.net.cable.rogers.com.65116: Flags [P.], seq 3444:3480, ack 1, win 501, length 36
06:00:04.518036 IP cpee0dbd127d1d4-cme0dbd127d1d2.cpe.net.cable.rogers.com.65116 > lamp-ubuntu-s-1vcpu-1gb-tor1-01.ssh: Flags [.], ack 2504, win 513, length 0
06:00:04.518085 IP lamp-ubuntu-s-1vcpu-1gb-tor1-01.ssh > cpee0dbd127d1d4-cme0dbd127d1d2.cpe.net.cable.rogers.com.65116: Flags [P.], seq 3480:4968, ack 1, win 501, length 1488
06:00:04.518232 IP lamp-ubuntu-s-1vcpu-1gb-tor1-01.ssh > cpee0dbd127d1d4-cme0dbd127d1d2.cpe.net.cable.rogers.com.65116: Flags [P.], seq 4968:5164, ack 1, win 501, length 196
06:00:04.518307 IP lamp-ubuntu-s-1vcpu-1gb-tor1-01.ssh > cpee0dbd127d1d4-cme0dbd127d1d2.cpe.net.cable.rogers.com.65116: Flags [P.], seq 5164:5200, ack 1, win 501, length 36
06:00:04.518398 IP lamp-ubuntu-s-1vcpu-1gb-tor1-01.ssh > cpee0dbd127d1d4-cme0dbd127d1d2.cpe.net.cable.rogers.com.65116: Flags [P.], seq 5200:5412, ack 1, win 501, length 212
06:00:04.518463 IP lamp-ubuntu-s-1vcpu-1gb-tor1-01.ssh > cpee0dbd127d1d4-cme0dbd127d1d2.cpe.net.cable.rogers.com.65116: Flags [P.], seq 5412:5448, ack 1, win 501, length 36
06:00:04.518535 IP lamp-ubuntu-s-1vcpu-1gb-tor1-01.ssh > cpee0dbd127d1d4-cme0dbd127d1d2.cpe.net.cable.rogers.com.65116: Flags [P.], seq 5448:5660, ack 1, win 501, length 212
06:00:04.518611 IP lamp-ubuntu-s-1vcpu-1gb-tor1-01.ssh > cpee0dbd127d1d4-cme0dbd127d1d2.cpe.net.cable.rogers.com.65116: Flags [P.], seq 5660:5696, ack 1, win 501, length 36
06:00:04.518694 IP lamp-ubuntu-s-1vcpu-1gb-tor1-01.ssh > cpee0dbd127d1d4-cme0dbd127d1d2.cpe.net.cable.rogers.com.65116: Flags [P.], seq 5696:5908, ack 1, win 501, length 212
06:00:04.518759 IP lamp-ubuntu-s-1vcpu-1gb-tor1-01.ssh > cpee0dbd127d1d4-cme0dbd127d1d2.cpe.net.cable.rogers.com.65116: Flags [P.], seq 5908:5944, ack 1, win 501, length 36
06:00:04.518841 IP lamp-ubuntu-s-1vcpu-1gb-tor1-01.ssh > cpee0dbd127d1d4-cme0dbd127d1d2.cpe.net.cable.rogers.com.65116: Flags [P.], seq 5944:6156, ack 1, win 501, length 212
06:00:04.518907 IP lamp-ubuntu-s-1vcpu-1gb-tor1-01.ssh > cpee0dbd127d1d4-cme0dbd127d1d2.cpe.net.cable.rogers.com.65116: Flags [P.], seq 6156:6192, ack 1, win 501, length 36
06:00:04.518987 IP lamp-ubuntu-s-1vcpu-1gb-tor1-01.ssh > cpee0dbd127d1d4-cme0dbd127d1d2.cpe.net.cable.rogers.com.65116: Flags [P.], seq 6192:6404, ack 1, win 501, length 212
06:00:04.519050 IP lamp-ubuntu-s-1vcpu-1gb-tor1-01.ssh > cpee0dbd127d1d4-cme0dbd127d1d2.cpe.net.cable.rogers.com.65116: Flags [P.], seq 6404:6440, ack 1, win 501, length 36
06:00:04.522233 IP cpee0dbd127d1d4-cme0dbd127d1d2.cpe.net.cable.rogers.com.65116 > lamp-ubuntu-s-1vcpu-1gb-tor1-01.ssh: Flags [.], ack 2736, win 512, length 0
06:00:04.522233 IP cpee0dbd127d1d4-cme0dbd127d1d2.cpe.net.cable.rogers.com.65116 > lamp-ubuntu-s-1vcpu-1gb-tor1-01.ssh: Flags [.], ack 3480, win 509, length 0
06:00:04.522276 IP lamp-ubuntu-s-1vcpu-1gb-tor1-01.ssh > cpee0dbd127d1d4-cme0dbd127d1d2.cpe.net.cable.rogers.com.65116: Flags [P.], seq 6440:8424, ack 1, win 501, length 1984
06:00:04.522413 IP lamp-ubuntu-s-1vcpu-1gb-tor1-01.ssh > cpee0dbd127d1d4-cme0dbd127d1d2.cpe.net.cable.rogers.com.65116: Flags [P.], seq 8424:8620, ack 1, win 501, length 196
06:00:04.522498 IP lamp-ubuntu-s-1vcpu-1gb-tor1-01.ssh > cpee0dbd127d1d4-cme0dbd127d1d2.cpe.net.cable.rogers.com.65116: Flags [P.], seq 8620:8656, ack 1, win 501, length 36
06:00:04.522577 IP lamp-ubuntu-s-1vcpu-1gb-tor1-01.ssh > cpee0dbd127d1d4-cme0dbd127d1d2.cpe.net.cable.rogers.com.65116: Flags [P.], seq 8656:8852, ack 1, win 501, length 196
06:00:04.522644 IP lamp-ubuntu-s-1vcpu-1gb-tor1-01.ssh > cpee0dbd127d1d4-cme0dbd127d1d2.cpe.net.cable.rogers.com.65116: Flags [P.], seq 8852:8888, ack 1, win 501, length 36
06:00:04.522731 IP lamp-ubuntu-s-1vcpu-1gb-tor1-01.ssh > cpee0dbd127d1d4-cme0dbd127d1d2.cpe.net.cable.rogers.com.65116: Flags [P.], seq 8888:9100, ack 1, win 501, length 212
06:00:04.522828 IP lamp-ubuntu-s-1vcpu-1gb-tor1-01.ssh > cpee0dbd127d1d4-cme0dbd127d1d2.cpe.net.cable.rogers.com.65116: Flags [P.], seq 9100:9136, ack 1, win 501, length 36
06:00:04.522879 IP lamp-ubuntu-s-1vcpu-1gb-tor1-01.ssh > cpee0dbd127d1d4-cme0dbd127d1d2.cpe.net.cable.rogers.com.65116: Flags [P.], seq 9136:9348, ack 1, win 501, length 212
06:00:04.522941 IP lamp-ubuntu-s-1vcpu-1gb-tor1-01.ssh > cpee0dbd127d1d4-cme0dbd127d1d2.cpe.net.cable.rogers.com.65116: Flags [P.], seq 9348:9384, ack 1, win 501, length 36
06:00:04.523022 IP lamp-ubuntu-s-1vcpu-1gb-tor1-01.ssh > cpee0dbd127d1d4-cme0dbd127d1d2.cpe.net.cable.rogers.com.65116: Flags [P.], seq 9384:9596, ack 1, win 501, length 212
06:00:04.523090 IP lamp-ubuntu-s-1vcpu-1gb-tor1-01.ssh > cpee0dbd127d1d4-cme0dbd127d1d2.cpe.net.cable.rogers.com.65116: Flags [P.], seq 9596:9632, ack 1, win 501, length 36
06:00:04.523171 IP lamp-ubuntu-s-1vcpu-1gb-tor1-01.ssh > cpee0dbd127d1d4-cme0dbd127d1d2.cpe.net.cable.rogers.com.65116: Flags [P.], seq 9632:9844, ack 1, win 501, length 212
06:00:04.523239 IP lamp-ubuntu-s-1vcpu-1gb-tor1-01.ssh > cpee0dbd127d1d4-cme0dbd127d1d2.cpe.net.cable.rogers.com.65116: Flags [P.], seq 9844:9880, ack 1, win 501, length 36
06:00:04.523325 IP lamp-ubuntu-s-1vcpu-1gb-tor1-01.ssh > cpee0dbd127d1d4-cme0dbd127d1d2.cpe.net.cable.rogers.com.65116: Flags [P.], seq 9880:10092, ack 1, win 501, length 212
06:00:04.523392 IP lamp-ubuntu-s-1vcpu-1gb-tor1-01.ssh > cpee0dbd127d1d4-cme0dbd127d1d2.cpe.net.cable.rogers.com.65116: Flags [P.], seq 10092:10128, ack 1, win 501, length 36
06:00:04.530164 IP cpee0dbd127d1d4-cme0dbd127d1d2.cpe.net.cable.rogers.com.65116 > lamp-ubuntu-s-1vcpu-1gb-tor1-01.ssh: Flags [.], ack 8620, win 513, length 0
06:00:04.530165 IP cpee0dbd127d1d4-cme0dbd127d1d2.cpe.net.cable.rogers.com.65116 > lamp-ubuntu-s-1vcpu-1gb-tor1-01.ssh: Flags [.], ack 10128, win 513, length 0
06:00:04.530243 IP lamp-ubuntu-s-1vcpu-1gb-tor1-01.ssh > cpee0dbd127d1d4-cme0dbd127d1d2.cpe.net.cable.rogers.com.65116: Flags [P.], seq 10128:12608, ack 1, win 501, length 2480
06:00:04.530439 IP lamp-ubuntu-s-1vcpu-1gb-tor1-01.ssh > cpee0dbd127d1d4-cme0dbd127d1d2.cpe.net.cable.rogers.com.65116: Flags [P.], seq 12608:12804, ack 1, win 501, length 196
06:00:04.530523 IP lamp-ubuntu-s-1vcpu-1gb-tor1-01.ssh > cpee0dbd127d1d4-cme0dbd127d1d2.cpe.net.cable.rogers.com.65116: Flags [P.], seq 12804:12840, ack 1, win 501, length 36
06:00:04.530617 IP lamp-ubuntu-s-1vcpu-1gb-tor1-01.ssh > cpee0dbd127d1d4-cme0dbd127d1d2.cpe.net.cable.rogers.com.65116: Flags [P.], seq 12840:13036, ack 1, win 501, length 196
06:00:04.530687 IP lamp-ubuntu-s-1vcpu-1gb-tor1-01.ssh > cpee0dbd127d1d4-cme0dbd127d1d2.cpe.net.cable.rogers.com.65116: Flags [P.], seq 13036:13072, ack 1, win 501, length 36
06:00:04.530777 IP lamp-ubuntu-s-1vcpu-1gb-tor1-01.ssh > cpee0dbd127d1d4-cme0dbd127d1d2.cpe.net.cable.rogers.com.65116: Flags [P.], seq 13072:13284, ack 1, win 501, length 212
06:00:04.530844 IP lamp-ubuntu-s-1vcpu-1gb-tor1-01.ssh > cpee0dbd127d1d4-cme0dbd127d1d2.cpe.net.cable.rogers.com.65116: Flags [P.], seq 13284:13320, ack 1, win 501, length 36
06:00:04.530922 IP lamp-ubuntu-s-1vcpu-1gb-tor1-01.ssh > cpee0dbd127d1d4-cme0dbd127d1d2.cpe.net.cable.rogers.com.65116: Flags [P.], seq 13320:13532, ack 1, win 501, length 212
06:00:04.530990 IP lamp-ubuntu-s-1vcpu-1gb-tor1-01.ssh > cpee0dbd127d1d4-cme0dbd127d1d2.cpe.net.cable.rogers.com.65116: Flags [P.], seq 13532:13568, ack 1, win 501, length 36
06:00:04.531078 IP lamp-ubuntu-s-1vcpu-1gb-tor1-01.ssh > cpee0dbd127d1d4-cme0dbd127d1d2.cpe.net.cable.rogers.com.65116: Flags [P.], seq 13568:13780, ack 1, win 501, length 212
06:00:04.531146 IP lamp-ubuntu-s-1vcpu-1gb-tor1-01.ssh > cpee0dbd127d1d4-cme0dbd127d1d2.cpe.net.cable.rogers.com.65116: Flags [P.], seq 13780:13816, ack 1, win 501, length 36
06:00:04.531254 IP lamp-ubuntu-s-1vcpu-1gb-tor1-01.ssh > cpee0dbd127d1d4-cme0dbd127d1d2.cpe.net.cable.rogers.com.65116: Flags [P.], seq 13816:14028, ack 1, win 501, length 212
06:00:04.531321 IP lamp-ubuntu-s-1vcpu-1gb-tor1-01.ssh > cpee0dbd127d1d4-cme0dbd127d1d2.cpe.net.cable.rogers.com.65116: Flags [P.], seq 14028:14064, ack 1, win 501, length 36
06:00:04.531407 IP lamp-ubuntu-s-1vcpu-1gb-tor1-01.ssh > cpee0dbd127d1d4-cme0dbd127d1d2.cpe.net.cable.rogers.com.65116: Flags [P.], seq 14064:14276, ack 1, win 501, length 212
06:00:04.531523 IP lamp-ubuntu-s-1vcpu-1gb-tor1-01.ssh > cpee0dbd127d1d4-cme0dbd127d1d2.cpe.net.cable.rogers.com.65116: Flags [P.], seq 14276:14664, ack 1, win 501, length 388
06:00:04.531675 IP lamp-ubuntu-s-1vcpu-1gb-tor1-01.ssh > cpee0dbd127d1d4-cme0dbd127d1d2.cpe.net.cable.rogers.com.65116: Flags [P.], seq 14664:15404, ack 1, win 501, length 740
06:00:04.531863 IP lamp-ubuntu-s-1vcpu-1gb-tor1-01.ssh > cpee0dbd127d1d4-cme0dbd127d1d2.cpe.net.cable.rogers.com.65116: Flags [P.], seq 15404:16328, ack 1, win 501, length 924
06:00:04.532220 IP lamp-ubuntu-s-1vcpu-1gb-tor1-01.ssh > cpee0dbd127d1d4-cme0dbd127d1d2.cpe.net.cable.rogers.com.65116: Flags [P.], seq 16328:16548, ack 1, win 501, length 220
06:00:04.532354 IP lamp-ubuntu-s-1vcpu-1gb-tor1-01.ssh > cpee0dbd127d1d4-cme0dbd127d1d2.cpe.net.cable.rogers.com.65116: Flags [P.], seq 16548:16760, ack 1, win 501, length 212
06:00:04.532464 IP lamp-ubuntu-s-1vcpu-1gb-tor1-01.ssh > cpee0dbd127d1d4-cme0dbd127d1d2.cpe.net.cable.rogers.com.65116: Flags [P.], seq 16760:16972, ack 1, win 501, length 212
06:00:04.532569 IP lamp-ubuntu-s-1vcpu-1gb-tor1-01.ssh > cpee0dbd127d1d4-cme0dbd127d1d2.cpe.net.cable.rogers.com.65116: Flags [P.], seq 16972:17184, ack 1, win 501, length 212
06:00:04.532673 IP lamp-ubuntu-s-1vcpu-1gb-tor1-01.ssh > cpee0dbd127d1d4-cme0dbd127d1d2.cpe.net.cable.rogers.com.65116: Flags [P.], seq 17184:17396, ack 1, win 501, length 212
06:00:04.532776 IP lamp-ubuntu-s-1vcpu-1gb-tor1-01.ssh > cpee0dbd127d1d4-cme0dbd127d1d2.cpe.net.cable.rogers.com.65116: Flags [P.], seq 17396:17608, ack 1, win 501, length 212
06:00:04.532880 IP lamp-ubuntu-s-1vcpu-1gb-tor1-01.ssh > cpee0dbd127d1d4-cme0dbd127d1d2.cpe.net.cable.rogers.com.65116: Flags [P.], seq 17608:17820, ack 1, win 501, length 212
06:00:04.533001 IP lamp-ubuntu-s-1vcpu-1gb-tor1-01.ssh > cpee0dbd127d1d4-cme0dbd127d1d2.cpe.net.cable.rogers.com.65116: Flags [P.], seq 17820:18032, ack 1, win 501, length 212
06:00:04.533107 IP lamp-ubuntu-s-1vcpu-1gb-tor1-01.ssh > cpee0dbd127d1d4-cme0dbd127d1d2.cpe.net.cable.rogers.com.65116: Flags [P.], seq 18032:18244, ack 1, win 501, length 212
06:00:04.533215 IP lamp-ubuntu-s-1vcpu-1gb-tor1-01.ssh > cpee0dbd127d1d4-cme0dbd127d1d2.cpe.net.cable.rogers.com.65116: Flags [P.], seq 18244:18456, ack 1, win 501, length 212
06:00:04.533334 IP lamp-ubuntu-s-1vcpu-1gb-tor1-01.ssh > cpee0dbd127d1d4-cme0dbd127d1d2.cpe.net.cable.rogers.com.65116: Flags [P.], seq 18456:18668, ack 1, win 501, length 212
06:00:04.533437 IP lamp-ubuntu-s-1vcpu-1gb-tor1-01.ssh > cpee0dbd127d1d4-cme0dbd127d1d2.cpe.net.cable.rogers.com.65116: Flags [P.], seq 18668:18880, ack 1, win 501, length 212
06:00:04.533539 IP lamp-ubuntu-s-1vcpu-1gb-tor1-01.ssh > cpee0dbd127d1d4-cme0dbd127d1d2.cpe.net.cable.rogers.com.65116: Flags [P.], seq 18880:19092, ack 1, win 501, length 212
06:00:04.533640 IP lamp-ubuntu-s-1vcpu-1gb-tor1-01.ssh > cpee0dbd127d1d4-cme0dbd127d1d2.cpe.net.cable.rogers.com.65116: Flags [P.], seq 19092:19304, ack 1, win 501, length 212
06:00:04.533754 IP lamp-ubuntu-s-1vcpu-1gb-tor1-01.ssh > cpee0dbd127d1d4-cme0dbd127d1d2.cpe.net.cable.rogers.com.65116: Flags [P.], seq 19304:19516, ack 1, win 501, length 212
06:00:04.533883 IP lamp-ubuntu-s-1vcpu-1gb-tor1-01.ssh > cpee0dbd127d1d4-cme0dbd127d1d2.cpe.net.cable.rogers.com.65116: Flags [P.], seq 19516:19728, ack 1, win 501, length 212
06:00:04.533992 IP lamp-ubuntu-s-1vcpu-1gb-tor1-01.ssh > cpee0dbd127d1d4-cme0dbd127d1d2.cpe.net.cable.rogers.com.65116: Flags [P.], seq 19728:19940, ack 1, win 501, length 212
06:00:04.534098 IP lamp-ubuntu-s-1vcpu-1gb-tor1-01.ssh > cpee0dbd127d1d4-cme0dbd127d1d2.cpe.net.cable.rogers.com.65116: Flags [P.], seq 19940:20152, ack 1, win 501, length 212
06:00:04.534200 IP lamp-ubuntu-s-1vcpu-1gb-tor1-01.ssh > cpee0dbd127d1d4-cme0dbd127d1d2.cpe.net.cable.rogers.com.65116: Flags [P.], seq 20152:20364, ack 1, win 501, length 212
06:00:04.534303 IP lamp-ubuntu-s-1vcpu-1gb-tor1-01.ssh > cpee0dbd127d1d4-cme0dbd127d1d2.cpe.net.cable.rogers.com.65116: Flags [P.], seq 20364:20576, ack 1, win 501, length 212
06:00:04.534406 IP lamp-ubuntu-s-1vcpu-1gb-tor1-01.ssh > cpee0dbd127d1d4-cme0dbd127d1d2.cpe.net.cable.rogers.com.65116: Flags [P.], seq 20576:20788, ack 1, win 501, length 212
06:00:04.534510 IP lamp-ubuntu-s-1vcpu-1gb-tor1-01.ssh > cpee0dbd127d1d4-cme0dbd127d1d2.cpe.net.cable.rogers.com.65116: Flags [P.], seq 20788:21000, ack 1, win 501, length 212
06:00:04.534614 IP lamp-ubuntu-s-1vcpu-1gb-tor1-01.ssh > cpee0dbd127d1d4-cme0dbd127d1d2.cpe.net.cable.rogers.com.65116: Flags [P.], seq 21000:21212, ack 1, win 501, length 212
06:00:04.534716 IP lamp-ubuntu-s-1vcpu-1gb-tor1-01.ssh > cpee0dbd127d1d4-cme0dbd127d1d2.cpe.net.cable.rogers.com.65116: Flags [P.], seq 21212:21424, ack 1, win 501, length 212
06:00:04.534819 IP lamp-ubuntu-s-1vcpu-1gb-tor1-01.ssh > cpee0dbd127d1d4-cme0dbd127d1d2.cpe.net.cable.rogers.com.65116: Flags [P.], seq 21424:21636, ack 1, win 501, length 212
06:00:04.534921 IP lamp-ubuntu-s-1vcpu-1gb-tor1-01.ssh > cpee0dbd127d1d4-cme0dbd127d1d2.cpe.net.cable.rogers.com.65116: Flags [P.], seq 21636:21848, ack 1, win 501, length 212
06:00:04.535025 IP lamp-ubuntu-s-1vcpu-1gb-tor1-01.ssh > cpee0dbd127d1d4-cme0dbd127d1d2.cpe.net.cable.rogers.com.65116: Flags [P.], seq 21848:22060, ack 1, win 501, length 212
06:00:04.535127 IP lamp-ubuntu-s-1vcpu-1gb-tor1-01.ssh > cpee0dbd127d1d4-cme0dbd127d1d2.cpe.net.cable.rogers.com.65116: Flags [P.], seq 22060:22272, ack 1, win 501, length 212
06:00:04.535228 IP lamp-ubuntu-s-1vcpu-1gb-tor1-01.ssh > cpee0dbd127d1d4-cme0dbd127d1d2.cpe.net.cable.rogers.com.65116: Flags [P.], seq 22272:22484, ack 1, win 501, length 212
06:00:04.535328 IP lamp-ubuntu-s-1vcpu-1gb-tor1-01.ssh > cpee0dbd127d1d4-cme0dbd127d1d2.cpe.net.cable.rogers.com.65116: Flags [P.], seq 22484:22696, ack 1, win 501, length 212
06:00:04.535431 IP lamp-ubuntu-s-1vcpu-1gb-tor1-01.ssh > cpee0dbd127d1d4-cme0dbd127d1d2.cpe.net.cable.rogers.com.65116: Flags [P.], seq 22696:22908, ack 1, win 501, length 212
06:00:04.535535 IP lamp-ubuntu-s-1vcpu-1gb-tor1-01.ssh > cpee0dbd127d1d4-cme0dbd127d1d2.cpe.net.cable.rogers.com.65116: Flags [P.], seq 22908:23120, ack 1, win 501, length 212
06:00:04.535639 IP lamp-ubuntu-s-1vcpu-1gb-tor1-01.ssh > cpee0dbd127d1d4-cme0dbd127d1d2.cpe.net.cable.rogers.com.65116: Flags [P.], seq 23120:23332, ack 1, win 501, length 212
06:00:04.535741 IP lamp-ubuntu-s-1vcpu-1gb-tor1-01.ssh > cpee0dbd127d1d4-cme0dbd127d1d2.cpe.net.cable.rogers.com.65116: Flags [P.], seq 23332:23544, ack 1, win 501, length 212
06:00:04.535850 IP lamp-ubuntu-s-1vcpu-1gb-tor1-01.ssh > cpee0dbd127d1d4-cme0dbd127d1d2.cpe.net.cable.rogers.com.65116: Flags [P.], seq 23544:23756, ack 1, win 501, length 212
06:00:04.535953 IP lamp-ubuntu-s-1vcpu-1gb-tor1-01.ssh > cpee0dbd127d1d4-cme0dbd127d1d2.cpe.net.cable.rogers.com.65116: Flags [P.], seq 23756:23968, ack 1, win 501, length 212
06:00:04.536055 IP lamp-ubuntu-s-1vcpu-1gb-tor1-01.ssh > cpee0dbd127d1d4-cme0dbd127d1d2.cpe.net.cable.rogers.com.65116: Flags [P.], seq 23968:24180, ack 1, win 501, length 212
06:00:04.536157 IP lamp-ubuntu-s-1vcpu-1gb-tor1-01.ssh > cpee0dbd127d1d4-cme0dbd127d1d2.cpe.net.cable.rogers.com.65116: Flags [P.], seq 24180:24392, ack 1, win 501, length 212
06:00:04.536288 IP lamp-ubuntu-s-1vcpu-1gb-tor1-01.ssh > cpee0dbd127d1d4-cme0dbd127d1d2.cpe.net.cable.rogers.com.65116: Flags [P.], seq 24392:24604, ack 1, win 501, length 212
06:00:04.536390 IP lamp-ubuntu-s-1vcpu-1gb-tor1-01.ssh > cpee0dbd127d1d4-cme0dbd127d1d2.cpe.net.cable.rogers.com.65116: Flags [P.], seq 24604:24816, ack 1, win 501, length 212
06:00:04.536493 IP lamp-ubuntu-s-1vcpu-1gb-tor1-01.ssh > cpee0dbd127d1d4-cme0dbd127d1d2.cpe.net.cable.rogers.com.65116: Flags [P.], seq 24816:25028, ack 1, win 501, length 212
06:00:04.536596 IP lamp-ubuntu-s-1vcpu-1gb-tor1-01.ssh > cpee0dbd127d1d4-cme0dbd127d1d2.cpe.net.cable.rogers.com.65116: Flags [P.], seq 25028:25240, ack 1, win 501, length 212
06:00:04.542178 IP cpee0dbd127d1d4-cme0dbd127d1d2.cpe.net.cable.rogers.com.65116 > lamp-ubuntu-s-1vcpu-1gb-tor1-01.ssh: Flags [.], ack 16760, win 507, length 0
06:00:04.542244 IP lamp-ubuntu-s-1vcpu-1gb-tor1-01.ssh > cpee0dbd127d1d4-cme0dbd127d1d2.cpe.net.cable.rogers.com.65116: Flags [P.], seq 25240:25452, ack 1, win 501, length 212
06:00:04.542425 IP lamp-ubuntu-s-1vcpu-1gb-tor1-01.ssh > cpee0dbd127d1d4-cme0dbd127d1d2.cpe.net.cable.rogers.com.65116: Flags [P.], seq 25452:25824, ack 1, win 501, length 372
06:00:04.542540 IP lamp-ubuntu-s-1vcpu-1gb-tor1-01.ssh > cpee0dbd127d1d4-cme0dbd127d1d2.cpe.net.cable.rogers.com.65116: Flags [P.], seq 25824:26036, ack 1, win 501, length 212
06:00:04.542645 IP lamp-ubuntu-s-1vcpu-1gb-tor1-01.ssh > cpee0dbd127d1d4-cme0dbd127d1d2.cpe.net.cable.rogers.com.65116: Flags [P.], seq 26036:26248, ack 1, win 501, length 212
06:00:04.542749 IP lamp-ubuntu-s-1vcpu-1gb-tor1-01.ssh > cpee0dbd127d1d4-cme0dbd127d1d2.cpe.net.cable.rogers.com.65116: Flags [P.], seq 26248:26460, ack 1, win 501, length 212
06:00:04.542853 IP lamp-ubuntu-s-1vcpu-1gb-tor1-01.ssh > cpee0dbd127d1d4-cme0dbd127d1d2.cpe.net.cable.rogers.com.65116: Flags [P.], seq 26460:26672, ack 1, win 501, length 212
06:00:04.542963 IP lamp-ubuntu-s-1vcpu-1gb-tor1-01.ssh > cpee0dbd127d1d4-cme0dbd127d1d2.cpe.net.cable.rogers.com.65116: Flags [P.], seq 26672:26884, ack 1, win 501, length 212
06:00:04.543066 IP lamp-ubuntu-s-1vcpu-1gb-tor1-01.ssh > cpee0dbd127d1d4-cme0dbd127d1d2.cpe.net.cable.rogers.com.65116: Flags [P.], seq 26884:27096, ack 1, win 501, length 212
06:00:04.543176 IP lamp-ubuntu-s-1vcpu-1gb-tor1-01.ssh > cpee0dbd127d1d4-cme0dbd127d1d2.cpe.net.cable.rogers.com.65116: Flags [P.], seq 27096:27308, ack 1, win 501, length 212
06:00:04.543273 IP lamp-ubuntu-s-1vcpu-1gb-tor1-01.ssh > cpee0dbd127d1d4-cme0dbd127d1d2.cpe.net.cable.rogers.com.65116: Flags [P.], seq 27308:27520, ack 1, win 501, length 212
06:00:04.543377 IP lamp-ubuntu-s-1vcpu-1gb-tor1-01.ssh > cpee0dbd127d1d4-cme0dbd127d1d2.cpe.net.cable.rogers.com.65116: Flags [P.], seq 27520:27732, ack 1, win 501, length 212
06:00:04.543474 IP lamp-ubuntu-s-1vcpu-1gb-tor1-01.ssh > cpee0dbd127d1d4-cme0dbd127d1d2.cpe.net.cable.rogers.com.65116: Flags [P.], seq 27732:27944, ack 1, win 501, length 212
06:00:04.543572 IP lamp-ubuntu-s-1vcpu-1gb-tor1-01.ssh > cpee0dbd127d1d4-cme0dbd127d1d2.cpe.net.cable.rogers.com.65116: Flags [P.], seq 27944:28156, ack 1, win 501, length 212
06:00:04.543674 IP lamp-ubuntu-s-1vcpu-1gb-tor1-01.ssh > cpee0dbd127d1d4-cme0dbd127d1d2.cpe.net.cable.rogers.com.65116: Flags [P.], seq 28156:28368, ack 1, win 501, length 212
06:00:04.543771 IP lamp-ubuntu-s-1vcpu-1gb-tor1-01.ssh > cpee0dbd127d1d4-cme0dbd127d1d2.cpe.net.cable.rogers.com.65116: Flags [P.], seq 28368:28580, ack 1, win 501, length 212
06:00:04.543873 IP lamp-ubuntu-s-1vcpu-1gb-tor1-01.ssh > cpee0dbd127d1d4-cme0dbd127d1d2.cpe.net.cable.rogers.com.65116: Flags [P.], seq 28580:28792, ack 1, win 501, length 212
06:00:04.543970 IP lamp-ubuntu-s-1vcpu-1gb-tor1-01.ssh > cpee0dbd127d1d4-cme0dbd127d1d2.cpe.net.cable.rogers.com.65116: Flags [P.], seq 28792:29004, ack 1, win 501, length 212
06:00:04.544070 IP lamp-ubuntu-s-1vcpu-1gb-tor1-01.ssh > cpee0dbd127d1d4-cme0dbd127d1d2.cpe.net.cable.rogers.com.65116: Flags [P.], seq 29004:29216, ack 1, win 501, length 212
06:00:04.544171 IP lamp-ubuntu-s-1vcpu-1gb-tor1-01.ssh > cpee0dbd127d1d4-cme0dbd127d1d2.cpe.net.cable.rogers.com.65116: Flags [P.], seq 29216:29428, ack 1, win 501, length 212
06:00:04.544291 IP lamp-ubuntu-s-1vcpu-1gb-tor1-01.ssh > cpee0dbd127d1d4-cme0dbd127d1d2.cpe.net.cable.rogers.com.65116: Flags [P.], seq 29428:29640, ack 1, win 501, length 212
06:00:04.544399 IP lamp-ubuntu-s-1vcpu-1gb-tor1-01.ssh > cpee0dbd127d1d4-cme0dbd127d1d2.cpe.net.cable.rogers.com.65116: Flags [P.], seq 29640:29852, ack 1, win 501, length 212
06:00:04.544497 IP lamp-ubuntu-s-1vcpu-1gb-tor1-01.ssh > cpee0dbd127d1d4-cme0dbd127d1d2.cpe.net.cable.rogers.com.65116: Flags [P.], seq 29852:30064, ack 1, win 501, length 212
06:00:04.544632 IP lamp-ubuntu-s-1vcpu-1gb-tor1-01.ssh > cpee0dbd127d1d4-cme0dbd127d1d2.cpe.net.cable.rogers.com.65116: Flags [P.], seq 30064:30276, ack 1, win 501, length 212
06:00:04.544739 IP lamp-ubuntu-s-1vcpu-1gb-tor1-01.ssh > cpee0dbd127d1d4-cme0dbd127d1d2.cpe.net.cable.rogers.com.65116: Flags [P.], seq 30276:30488, ack 1, win 501, length 212
06:00:04.544846 IP lamp-ubuntu-s-1vcpu-1gb-tor1-01.ssh > cpee0dbd127d1d4-cme0dbd127d1d2.cpe.net.cable.rogers.com.65116: Flags [P.], seq 30488:30700, ack 1, win 501, length 212
06:00:04.544957 IP lamp-ubuntu-s-1vcpu-1gb-tor1-01.ssh > cpee0dbd127d1d4-cme0dbd127d1d2.cpe.net.cable.rogers.com.65116: Flags [P.], seq 30700:30912, ack 1, win 501, length 212
06:00:04.545065 IP lamp-ubuntu-s-1vcpu-1gb-tor1-01.ssh > cpee0dbd127d1d4-cme0dbd127d1d2.cpe.net.cable.rogers.com.65116: Flags [P.], seq 30912:31124, ack 1, win 501, length 212
06:00:04.545164 IP lamp-ubuntu-s-1vcpu-1gb-tor1-01.ssh > cpee0dbd127d1d4-cme0dbd127d1d2.cpe.net.cable.rogers.com.65116: Flags [P.], seq 31124:31336, ack 1, win 501, length 212
06:00:04.545260 IP lamp-ubuntu-s-1vcpu-1gb-tor1-01.ssh > cpee0dbd127d1d4-cme0dbd127d1d2.cpe.net.cable.rogers.com.65116: Flags [P.], seq 31336:31548, ack 1, win 501, length 212
06:00:04.545366 IP lamp-ubuntu-s-1vcpu-1gb-tor1-01.ssh > cpee0dbd127d1d4-cme0dbd127d1d2.cpe.net.cable.rogers.com.65116: Flags [P.], seq 31548:31760, ack 1, win 501, length 212
06:00:04.545462 IP lamp-ubuntu-s-1vcpu-1gb-tor1-01.ssh > cpee0dbd127d1d4-cme0dbd127d1d2.cpe.net.cable.rogers.com.65116: Flags [P.], seq 31760:31972, ack 1, win 501, length 212
06:00:04.545560 IP lamp-ubuntu-s-1vcpu-1gb-tor1-01.ssh > cpee0dbd127d1d4-cme0dbd127d1d2.cpe.net.cable.rogers.com.65116: Flags [P.], seq 31972:32184, ack 1, win 501, length 212
06:00:04.545664 IP lamp-ubuntu-s-1vcpu-1gb-tor1-01.ssh > cpee0dbd127d1d4-cme0dbd127d1d2.cpe.net.cable.rogers.com.65116: Flags [P.], seq 32184:32396, ack 1, win 501, length 212
06:00:04.545759 IP lamp-ubuntu-s-1vcpu-1gb-tor1-01.ssh > cpee0dbd127d1d4-cme0dbd127d1d2.cpe.net.cable.rogers.com.65116: Flags [P.], seq 32396:32608, ack 1, win 501, length 212
06:00:04.545902 IP lamp-ubuntu-s-1vcpu-1gb-tor1-01.ssh > cpee0dbd127d1d4-cme0dbd127d1d2.cpe.net.cable.rogers.com.65116: Flags [P.], seq 32608:32820, ack 1, win 501, length 212
06:00:04.546006 IP lamp-ubuntu-s-1vcpu-1gb-tor1-01.ssh > cpee0dbd127d1d4-cme0dbd127d1d2.cpe.net.cable.rogers.com.65116: Flags [P.], seq 32820:33032, ack 1, win 501, length 212
06:00:04.546076 IP cpee0dbd127d1d4-cme0dbd127d1d2.cpe.net.cable.rogers.com.65116 > lamp-ubuntu-s-1vcpu-1gb-tor1-01.ssh: Flags [.], ack 22908, win 510, length 0
06:00:04.546076 IP cpee0dbd127d1d4-cme0dbd127d1d2.cpe.net.cable.rogers.com.65116 > lamp-ubuntu-s-1vcpu-1gb-tor1-01.ssh: Flags [.], ack 25240, win 513, length 0
06:00:04.546226 IP lamp-ubuntu-s-1vcpu-1gb-tor1-01.ssh > cpee0dbd127d1d4-cme0dbd127d1d2.cpe.net.cable.rogers.com.65116: Flags [P.], seq 33032:33572, ack 1, win 501, length 540
06:00:04.546335 IP lamp-ubuntu-s-1vcpu-1gb-tor1-01.ssh > cpee0dbd127d1d4-cme0dbd127d1d2.cpe.net.cable.rogers.com.65116: Flags [P.], seq 33572:33784, ack 1, win 501, length 212
06:00:04.546441 IP lamp-ubuntu-s-1vcpu-1gb-tor1-01.ssh > cpee0dbd127d1d4-cme0dbd127d1d2.cpe.net.cable.rogers.com.65116: Flags [P.], seq 33784:33996, ack 1, win 501, length 212
06:00:04.546542 IP lamp-ubuntu-s-1vcpu-1gb-tor1-01.ssh > cpee0dbd127d1d4-cme0dbd127d1d2.cpe.net.cable.rogers.com.65116: Flags [P.], seq 33996:34208, ack 1, win 501, length 212
06:00:04.546644 IP lamp-ubuntu-s-1vcpu-1gb-tor1-01.ssh > cpee0dbd127d1d4-cme0dbd127d1d2.cpe.net.cable.rogers.com.65116: Flags [P.], seq 34208:34420, ack 1, win 501, length 212
06:00:04.546740 IP lamp-ubuntu-s-1vcpu-1gb-tor1-01.ssh > cpee0dbd127d1d4-cme0dbd127d1d2.cpe.net.cable.rogers.com.65116: Flags [P.], seq 34420:34632, ack 1, win 501, length 212
06:00:04.546836 IP lamp-ubuntu-s-1vcpu-1gb-tor1-01.ssh > cpee0dbd127d1d4-cme0dbd127d1d2.cpe.net.cable.rogers.com.65116: Flags [P.], seq 34632:34844, ack 1, win 501, length 212
06:00:04.546939 IP lamp-ubuntu-s-1vcpu-1gb-tor1-01.ssh > cpee0dbd127d1d4-cme0dbd127d1d2.cpe.net.cable.rogers.com.65116: Flags [P.], seq 34844:35056, ack 1, win 501, length 212
06:00:04.547052 IP lamp-ubuntu-s-1vcpu-1gb-tor1-01.ssh > cpee0dbd127d1d4-cme0dbd127d1d2.cpe.net.cable.rogers.com.65116: Flags [P.], seq 35056:35268, ack 1, win 501, length 212
06:00:04.547151 IP lamp-ubuntu-s-1vcpu-1gb-tor1-01.ssh > cpee0dbd127d1d4-cme0dbd127d1d2.cpe.net.cable.rogers.com.65116: Flags [P.], seq 35268:35480, ack 1, win 501, length 212
06:00:04.547248 IP lamp-ubuntu-s-1vcpu-1gb-tor1-01.ssh > cpee0dbd127d1d4-cme0dbd127d1d2.cpe.net.cable.rogers.com.65116: Flags [P.], seq 35480:35692, ack 1, win 501, length 212
06:00:04.547351 IP lamp-ubuntu-s-1vcpu-1gb-tor1-01.ssh > cpee0dbd127d1d4-cme0dbd127d1d2.cpe.net.cable.rogers.com.65116: Flags [P.], seq 35692:35904, ack 1, win 501, length 212
06:00:04.547447 IP lamp-ubuntu-s-1vcpu-1gb-tor1-01.ssh > cpee0dbd127d1d4-cme0dbd127d1d2.cpe.net.cable.rogers.com.65116: Flags [P.], seq 35904:36116, ack 1, win 501, length 212
06:00:04.547552 IP lamp-ubuntu-s-1vcpu-1gb-tor1-01.ssh > cpee0dbd127d1d4-cme0dbd127d1d2.cpe.net.cable.rogers.com.65116: Flags [P.], seq 36116:36328, ack 1, win 501, length 212
06:00:04.547647 IP lamp-ubuntu-s-1vcpu-1gb-tor1-01.ssh > cpee0dbd127d1d4-cme0dbd127d1d2.cpe.net.cable.rogers.com.65116: Flags [P.], seq 36328:36540, ack 1, win 501, length 212
06:00:04.547751 IP lamp-ubuntu-s-1vcpu-1gb-tor1-01.ssh > cpee0dbd127d1d4-cme0dbd127d1d2.cpe.net.cable.rogers.com.65116: Flags [P.], seq 36540:36752, ack 1, win 501, length 212
06:00:04.547861 IP lamp-ubuntu-s-1vcpu-1gb-tor1-01.ssh > cpee0dbd127d1d4-cme0dbd127d1d2.cpe.net.cable.rogers.com.65116: Flags [P.], seq 36752:36964, ack 1, win 501, length 212
06:00:04.547961 IP lamp-ubuntu-s-1vcpu-1gb-tor1-01.ssh > cpee0dbd127d1d4-cme0dbd127d1d2.cpe.net.cable.rogers.com.65116: Flags [P.], seq 36964:37176, ack 1, win 501, length 212
06:00:04.548056 IP lamp-ubuntu-s-1vcpu-1gb-tor1-01.ssh > cpee0dbd127d1d4-cme0dbd127d1d2.cpe.net.cable.rogers.com.65116: Flags [P.], seq 37176:37388, ack 1, win 501, length 212
06:00:04.548151 IP lamp-ubuntu-s-1vcpu-1gb-tor1-01.ssh > cpee0dbd127d1d4-cme0dbd127d1d2.cpe.net.cable.rogers.com.65116: Flags [P.], seq 37388:37600, ack 1, win 501, length 212
06:00:04.548274 IP lamp-ubuntu-s-1vcpu-1gb-tor1-01.ssh > cpee0dbd127d1d4-cme0dbd127d1d2.cpe.net.cable.rogers.com.65116: Flags [P.], seq 37600:37812, ack 1, win 501, length 212
06:00:04.548382 IP lamp-ubuntu-s-1vcpu-1gb-tor1-01.ssh > cpee0dbd127d1d4-cme0dbd127d1d2.cpe.net.cable.rogers.com.65116: Flags [P.], seq 37812:38024, ack 1, win 501, length 212
06:00:04.548477 IP lamp-ubuntu-s-1vcpu-1gb-tor1-01.ssh > cpee0dbd127d1d4-cme0dbd127d1d2.cpe.net.cable.rogers.com.65116: Flags [P.], seq 38024:38236, ack 1, win 501, length 212
06:00:04.548580 IP lamp-ubuntu-s-1vcpu-1gb-tor1-01.ssh > cpee0dbd127d1d4-cme0dbd127d1d2.cpe.net.cable.rogers.com.65116: Flags [P.], seq 38236:38448, ack 1, win 501, length 212
06:00:04.548676 IP lamp-ubuntu-s-1vcpu-1gb-tor1-01.ssh > cpee0dbd127d1d4-cme0dbd127d1d2.cpe.net.cable.rogers.com.65116: Flags [P.], seq 38448:38660, ack 1, win 501, length 212
06:00:04.548779 IP lamp-ubuntu-s-1vcpu-1gb-tor1-01.ssh > cpee0dbd127d1d4-cme0dbd127d1d2.cpe.net.cable.rogers.com.65116: Flags [P.], seq 38660:38872, ack 1, win 501, length 212
06:00:04.548874 IP lamp-ubuntu-s-1vcpu-1gb-tor1-01.ssh > cpee0dbd127d1d4-cme0dbd127d1d2.cpe.net.cable.rogers.com.65116: Flags [P.], seq 38872:39084, ack 1, win 501, length 212
06:00:04.548987 IP lamp-ubuntu-s-1vcpu-1gb-tor1-01.ssh > cpee0dbd127d1d4-cme0dbd127d1d2.cpe.net.cable.rogers.com.65116: Flags [P.], seq 39084:39296, ack 1, win 501, length 212
06:00:04.549092 IP lamp-ubuntu-s-1vcpu-1gb-tor1-01.ssh > cpee0dbd127d1d4-cme0dbd127d1d2.cpe.net.cable.rogers.com.65116: Flags [P.], seq 39296:39508, ack 1, win 501, length 212
06:00:04.549188 IP lamp-ubuntu-s-1vcpu-1gb-tor1-01.ssh > cpee0dbd127d1d4-cme0dbd127d1d2.cpe.net.cable.rogers.com.65116: Flags [P.], seq 39508:39720, ack 1, win 501, length 212
06:00:04.549285 IP lamp-ubuntu-s-1vcpu-1gb-tor1-01.ssh > cpee0dbd127d1d4-cme0dbd127d1d2.cpe.net.cable.rogers.com.65116: Flags [P.], seq 39720:39932, ack 1, win 501, length 212
06:00:04.549384 IP lamp-ubuntu-s-1vcpu-1gb-tor1-01.ssh > cpee0dbd127d1d4-cme0dbd127d1d2.cpe.net.cable.rogers.com.65116: Flags [P.], seq 39932:40144, ack 1, win 501, length 212
06:00:04.549483 IP lamp-ubuntu-s-1vcpu-1gb-tor1-01.ssh > cpee0dbd127d1d4-cme0dbd127d1d2.cpe.net.cable.rogers.com.65116: Flags [P.], seq 40144:40356, ack 1, win 501, length 212
06:00:04.549583 IP lamp-ubuntu-s-1vcpu-1gb-tor1-01.ssh > cpee0dbd127d1d4-cme0dbd127d1d2.cpe.net.cable.rogers.com.65116: Flags [P.], seq 40356:40568, ack 1, win 501, length 212
06:00:04.549686 IP lamp-ubuntu-s-1vcpu-1gb-tor1-01.ssh > cpee0dbd127d1d4-cme0dbd127d1d2.cpe.net.cable.rogers.com.65116: Flags [P.], seq 40568:40780, ack 1, win 501, length 212
06:00:04.549781 IP lamp-ubuntu-s-1vcpu-1gb-tor1-01.ssh > cpee0dbd127d1d4-cme0dbd127d1d2.cpe.net.cable.rogers.com.65116: Flags [P.], seq 40780:40992, ack 1, win 501, length 212
06:00:04.549899 IP lamp-ubuntu-s-1vcpu-1gb-tor1-01.ssh > cpee0dbd127d1d4-cme0dbd127d1d2.cpe.net.cable.rogers.com.65116: Flags [P.], seq 40992:41204, ack 1, win 501, length 212
06:00:04.550008 IP lamp-ubuntu-s-1vcpu-1gb-tor1-01.ssh > cpee0dbd127d1d4-cme0dbd127d1d2.cpe.net.cable.rogers.com.65116: Flags [P.], seq 41204:41416, ack 1, win 501, length 212
06:00:04.550107 IP lamp-ubuntu-s-1vcpu-1gb-tor1-01.ssh > cpee0dbd127d1d4-cme0dbd127d1d2.cpe.net.cable.rogers.com.65116: Flags [P.], seq 41416:41628, ack 1, win 501, length 212
06:00:04.550205 IP lamp-ubuntu-s-1vcpu-1gb-tor1-01.ssh > cpee0dbd127d1d4-cme0dbd127d1d2.cpe.net.cable.rogers.com.65116: Flags [P.], seq 41628:41840, ack 1, win 501, length 212
06:00:04.550301 IP lamp-ubuntu-s-1vcpu-1gb-tor1-01.ssh > cpee0dbd127d1d4-cme0dbd127d1d2.cpe.net.cable.rogers.com.65116: Flags [P.], seq 41840:42052, ack 1, win 501, length 212
06:00:04.550418 IP lamp-ubuntu-s-1vcpu-1gb-tor1-01.ssh > cpee0dbd127d1d4-cme0dbd127d1d2.cpe.net.cable.rogers.com.65116: Flags [P.], seq 42052:42264, ack 1, win 501, length 212
06:00:04.550518 IP lamp-ubuntu-s-1vcpu-1gb-tor1-01.ssh > cpee0dbd127d1d4-cme0dbd127d1d2.cpe.net.cable.rogers.com.65116: Flags [P.], seq 42264:42476, ack 1, win 501, length 212
06:00:04.550581 IP cpee0dbd127d1d4-cme0dbd127d1d2.cpe.net.cable.rogers.com.65116 > lamp-ubuntu-s-1vcpu-1gb-tor1-01.ssh: Flags [P.], seq 1:37, ack 25240, win 513, length 36
06:00:04.550581 IP cpee0dbd127d1d4-cme0dbd127d1d2.cpe.net.cable.rogers.com.65116 > lamp-ubuntu-s-1vcpu-1gb-tor1-01.ssh: Flags [.], ack 31336, win 513, length 0
06:00:04.550736 IP lamp-ubuntu-s-1vcpu-1gb-tor1-01.ssh > cpee0dbd127d1d4-cme0dbd127d1d2.cpe.net.cable.rogers.com.65116: Flags [P.], seq 42476:43024, ack 37, win 501, length 548
06:00:04.550843 IP lamp-ubuntu-s-1vcpu-1gb-tor1-01.ssh > cpee0dbd127d1d4-cme0dbd127d1d2.cpe.net.cable.rogers.com.65116: Flags [P.], seq 43024:43236, ack 37, win 501, length 212
06:00:04.550941 IP lamp-ubuntu-s-1vcpu-1gb-tor1-01.ssh > cpee0dbd127d1d4-cme0dbd127d1d2.cpe.net.cable.rogers.com.65116: Flags [P.], seq 43236:43448, ack 37, win 501, length 212
06:00:04.551043 IP lamp-ubuntu-s-1vcpu-1gb-tor1-01.ssh > cpee0dbd127d1d4-cme0dbd127d1d2.cpe.net.cable.rogers.com.65116: Flags [P.], seq 43448:43660, ack 37, win 501, length 212
06:00:04.551138 IP lamp-ubuntu-s-1vcpu-1gb-tor1-01.ssh > cpee0dbd127d1d4-cme0dbd127d1d2.cpe.net.cable.rogers.com.65116: Flags [P.], seq 43660:43872, ack 37, win 501, length 212
06:00:04.551237 IP lamp-ubuntu-s-1vcpu-1gb-tor1-01.ssh > cpee0dbd127d1d4-cme0dbd127d1d2.cpe.net.cable.rogers.com.65116: Flags [P.], seq 43872:44084, ack 37, win 501, length 212
06:00:04.551333 IP lamp-ubuntu-s-1vcpu-1gb-tor1-01.ssh > cpee0dbd127d1d4-cme0dbd127d1d2.cpe.net.cable.rogers.com.65116: Flags [P.], seq 44084:44296, ack 37, win 501, length 212
06:00:04.551434 IP lamp-ubuntu-s-1vcpu-1gb-tor1-01.ssh > cpee0dbd127d1d4-cme0dbd127d1d2.cpe.net.cable.rogers.com.65116: Flags [P.], seq 44296:44508, ack 37, win 501, length 212
06:00:04.551529 IP lamp-ubuntu-s-1vcpu-1gb-tor1-01.ssh > cpee0dbd127d1d4-cme0dbd127d1d2.cpe.net.cable.rogers.com.65116: Flags [P.], seq 44508:44720, ack 37, win 501, length 212
06:00:04.551623 IP lamp-ubuntu-s-1vcpu-1gb-tor1-01.ssh > cpee0dbd127d1d4-cme0dbd127d1d2.cpe.net.cable.rogers.com.65116: Flags [P.], seq 44720:44932, ack 37, win 501, length 212
06:00:04.551726 IP lamp-ubuntu-s-1vcpu-1gb-tor1-01.ssh > cpee0dbd127d1d4-cme0dbd127d1d2.cpe.net.cable.rogers.com.65116: Flags [P.], seq 44932:45144, ack 37, win 501, length 212
06:00:04.551835 IP lamp-ubuntu-s-1vcpu-1gb-tor1-01.ssh > cpee0dbd127d1d4-cme0dbd127d1d2.cpe.net.cable.rogers.com.65116: Flags [P.], seq 45144:45356, ack 37, win 501, length 212
06:00:04.551938 IP lamp-ubuntu-s-1vcpu-1gb-tor1-01.ssh > cpee0dbd127d1d4-cme0dbd127d1d2.cpe.net.cable.rogers.com.65116: Flags [P.], seq 45356:45568, ack 37, win 501, length 212
06:00:04.552032 IP lamp-ubuntu-s-1vcpu-1gb-tor1-01.ssh > cpee0dbd127d1d4-cme0dbd127d1d2.cpe.net.cable.rogers.com.65116: Flags [P.], seq 45568:45780, ack 37, win 501, length 212
06:00:04.552131 IP lamp-ubuntu-s-1vcpu-1gb-tor1-01.ssh > cpee0dbd127d1d4-cme0dbd127d1d2.cpe.net.cable.rogers.com.65116: Flags [P.], seq 45780:45992, ack 37, win 501, length 212
06:00:04.552245 IP lamp-ubuntu-s-1vcpu-1gb-tor1-01.ssh > cpee0dbd127d1d4-cme0dbd127d1d2.cpe.net.cable.rogers.com.65116: Flags [P.], seq 45992:46204, ack 37, win 501, length 212
06:00:04.552345 IP lamp-ubuntu-s-1vcpu-1gb-tor1-01.ssh > cpee0dbd127d1d4-cme0dbd127d1d2.cpe.net.cable.rogers.com.65116: Flags [P.], seq 46204:46416, ack 37, win 501, length 212
06:00:04.552442 IP lamp-ubuntu-s-1vcpu-1gb-tor1-01.ssh > cpee0dbd127d1d4-cme0dbd127d1d2.cpe.net.cable.rogers.com.65116: Flags [P.], seq 46416:46628, ack 37, win 501, length 212
06:00:04.552538 IP lamp-ubuntu-s-1vcpu-1gb-tor1-01.ssh > cpee0dbd127d1d4-cme0dbd127d1d2.cpe.net.cable.rogers.com.65116: Flags [P.], seq 46628:46840, ack 37, win 501, length 212
06:00:04.552634 IP lamp-ubuntu-s-1vcpu-1gb-tor1-01.ssh > cpee0dbd127d1d4-cme0dbd127d1d2.cpe.net.cable.rogers.com.65116: Flags [P.], seq 46840:47052, ack 37, win 501, length 212
06:00:04.552729 IP lamp-ubuntu-s-1vcpu-1gb-tor1-01.ssh > cpee0dbd127d1d4-cme0dbd127d1d2.cpe.net.cable.rogers.com.65116: Flags [P.], seq 47052:47264, ack 37, win 501, length 212
06:00:04.552830 IP lamp-ubuntu-s-1vcpu-1gb-tor1-01.ssh > cpee0dbd127d1d4-cme0dbd127d1d2.cpe.net.cable.rogers.com.65116: Flags [P.], seq 47264:47476, ack 37, win 501, length 212
06:00:04.552934 IP lamp-ubuntu-s-1vcpu-1gb-tor1-01.ssh > cpee0dbd127d1d4-cme0dbd127d1d2.cpe.net.cable.rogers.com.65116: Flags [P.], seq 47476:47688, ack 37, win 501, length 212
06:00:04.553041 IP lamp-ubuntu-s-1vcpu-1gb-tor1-01.ssh > cpee0dbd127d1d4-cme0dbd127d1d2.cpe.net.cable.rogers.com.65116: Flags [P.], seq 47688:47900, ack 37, win 501, length 212
06:00:04.553137 IP lamp-ubuntu-s-1vcpu-1gb-tor1-01.ssh > cpee0dbd127d1d4-cme0dbd127d1d2.cpe.net.cable.rogers.com.65116: Flags [P.], seq 47900:48112, ack 37, win 501, length 212
06:00:04.553233 IP lamp-ubuntu-s-1vcpu-1gb-tor1-01.ssh > cpee0dbd127d1d4-cme0dbd127d1d2.cpe.net.cable.rogers.com.65116: Flags [P.], seq 48112:48324, ack 37, win 501, length 212
06:00:04.553327 IP lamp-ubuntu-s-1vcpu-1gb-tor1-01.ssh > cpee0dbd127d1d4-cme0dbd127d1d2.cpe.net.cable.rogers.com.65116: Flags [P.], seq 48324:48536, ack 37, win 501, length 212
06:00:04.553424 IP lamp-ubuntu-s-1vcpu-1gb-tor1-01.ssh > cpee0dbd127d1d4-cme0dbd127d1d2.cpe.net.cable.rogers.com.65116: Flags [P.], seq 48536:48748, ack 37, win 501, length 212
06:00:04.553523 IP lamp-ubuntu-s-1vcpu-1gb-tor1-01.ssh > cpee0dbd127d1d4-cme0dbd127d1d2.cpe.net.cable.rogers.com.65116: Flags [P.], seq 48748:48960, ack 37, win 501, length 212
06:00:04.553620 IP lamp-ubuntu-s-1vcpu-1gb-tor1-01.ssh > cpee0dbd127d1d4-cme0dbd127d1d2.cpe.net.cable.rogers.com.65116: Flags [P.], seq 48960:49172, ack 37, win 501, length 212
06:00:04.553717 IP lamp-ubuntu-s-1vcpu-1gb-tor1-01.ssh > cpee0dbd127d1d4-cme0dbd127d1d2.cpe.net.cable.rogers.com.65116: Flags [P.], seq 49172:49384, ack 37, win 501, length 212
06:00:04.553830 IP lamp-ubuntu-s-1vcpu-1gb-tor1-01.ssh > cpee0dbd127d1d4-cme0dbd127d1d2.cpe.net.cable.rogers.com.65116: Flags [P.], seq 49384:49596, ack 37, win 501, length 212
