05:58:47.883162 IP 143.110.210.251.22 > 99.226.233.187.65116: Flags [P.], seq 322300:322464, ack 145, win 501, length 164
05:58:47.883243 IP 143.110.210.251.22 > 99.226.233.187.65116: Flags [P.], seq 322464:322628, ack 145, win 501, length 164
05:58:47.883329 IP 143.110.210.251.22 > 99.226.233.187.65116: Flags [P.], seq 322628:322792, ack 145, win 501, length 164
05:58:47.883409 IP 143.110.210.251.22 > 99.226.233.187.65116: Flags [P.], seq 322792:322956, ack 145, win 501, length 164
05:58:47.883495 IP 143.110.210.251.22 > 99.226.233.187.65116: Flags [P.], seq 322956:323120, ack 145, win 501, length 164
05:58:47.883575 IP 143.110.210.251.22 > 99.226.233.187.65116: Flags [P.], seq 323120:323284, ack 145, win 501, length 164
05:58:47.883660 IP 143.110.210.251.22 > 99.226.233.187.65116: Flags [P.], seq 323284:323448, ack 145, win 501, length 164
05:58:47.883748 IP 143.110.210.251.22 > 99.226.233.187.65116: Flags [P.], seq 323448:323612, ack 145, win 501, length 164
05:58:47.883832 IP 143.110.210.251.22 > 99.226.233.187.65116: Flags [P.], seq 323612:323776, ack 145, win 501, length 164
05:58:47.883915 IP 143.110.210.251.22 > 99.226.233.187.65116: Flags [P.], seq 323776:323940, ack 145, win 501, length 164
05:58:47.884001 IP 143.110.210.251.22 > 99.226.233.187.65116: Flags [P.], seq 323940:324104, ack 145, win 501, length 164
05:58:47.884082 IP 143.110.210.251.22 > 99.226.233.187.65116: Flags [P.], seq 324104:324268, ack 145, win 501, length 164
05:58:47.884163 IP 143.110.210.251.22 > 99.226.233.187.65116: Flags [P.], seq 324268:324432, ack 145, win 501, length 164
05:58:47.884273 IP 143.110.210.251.22 > 99.226.233.187.65116: Flags [P.], seq 324432:324596, ack 145, win 501, length 164
05:58:47.884358 IP 143.110.210.251.22 > 99.226.233.187.65116: Flags [P.], seq 324596:324760, ack 145, win 501, length 164
05:58:47.884443 IP 143.110.210.251.22 > 99.226.233.187.65116: Flags [P.], seq 324760:324924, ack 145, win 501, length 164
05:58:47.884527 IP 99.226.233.187.65116 > 143.110.210.251.22: Flags [.], ack 306780, win 513, length 0
05:58:47.884612 IP 143.110.210.251.22 > 99.226.233.187.65116: Flags [P.], seq 324924:325088, ack 145, win 501, length 164
05:58:47.884694 IP 143.110.210.251.22 > 99.226.233.187.65116: Flags [P.], seq 325088:325228, ack 145, win 501, length 140
05:58:47.884771 IP 143.110.210.251.22 > 99.226.233.187.65116: Flags [P.], seq 325228:325392, ack 145, win 501, length 164
05:58:47.884845 IP 143.110.210.251.22 > 99.226.233.187.65116: Flags [P.], seq 325392:325556, ack 145, win 501, length 164
05:58:47.884921 IP 143.110.210.251.22 > 99.226.233.187.65116: Flags [P.], seq 325556:325720, ack 145, win 501, length 164
05:58:47.884997 IP 143.110.210.251.22 > 99.226.233.187.65116: Flags [P.], seq 325720:325884, ack 145, win 501, length 164
05:58:47.885073 IP 143.110.210.251.22 > 99.226.233.187.65116: Flags [P.], seq 325884:326048, ack 145, win 501, length 164
05:58:47.885147 IP 143.110.210.251.22 > 99.226.233.187.65116: Flags [P.], seq 326048:326212, ack 145, win 501, length 164
05:58:47.885222 IP 143.110.210.251.22 > 99.226.233.187.65116: Flags [P.], seq 326212:326376, ack 145, win 501, length 164
05:58:47.885298 IP 143.110.210.251.22 > 99.226.233.187.65116: Flags [P.], seq 326376:326540, ack 145, win 501, length 164
05:58:47.885385 IP 143.110.210.251.22 > 99.226.233.187.65116: Flags [P.], seq 326540:326868, ack 145, win 501, length 328
05:58:47.885467 IP 143.110.210.251.22 > 99.226.233.187.65116: Flags [P.], seq 326868:327032, ack 145, win 501, length 164
05:58:47.885549 IP 143.110.210.251.22 > 99.226.233.187.65116: Flags [P.], seq 327032:327196, ack 145, win 501, length 164
05:58:47.885631 IP 143.110.210.251.22 > 99.226.233.187.65116: Flags [P.], seq 327196:327360, ack 145, win 501, length 164
05:58:47.885712 IP 143.110.210.251.22 > 99.226.233.187.65116: Flags [P.], seq 327360:327524, ack 145, win 501, length 164
05:58:47.885818 IP 143.110.210.251.22 > 99.226.233.187.65116: Flags [P.], seq 327524:327688, ack 145, win 501, length 164
05:58:47.885904 IP 143.110.210.251.22 > 99.226.233.187.65116: Flags [P.], seq 327688:327852, ack 145, win 501, length 164
05:58:47.886004 IP 143.110.210.251.22 > 99.226.233.187.65116: Flags [P.], seq 327852:328016, ack 145, win 501, length 164
05:58:47.886088 IP 143.110.210.251.22 > 99.226.233.187.65116: Flags [P.], seq 328016:328180, ack 145, win 501, length 164
05:58:47.886171 IP 143.110.210.251.22 > 99.226.233.187.65116: Flags [P.], seq 328180:328344, ack 145, win 501, length 164
05:58:47.886254 IP 143.110.210.251.22 > 99.226.233.187.65116: Flags [P.], seq 328344:328508, ack 145, win 501, length 164
05:58:47.886335 IP 143.110.210.251.22 > 99.226.233.187.65116: Flags [P.], seq 328508:328672, ack 145, win 501, length 164
05:58:47.886418 IP 143.110.210.251.22 > 99.226.233.187.65116: Flags [P.], seq 328672:328836, ack 145, win 501, length 164
05:58:47.886500 IP 143.110.210.251.22 > 99.226.233.187.65116: Flags [P.], seq 328836:329000, ack 145, win 501, length 164
05:58:47.886581 IP 143.110.210.251.22 > 99.226.233.187.65116: Flags [P.], seq 329000:329164, ack 145, win 501, length 164
05:58:47.886664 IP 143.110.210.251.22 > 99.226.233.187.65116: Flags [P.], seq 329164:329328, ack 145, win 501, length 164
05:58:47.886751 IP 143.110.210.251.22 > 99.226.233.187.65116: Flags [P.], seq 329328:329492, ack 145, win 501, length 164
05:58:47.886832 IP 143.110.210.251.22 > 99.226.233.187.65116: Flags [P.], seq 329492:329656, ack 145, win 501, length 164
05:58:47.886917 IP 143.110.210.251.22 > 99.226.233.187.65116: Flags [P.], seq 329656:329820, ack 145, win 501, length 164
05:58:47.886998 IP 143.110.210.251.22 > 99.226.233.187.65116: Flags [P.], seq 329820:329984, ack 145, win 501, length 164
05:58:47.887081 IP 143.110.210.251.22 > 99.226.233.187.65116: Flags [P.], seq 329984:330148, ack 145, win 501, length 164
05:58:47.887162 IP 143.110.210.251.22 > 99.226.233.187.65116: Flags [P.], seq 330148:330312, ack 145, win 501, length 164
05:58:47.887241 IP 143.110.210.251.22 > 99.226.233.187.65116: Flags [P.], seq 330312:330476, ack 145, win 501, length 164
05:58:47.887322 IP 143.110.210.251.22 > 99.226.233.187.65116: Flags [P.], seq 330476:330640, ack 145, win 501, length 164
05:58:47.887408 IP 143.110.210.251.22 > 99.226.233.187.65116: Flags [P.], seq 330640:330804, ack 145, win 501, length 164
05:58:47.887655 IP 143.110.210.251.22 > 99.226.233.187.65116: Flags [P.], seq 330804:330968, ack 145, win 501, length 164
05:58:47.887750 IP 143.110.210.251.22 > 99.226.233.187.65116: Flags [P.], seq 330968:331132, ack 145, win 501, length 164
05:58:47.887883 IP 143.110.210.251.22 > 99.226.233.187.65116: Flags [P.], seq 331132:331296, ack 145, win 501, length 164
05:58:47.888003 IP 143.110.210.251.22 > 99.226.233.187.65116: Flags [P.], seq 331296:331460, ack 145, win 501, length 164
05:58:47.888095 IP 143.110.210.251.22 > 99.226.233.187.65116: Flags [P.], seq 331460:331624, ack 145, win 501, length 164
05:58:47.888186 IP 143.110.210.251.22 > 99.226.233.187.65116: Flags [P.], seq 331624:331788, ack 145, win 501, length 164
05:58:47.888288 IP 143.110.210.251.22 > 99.226.233.187.65116: Flags [P.], seq 331788:331952, ack 145, win 501, length 164
05:58:47.888378 IP 143.110.210.251.22 > 99.226.233.187.65116: Flags [P.], seq 331952:332116, ack 145, win 501, length 164
05:58:47.888461 IP 143.110.210.251.22 > 99.226.233.187.65116: Flags [P.], seq 332116:332280, ack 145, win 501, length 164
05:58:47.888548 IP 143.110.210.251.22 > 99.226.233.187.65116: Flags [P.], seq 332280:332444, ack 145, win 501, length 164
05:58:47.888571 IP 99.226.233.187.65116 > 143.110.210.251.22: Flags [.], ack 309404, win 510, length 0
05:58:47.888571 IP 99.226.233.187.65116 > 143.110.210.251.22: Flags [.], ack 320496, win 511, length 0
05:58:47.888724 IP 143.110.210.251.22 > 99.226.233.187.65116: Flags [P.], seq 332444:332816, ack 145, win 501, length 372
05:58:47.888811 IP 143.110.210.251.22 > 99.226.233.187.65116: Flags [P.], seq 332816:332980, ack 145, win 501, length 164
05:58:47.888893 IP 143.110.210.251.22 > 99.226.233.187.65116: Flags [P.], seq 332980:333144, ack 145, win 501, length 164
05:58:47.888977 IP 143.110.210.251.22 > 99.226.233.187.65116: Flags [P.], seq 333144:333308, ack 145, win 501, length 164
05:58:47.889057 IP 143.110.210.251.22 > 99.226.233.187.65116: Flags [P.], seq 333308:333472, ack 145, win 501, length 164
05:58:47.889137 IP 143.110.210.251.22 > 99.226.233.187.65116: Flags [P.], seq 333472:333636, ack 145, win 501, length 164
05:58:47.889217 IP 143.110.210.251.22 > 99.226.233.187.65116: Flags [P.], seq 333636:333800, ack 145, win 501, length 164
05:58:47.889303 IP 143.110.210.251.22 > 99.226.233.187.65116: Flags [P.], seq 333800:333964, ack 145, win 501, length 164
05:58:47.889384 IP 143.110.210.251.22 > 99.226.233.187.65116: Flags [P.], seq 333964:334128, ack 145, win 501, length 164
05:58:47.889471 IP 143.110.210.251.22 > 99.226.233.187.65116: Flags [P.], seq 334128:334292, ack 145, win 501, length 164
05:58:47.889554 IP 143.110.210.251.22 > 99.226.233.187.65116: Flags [P.], seq 334292:334456, ack 145, win 501, length 164
05:58:47.889641 IP 143.110.210.251.22 > 99.226.233.187.65116: Flags [P.], seq 334456:334620, ack 145, win 501, length 164
05:58:47.889723 IP 143.110.210.251.22 > 99.226.233.187.65116: Flags [P.], seq 334620:334784, ack 145, win 501, length 164
05:58:47.889823 IP 143.110.210.251.22 > 99.226.233.187.65116: Flags [P.], seq 334784:334948, ack 145, win 501, length 164
05:58:47.889911 IP 143.110.210.251.22 > 99.226.233.187.65116: Flags [P.], seq 334948:335112, ack 145, win 501, length 164
05:58:47.890007 IP 143.110.210.251.22 > 99.226.233.187.65116: Flags [P.], seq 335112:335276, ack 145, win 501, length 164
05:58:47.890121 IP 143.110.210.251.22 > 99.226.233.187.65116: Flags [P.], seq 335276:335440, ack 145, win 501, length 164
05:58:47.890244 IP 143.110.210.251.22 > 99.226.233.187.65116: Flags [P.], seq 335440:335604, ack 145, win 501, length 164
05:58:47.890333 IP 143.110.210.251.22 > 99.226.233.187.65116: Flags [P.], seq 335604:335768, ack 145, win 501, length 164
05:58:47.890420 IP 143.110.210.251.22 > 99.226.233.187.65116: Flags [P.], seq 335768:335932, ack 145, win 501, length 164
05:58:47.890504 IP 143.110.210.251.22 > 99.226.233.187.65116: Flags [P.], seq 335932:336096, ack 145, win 501, length 164
05:58:47.890592 IP 143.110.210.251.22 > 99.226.233.187.65116: Flags [P.], seq 336096:336260, ack 145, win 501, length 164
05:58:47.890674 IP 143.110.210.251.22 > 99.226.233.187.65116: Flags [P.], seq 336260:336424, ack 145, win 501, length 164
05:58:47.890761 IP 143.110.210.251.22 > 99.226.233.187.65116: Flags [P.], seq 336424:336588, ack 145, win 501, length 164
05:58:47.890843 IP 143.110.210.251.22 > 99.226.233.187.65116: Flags [P.], seq 336588:336752, ack 145, win 501, length 164
05:58:47.890926 IP 143.110.210.251.22 > 99.226.233.187.65116: Flags [P.], seq 336752:336916, ack 145, win 501, length 164
05:58:47.891013 IP 143.110.210.251.22 > 99.226.233.187.65116: Flags [P.], seq 336916:337080, ack 145, win 501, length 164
05:58:47.891098 IP 143.110.210.251.22 > 99.226.233.187.65116: Flags [P.], seq 337080:337244, ack 145, win 501, length 164
05:58:47.891178 IP 143.110.210.251.22 > 99.226.233.187.65116: Flags [P.], seq 337244:337408, ack 145, win 501, length 164
05:58:47.891258 IP 143.110.210.251.22 > 99.226.233.187.65116: Flags [P.], seq 337408:337572, ack 145, win 501, length 164
05:58:47.891353 IP 143.110.210.251.22 > 99.226.233.187.65116: Flags [P.], seq 337572:337736, ack 145, win 501, length 164
05:58:47.891437 IP 143.110.210.251.22 > 99.226.233.187.65116: Flags [P.], seq 337736:337900, ack 145, win 501, length 164
05:58:47.891524 IP 143.110.210.251.22 > 99.226.233.187.65116: Flags [P.], seq 337900:338064, ack 145, win 501, length 164
05:58:47.891605 IP 143.110.210.251.22 > 99.226.233.187.65116: Flags [P.], seq 338064:338228, ack 145, win 501, length 164
05:58:47.891731 IP 143.110.210.251.22 > 99.226.233.187.65116: Flags [P.], seq 338228:338392, ack 145, win 501, length 164
05:58:47.891827 IP 143.110.210.251.22 > 99.226.233.187.65116: Flags [P.], seq 338392:338556, ack 145, win 501, length 164
05:58:47.891916 IP 143.110.210.251.22 > 99.226.233.187.65116: Flags [P.], seq 338556:338720, ack 145, win 501, length 164
05:58:47.891997 IP 143.110.210.251.22 > 99.226.233.187.65116: Flags [P.], seq 338720:338884, ack 145, win 501, length 164
05:58:47.892078 IP 143.110.210.251.22 > 99.226.233.187.65116: Flags [P.], seq 338884:339048, ack 145, win 501, length 164
05:58:47.892163 IP 143.110.210.251.22 > 99.226.233.187.65116: Flags [P.], seq 339048:339212, ack 145, win 501, length 164
05:58:47.892247 IP 99.226.233.187.65116 > 143.110.210.251.22: Flags [P.], seq 145:181, ack 308584, win 513, length 36
05:58:47.892247 IP 99.226.233.187.65116 > 143.110.210.251.22: Flags [.], ack 328344, win 509, length 0
05:58:47.892368 IP 143.110.210.251.22 > 99.226.233.187.65116: Flags [P.], seq 339212:339592, ack 181, win 501, length 380
05:58:47.892462 IP 143.110.210.251.22 > 99.226.233.187.65116: Flags [P.], seq 339592:339756, ack 181, win 501, length 164
05:58:47.892550 IP 143.110.210.251.22 > 99.226.233.187.65116: Flags [P.], seq 339756:339920, ack 181, win 501, length 164
05:58:47.892632 IP 143.110.210.251.22 > 99.226.233.187.65116: Flags [P.], seq 339920:340084, ack 181, win 501, length 164
05:58:47.892718 IP 143.110.210.251.22 > 99.226.233.187.65116: Flags [P.], seq 340084:340248, ack 181, win 501, length 164
05:58:47.892799 IP 143.110.210.251.22 > 99.226.233.187.65116: Flags [P.], seq 340248:340412, ack 181, win 501, length 164
05:58:47.892885 IP 143.110.210.251.22 > 99.226.233.187.65116: Flags [P.], seq 340412:340576, ack 181, win 501, length 164
05:58:47.892966 IP 143.110.210.251.22 > 99.226.233.187.65116: Flags [P.], seq 340576:340740, ack 181, win 501, length 164
05:58:47.893052 IP 143.110.210.251.22 > 99.226.233.187.65116: Flags [P.], seq 340740:340904, ack 181, win 501, length 164
05:58:47.893133 IP 143.110.210.251.22 > 99.226.233.187.65116: Flags [P.], seq 340904:341068, ack 181, win 501, length 164
05:58:47.893218 IP 143.110.210.251.22 > 99.226.233.187.65116: Flags [P.], seq 341068:341232, ack 181, win 501, length 164
05:58:47.893299 IP 143.110.210.251.22 > 99.226.233.187.65116: Flags [P.], seq 341232:341396, ack 181, win 501, length 164
05:58:47.893383 IP 143.110.210.251.22 > 99.226.233.187.65116: Flags [P.], seq 341396:341560, ack 181, win 501, length 164
05:58:47.893464 IP 143.110.210.251.22 > 99.226.233.187.65116: Flags [P.], seq 341560:341724, ack 181, win 501, length 164
05:58:47.893544 IP 143.110.210.251.22 > 99.226.233.187.65116: Flags [P.], seq 341724:341888, ack 181, win 501, length 164
05:58:47.893625 IP 143.110.210.251.22 > 99.226.233.187.65116: Flags [P.], seq 341888:342052, ack 181, win 501, length 164
05:58:47.893731 IP 143.110.210.251.22 > 99.226.233.187.65116: Flags [P.], seq 342052:342216, ack 181, win 501, length 164
05:58:47.893862 IP 143.110.210.251.22 > 99.226.233.187.65116: Flags [P.], seq 342216:342380, ack 181, win 501, length 164
05:58:47.893993 IP 143.110.210.251.22 > 99.226.233.187.65116: Flags [P.], seq 342380:342544, ack 181, win 501, length 164
05:58:47.894083 IP 143.110.210.251.22 > 99.226.233.187.65116: Flags [P.], seq 342544:342708, ack 181, win 501, length 164
05:58:47.894165 IP 143.110.210.251.22 > 99.226.233.187.65116: Flags [P.], seq 342708:342872, ack 181, win 501, length 164
05:58:47.894253 IP 143.110.210.251.22 > 99.226.233.187.65116: Flags [P.], seq 342872:343036, ack 181, win 501, length 164
05:58:47.894334 IP 143.110.210.251.22 > 99.226.233.187.65116: Flags [P.], seq 343036:343200, ack 181, win 501, length 164
05:58:47.894421 IP 143.110.210.251.22 > 99.226.233.187.65116: Flags [P.], seq 343200:343364, ack 181, win 501, length 164
05:58:47.894503 IP 143.110.210.251.22 > 99.226.233.187.65116: Flags [P.], seq 343364:343528, ack 181, win 501, length 164
05:58:47.894590 IP 143.110.210.251.22 > 99.226.233.187.65116: Flags [P.], seq 343528:343692, ack 181, win 501, length 164
05:58:47.894679 IP 143.110.210.251.22 > 99.226.233.187.65116: Flags [P.], seq 343692:343856, ack 181, win 501, length 164
05:58:47.894767 IP 143.110.210.251.22 > 99.226.233.187.65116: Flags [P.], seq 343856:344020, ack 181, win 501, length 164
05:58:47.894848 IP 143.110.210.251.22 > 99.226.233.187.65116: Flags [P.], seq 344020:344184, ack 181, win 501, length 164
05:58:47.894930 IP 143.110.210.251.22 > 99.226.233.187.65116: Flags [P.], seq 344184:344348, ack 181, win 501, length 164
05:58:47.895020 IP 143.110.210.251.22 > 99.226.233.187.65116: Flags [P.], seq 344348:344512, ack 181, win 501, length 164
05:58:47.895105 IP 143.110.210.251.22 > 99.226.233.187.65116: Flags [P.], seq 344512:344676, ack 181, win 501, length 164
05:58:47.895187 IP 143.110.210.251.22 > 99.226.233.187.65116: Flags [P.], seq 344676:344840, ack 181, win 501, length 164
05:58:47.895272 IP 143.110.210.251.22 > 99.226.233.187.65116: Flags [P.], seq 344840:345004, ack 181, win 501, length 164
05:58:47.895355 IP 143.110.210.251.22 > 99.226.233.187.65116: Flags [P.], seq 345004:345168, ack 181, win 501, length 164
05:58:47.895437 IP 143.110.210.251.22 > 99.226.233.187.65116: Flags [P.], seq 345168:345332, ack 181, win 501, length 164
05:58:47.895516 IP 143.110.210.251.22 > 99.226.233.187.65116: Flags [P.], seq 345332:345496, ack 181, win 501, length 164
05:58:47.895600 IP 143.110.210.251.22 > 99.226.233.187.65116: Flags [P.], seq 345496:345660, ack 181, win 501, length 164
05:58:47.895682 IP 143.110.210.251.22 > 99.226.233.187.65116: Flags [P.], seq 345660:345824, ack 181, win 501, length 164
05:58:47.895764 IP 143.110.210.251.22 > 99.226.233.187.65116: Flags [P.], seq 345824:345988, ack 181, win 501, length 164
05:58:47.895849 IP 143.110.210.251.22 > 99.226.233.187.65116: Flags [P.], seq 345988:346152, ack 181, win 501, length 164
05:58:47.895930 IP 143.110.210.251.22 > 99.226.233.187.65116: Flags [P.], seq 346152:346316, ack 181, win 501, length 164
05:58:47.896012 IP 143.110.210.251.22 > 99.226.233.187.65116: Flags [P.], seq 346316:346480, ack 181, win 501, length 164
05:58:47.896094 IP 143.110.210.251.22 > 99.226.233.187.65116: Flags [P.], seq 346480:346644, ack 181, win 501, length 164
05:58:47.896179 IP 143.110.210.251.22 > 99.226.233.187.65116: Flags [P.], seq 346644:346808, ack 181, win 501, length 164
05:58:47.896278 IP 143.110.210.251.22 > 99.226.233.187.65116: Flags [P.], seq 346808:346972, ack 181, win 501, length 164
05:58:47.896362 IP 143.110.210.251.22 > 99.226.233.187.65116: Flags [P.], seq 346972:347136, ack 181, win 501, length 164
05:58:47.896444 IP 143.110.210.251.22 > 99.226.233.187.65116: Flags [P.], seq 347136:347300, ack 181, win 501, length 164
05:58:47.896527 IP 143.110.210.251.22 > 99.226.233.187.65116: Flags [P.], seq 347300:347464, ack 181, win 501, length 164
05:58:47.896609 IP 143.110.210.251.22 > 99.226.233.187.65116: Flags [P.], seq 347464:347628, ack 181, win 501, length 164
05:58:47.896692 IP 143.110.210.251.22 > 99.226.233.187.65116: Flags [P.], seq 347628:347792, ack 181, win 501, length 164
05:58:47.896779 IP 143.110.210.251.22 > 99.226.233.187.65116: Flags [P.], seq 347792:347956, ack 181, win 501, length 164
05:58:47.897123 IP 143.110.210.251.22 > 99.226.233.187.65116: Flags [P.], seq 347956:348120, ack 181, win 501, length 164
05:58:47.897221 IP 143.110.210.251.22 > 99.226.233.187.65116: Flags [P.], seq 348120:348284, ack 181, win 501, length 164
05:58:47.897313 IP 143.110.210.251.22 > 99.226.233.187.65116: Flags [P.], seq 348284:348448, ack 181, win 501, length 164
05:58:47.897394 IP 143.110.210.251.22 > 99.226.233.187.65116: Flags [P.], seq 348448:348612, ack 181, win 501, length 164
05:58:47.897475 IP 143.110.210.251.22 > 99.226.233.187.65116: Flags [P.], seq 348612:348776, ack 181, win 501, length 164
05:58:47.897557 IP 143.110.210.251.22 > 99.226.233.187.65116: Flags [P.], seq 348776:348940, ack 181, win 501, length 164
05:58:47.897645 IP 143.110.210.251.22 > 99.226.233.187.65116: Flags [P.], seq 348940:349104, ack 181, win 501, length 164
05:58:47.897729 IP 143.110.210.251.22 > 99.226.233.187.65116: Flags [P.], seq 349104:349268, ack 181, win 501, length 164
05:58:47.897892 IP 143.110.210.251.22 > 99.226.233.187.65116: Flags [P.], seq 349268:349432, ack 181, win 501, length 164
05:58:47.898085 IP 143.110.210.251.22 > 99.226.233.187.65116: Flags [P.], seq 349432:349596, ack 181, win 501, length 164
05:58:47.898184 IP 143.110.210.251.22 > 99.226.233.187.65116: Flags [P.], seq 349596:349760, ack 181, win 501, length 164
05:58:47.898277 IP 143.110.210.251.22 > 99.226.233.187.65116: Flags [P.], seq 349760:349924, ack 181, win 501, length 164
05:58:47.898366 IP 143.110.210.251.22 > 99.226.233.187.65116: Flags [P.], seq 349924:350088, ack 181, win 501, length 164
05:58:47.898451 IP 143.110.210.251.22 > 99.226.233.187.65116: Flags [P.], seq 350088:350252, ack 181, win 501, length 164
05:58:47.898534 IP 143.110.210.251.22 > 99.226.233.187.65116: Flags [P.], seq 350252:350416, ack 181, win 501, length 164
05:58:47.898619 IP 143.110.210.251.22 > 99.226.233.187.65116: Flags [P.], seq 350416:350580, ack 181, win 501, length 164
05:58:47.898708 IP 143.110.210.251.22 > 99.226.233.187.65116: Flags [P.], seq 350580:350744, ack 181, win 501, length 164
05:58:47.898790 IP 143.110.210.251.22 > 99.226.233.187.65116: Flags [P.], seq 350744:350908, ack 181, win 501, length 164
05:58:47.898873 IP 143.110.210.251.22 > 99.226.233.187.65116: Flags [P.], seq 350908:351072, ack 181, win 501, length 164
05:58:47.898957 IP 143.110.210.251.22 > 99.226.233.187.65116: Flags [P.], seq 351072:351236, ack 181, win 501, length 164
05:58:47.899040 IP 143.110.210.251.22 > 99.226.233.187.65116: Flags [P.], seq 351236:351400, ack 181, win 501, length 164
05:58:47.899121 IP 143.110.210.251.22 > 99.226.233.187.65116: Flags [P.], seq 351400:351564, ack 181, win 501, length 164
05:58:47.899225 IP 143.110.210.251.22 > 99.226.233.187.65116: Flags [P.], seq 351564:351728, ack 181, win 501, length 164
05:58:47.899416 IP 143.110.210.251.22 > 99.226.233.187.65116: Flags [P.], seq 351728:351892, ack 181, win 501, length 164
05:58:47.899507 IP 143.110.210.251.22 > 99.226.233.187.65116: Flags [P.], seq 351892:352056, ack 181, win 501, length 164
05:58:47.899589 IP 143.110.210.251.22 > 99.226.233.187.65116: Flags [P.], seq 352056:352220, ack 181, win 501, length 164
05:58:47.899670 IP 143.110.210.251.22 > 99.226.233.187.65116: Flags [P.], seq 352220:352384, ack 181, win 501, length 164
05:58:47.899750 IP 143.110.210.251.22 > 99.226.233.187.65116: Flags [P.], seq 352384:352548, ack 181, win 501, length 164
05:58:47.899831 IP 143.110.210.251.22 > 99.226.233.187.65116: Flags [P.], seq 352548:352712, ack 181, win 501, length 164
05:58:47.899911 IP 143.110.210.251.22 > 99.226.233.187.65116: Flags [P.], seq 352712:352876, ack 181, win 501, length 164
05:58:47.900005 IP 143.110.210.251.22 > 99.226.233.187.65116: Flags [P.], seq 352876:353040, ack 181, win 501, length 164
05:58:47.900041 IP 99.226.233.187.65116 > 143.110.210.251.22: Flags [.], ack 332444, win 513, length 0
05:58:47.900141 IP 143.110.210.251.22 > 99.226.233.187.65116: Flags [P.], seq 353040:353308, ack 181, win 501, length 268
05:58:47.900251 IP 143.110.210.251.22 > 99.226.233.187.65116: Flags [P.], seq 353308:353472, ack 181, win 501, length 164
05:58:47.900339 IP 143.110.210.251.22 > 99.226.233.187.65116: Flags [P.], seq 353472:353636, ack 181, win 501, length 164
05:58:47.900425 IP 143.110.210.251.22 > 99.226.233.187.65116: Flags [P.], seq 353636:353800, ack 181, win 501, length 164
05:58:47.900510 IP 143.110.210.251.22 > 99.226.233.187.65116: Flags [P.], seq 353800:353964, ack 181, win 501, length 164
05:58:47.900597 IP 143.110.210.251.22 > 99.226.233.187.65116: Flags [P.], seq 353964:354128, ack 181, win 501, length 164
05:58:47.900677 IP 143.110.210.251.22 > 99.226.233.187.65116: Flags [P.], seq 354128:354292, ack 181, win 501, length 164
05:58:47.900759 IP 143.110.210.251.22 > 99.226.233.187.65116: Flags [P.], seq 354292:354456, ack 181, win 501, length 164
05:58:47.900838 IP 143.110.210.251.22 > 99.226.233.187.65116: Flags [P.], seq 354456:354620, ack 181, win 501, length 164
05:58:47.900940 IP 143.110.210.251.22 > 99.226.233.187.65116: Flags [P.], seq 354620:354784, ack 181, win 501, length 164
05:58:47.901056 IP 143.110.210.251.22 > 99.226.233.187.65116: Flags [P.], seq 354784:354948, ack 181, win 501, length 164
05:58:47.901147 IP 143.110.210.251.22 > 99.226.233.187.65116: Flags [P.], seq 354948:355112, ack 181, win 501, length 164
05:58:47.901230 IP 143.110.210.251.22 > 99.226.233.187.65116: Flags [P.], seq 355112:355276, ack 181, win 501, length 164
05:58:47.901317 IP 143.110.210.251.22 > 99.226.233.187.65116: Flags [P.], seq 355276:355440, ack 181, win 501, length 164
05:58:47.901438 IP 143.110.210.251.22 > 99.226.233.187.65116: Flags [P.], seq 355440:355604, ack 181, win 501, length 164
05:58:47.901547 IP 143.110.210.251.22 > 99.226.233.187.65116: Flags [P.], seq 355604:355768, ack 181, win 501, length 164
05:58:47.901638 IP 143.110.210.251.22 > 99.226.233.187.65116: Flags [P.], seq 355768:355932, ack 181, win 501, length 164
05:58:47.901722 IP 143.110.210.251.22 > 99.226.233.187.65116: Flags [P.], seq 355932:356096, ack 181, win 501, length 164
05:58:47.901831 IP 143.110.210.251.22 > 99.226.233.187.65116: Flags [P.], seq 356096:356260, ack 181, win 501, length 164
05:58:47.901917 IP 143.110.210.251.22 > 99.226.233.187.65116: Flags [P.], seq 356260:356424, ack 181, win 501, length 164
05:58:47.902003 IP 143.110.210.251.22 > 99.226.233.187.65116: Flags [P.], seq 356424:356588, ack 181, win 501, length 164
05:58:47.902085 IP 143.110.210.251.22 > 99.226.233.187.65116: Flags [P.], seq 356588:356752, ack 181, win 501, length 164
05:58:47.902176 IP 143.110.210.251.22 > 99.226.233.187.65116: Flags [P.], seq 356752:356916, ack 181, win 501, length 164
05:58:47.902265 IP 143.110.210.251.22 > 99.226.233.187.65116: Flags [P.], seq 356916:357080, ack 181, win 501, length 164
05:58:47.902348 IP 143.110.210.251.22 > 99.226.233.187.65116: Flags [P.], seq 357080:357244, ack 181, win 501, length 164
05:58:47.902430 IP 143.110.210.251.22 > 99.226.233.187.65116: Flags [P.], seq 357244:357408, ack 181, win 501, length 164
05:58:47.902510 IP 143.110.210.251.22 > 99.226.233.187.65116: Flags [P.], seq 357408:357572, ack 181, win 501, length 164
05:58:47.902599 IP 143.110.210.251.22 > 99.226.233.187.65116: Flags [P.], seq 357572:357736, ack 181, win 501, length 164
05:58:47.902681 IP 143.110.210.251.22 > 99.226.233.187.65116: Flags [P.], seq 357736:357900, ack 181, win 501, length 164
05:58:47.902762 IP 143.110.210.251.22 > 99.226.233.187.65116: Flags [P.], seq 357900:358064, ack 181, win 501, length 164
05:58:47.902843 IP 143.110.210.251.22 > 99.226.233.187.65116: Flags [P.], seq 358064:358228, ack 181, win 501, length 164
05:58:47.902960 IP 143.110.210.251.22 > 99.226.233.187.65116: Flags [P.], seq 358228:358392, ack 181, win 501, length 164
05:58:47.903072 IP 143.110.210.251.22 > 99.226.233.187.65116: Flags [P.], seq 358392:358556, ack 181, win 501, length 164
05:58:47.903160 IP 143.110.210.251.22 > 99.226.233.187.65116: Flags [P.], seq 358556:358720, ack 181, win 501, length 164
05:58:47.903250 IP 143.110.210.251.22 > 99.226.233.187.65116: Flags [P.], seq 358720:358884, ack 181, win 501, length 164
05:58:47.903335 IP 143.110.210.251.22 > 99.226.233.187.65116: Flags [P.], seq 358884:359048, ack 181, win 501, length 164
05:58:47.903418 IP 143.110.210.251.22 > 99.226.233.187.65116: Flags [P.], seq 359048:359212, ack 181, win 501, length 164
05:58:47.903500 IP 143.110.210.251.22 > 99.226.233.187.65116: Flags [P.], seq 359212:359376, ack 181, win 501, length 164
05:58:47.903587 IP 143.110.210.251.22 > 99.226.233.187.65116: Flags [P.], seq 359376:359540, ack 181, win 501, length 164
05:58:47.903669 IP 143.110.210.251.22 > 99.226.233.187.65116: Flags [P.], seq 359540:359704, ack 181, win 501, length 164
05:58:47.903757 IP 143.110.210.251.22 > 99.226.233.187.65116: Flags [P.], seq 359704:359868, ack 181, win 501, length 164
05:58:47.903840 IP 143.110.210.251.22 > 99.226.233.187.65116: Flags [P.], seq 359868:360032, ack 181, win 501, length 164
05:58:47.903930 IP 143.110.210.251.22 > 99.226.233.187.65116: Flags [P.], seq 360032:360196, ack 181, win 501, length 164
05:58:47.904014 IP 143.110.210.251.22 > 99.226.233.187.65116: Flags [P.], seq 360196:360360, ack 181, win 501, length 164
05:58:47.904106 IP 143.110.210.251.22 > 99.226.233.187.65116: Flags [P.], seq 360360:360524, ack 181, win 501, length 164
05:58:47.904189 IP 143.110.210.251.22 > 99.226.233.187.65116: Flags [P.], seq 360524:360688, ack 181, win 501, length 164
05:58:47.904294 IP 143.110.210.251.22 > 99.226.233.187.65116: Flags [P.], seq 360688:360852, ack 181, win 501, length 164
05:58:47.904379 IP 143.110.210.251.22 > 99.226.233.187.65116: Flags [P.], seq 360852:361016, ack 181, win 501, length 164
05:58:47.904462 IP 143.110.210.251.22 > 99.226.233.187.65116: Flags [P.], seq 361016:361180, ack 181, win 501, length 164
05:58:47.904530 IP 99.226.233.187.65116 > 143.110.210.251.22: Flags [.], ack 340084, win 511, length 0
05:58:47.904530 IP 99.226.233.187.65116 > 143.110.210.251.22: Flags [.], ack 348120, win 512, length 0
05:58:47.904666 IP 143.110.210.251.22 > 99.226.233.187.65116: Flags [P.], seq 361180:361552, ack 181, win 501, length 372
05:58:47.904759 IP 143.110.210.251.22 > 99.226.233.187.65116: Flags [P.], seq 361552:361716, ack 181, win 501, length 164
05:58:47.904851 IP 143.110.210.251.22 > 99.226.233.187.65116: Flags [P.], seq 361716:361880, ack 181, win 501, length 164
05:58:47.904938 IP 143.110.210.251.22 > 99.226.233.187.65116: Flags [P.], seq 361880:362044, ack 181, win 501, length 164
05:58:47.905023 IP 143.110.210.251.22 > 99.226.233.187.65116: Flags [P.], seq 362044:362208, ack 181, win 501, length 164
05:58:47.905109 IP 143.110.210.251.22 > 99.226.233.187.65116: Flags [P.], seq 362208:362372, ack 181, win 501, length 164
05:58:47.905191 IP 143.110.210.251.22 > 99.226.233.187.65116: Flags [P.], seq 362372:362536, ack 181, win 501, length 164
05:58:47.905278 IP 143.110.210.251.22 > 99.226.233.187.65116: Flags [P.], seq 362536:362700, ack 181, win 501, length 164
05:58:47.905359 IP 143.110.210.251.22 > 99.226.233.187.65116: Flags [P.], seq 362700:362864, ack 181, win 501, length 164
05:58:47.905445 IP 143.110.210.251.22 > 99.226.233.187.65116: Flags [P.], seq 362864:363028, ack 181, win 501, length 164
05:58:47.905527 IP 143.110.210.251.22 > 99.226.233.187.65116: Flags [P.], seq 363028:363192, ack 181, win 501, length 164
05:58:47.905612 IP 143.110.210.251.22 > 99.226.233.187.65116: Flags [P.], seq 363192:363356, ack 181, win 501, length 164
05:58:47.905693 IP 143.110.210.251.22 > 99.226.233.187.65116: Flags [P.], seq 363356:363520, ack 181, win 501, length 164
05:58:47.905788 IP 143.110.210.251.22 > 99.226.233.187.65116: Flags [P.], seq 363520:363684, ack 181, win 501, length 164
05:58:47.905869 IP 143.110.210.251.22 > 99.226.233.187.65116: Flags [P.], seq 363684:363848, ack 181, win 501, length 164
05:58:47.905956 IP 143.110.210.251.22 > 99.226.233.187.65116: Flags [P.], seq 363848:364012, ack 181, win 501, length 164
05:58:47.906038 IP 143.110.210.251.22 > 99.226.233.187.65116: Flags [P.], seq 364012:364176, ack 181, win 501, length 164
05:58:47.906124 IP 143.110.210.251.22 > 99.226.233.187.65116: Flags [P.], seq 364176:364340, ack 181, win 501, length 164
05:58:47.906205 IP 143.110.210.251.22 > 99.226.233.187.65116: Flags [P.], seq 364340:364504, ack 181, win 501, length 164
05:58:47.906286 IP 143.110.210.251.22 > 99.226.233.187.65116: Flags [P.], seq 364504:364668, ack 181, win 501, length 164
05:58:47.906375 IP 143.110.210.251.22 > 99.226.233.187.65116: Flags [P.], seq 364668:364832, ack 181, win 501, length 164
05:58:47.906456 IP 143.110.210.251.22 > 99.226.233.187.65116: Flags [P.], seq 364832:364996, ack 181, win 501, length 164
05:58:47.906543 IP 143.110.210.251.22 > 99.226.233.187.65116: Flags [P.], seq 364996:365160, ack 181, win 501, length 164
05:58:47.906629 IP 143.110.210.251.22 > 99.226.233.187.65116: Flags [P.], seq 365160:365324, ack 181, win 501, length 164
05:58:47.906708 IP 143.110.210.251.22 > 99.226.233.187.65116: Flags [P.], seq 365324:365488, ack 181, win 501, length 164
05:58:47.906788 IP 143.110.210.251.22 > 99.226.233.187.65116: Flags [P.], seq 365488:365652, ack 181, win 501, length 164
05:58:47.906875 IP 143.110.210.251.22 > 99.226.233.187.65116: Flags [P.], seq 365652:365816, ack 181, win 501, length 164
05:58:47.907025 IP 143.110.210.251.22 > 99.226.233.187.65116: Flags [P.], seq 365816:365980, ack 181, win 501, length 164
05:58:47.907123 IP 143.110.210.251.22 > 99.226.233.187.65116: Flags [P.], seq 365980:366144, ack 181, win 501, length 164
05:58:47.907215 IP 143.110.210.251.22 > 99.226.233.187.65116: Flags [P.], seq 366144:366308, ack 181, win 501, length 164
05:58:47.907328 IP 143.110.210.251.22 > 99.226.233.187.65116: Flags [P.], seq 366308:366472, ack 181, win 501, length 164
05:58:47.907439 IP 143.110.210.251.22 > 99.226.233.187.65116: Flags [P.], seq 366472:366636, ack 181, win 501, length 164
05:58:47.907527 IP 143.110.210.251.22 > 99.226.233.187.65116: Flags [P.], seq 366636:366800, ack 181, win 501, length 164
05:58:47.907613 IP 143.110.210.251.22 > 99.226.233.187.65116: Flags [P.], seq 366800:366964, ack 181, win 501, length 164
05:58:47.907702 IP 143.110.210.251.22 > 99.226.233.187.65116: Flags [P.], seq 366964:367128, ack 181, win 501, length 164
05:58:47.907789 IP 143.110.210.251.22 > 99.226.233.187.65116: Flags [P.], seq 367128:367292, ack 181, win 501, length 164
05:58:47.907877 IP 143.110.210.251.22 > 99.226.233.187.65116: Flags [P.], seq 367292:367456, ack 181, win 501, length 164
05:58:47.908002 IP 143.110.210.251.22 > 99.226.233.187.65116: Flags [P.], seq 367456:367620, ack 181, win 501, length 164
05:58:47.908098 IP 143.110.210.251.22 > 99.226.233.187.65116: Flags [P.], seq 367620:367784, ack 181, win 501, length 164
05:58:47.908158 IP 99.226.233.187.65116 > 143.110.210.251.22: Flags [.], ack 356260, win 508, length 0
05:58:47.908265 IP 143.110.210.251.22 > 99.226.233.187.65116: Flags [P.], seq 367784:368052, ack 181, win 501, length 268
05:58:47.908354 IP 143.110.210.251.22 > 99.226.233.187.65116: Flags [P.], seq 368052:368216, ack 181, win 501, length 164
05:58:47.908439 IP 143.110.210.251.22 > 99.226.233.187.65116: Flags [P.], seq 368216:368380, ack 181, win 501, length 164
05:58:47.908522 IP 143.110.210.251.22 > 99.226.233.187.65116: Flags [P.], seq 368380:368544, ack 181, win 501, length 164
05:58:47.908604 IP 143.110.210.251.22 > 99.226.233.187.65116: Flags [P.], seq 368544:368708, ack 181, win 501, length 164
05:58:47.908684 IP 143.110.210.251.22 > 99.226.233.187.65116: Flags [P.], seq 368708:368872, ack 181, win 501, length 164
05:58:47.908770 IP 143.110.210.251.22 > 99.226.233.187.65116: Flags [P.], seq 368872:369036, ack 181, win 501, length 164
05:58:47.908851 IP 143.110.210.251.22 > 99.226.233.187.65116: Flags [P.], seq 369036:369200, ack 181, win 501, length 164
05:58:47.908937 IP 143.110.210.251.22 > 99.226.233.187.65116: Flags [P.], seq 369200:369364, ack 181, win 501, length 164
05:58:47.909019 IP 143.110.210.251.22 > 99.226.233.187.65116: Flags [P.], seq 369364:369528, ack 181, win 501, length 164
05:58:47.909100 IP 143.110.210.251.22 > 99.226.233.187.65116: Flags [P.], seq 369528:369692, ack 181, win 501, length 164
05:58:47.909197 IP 143.110.210.251.22 > 99.226.233.187.65116: Flags [P.], seq 369692:369856, ack 181, win 501, length 164
05:58:47.909282 IP 143.110.210.251.22 > 99.226.233.187.65116: Flags [P.], seq 369856:370020, ack 181, win 501, length 164
05:58:47.909371 IP 143.110.210.251.22 > 99.226.233.187.65116: Flags [P.], seq 370020:370184, ack 181, win 501, length 164
05:58:47.909453 IP 143.110.210.251.22 > 99.226.233.187.65116: Flags [P.], seq 370184:370348, ack 181, win 501, length 164
05:58:47.909543 IP 143.110.210.251.22 > 99.226.233.187.65116: Flags [P.], seq 370348:370512, ack 181, win 501, length 164
05:58:47.909648 IP 143.110.210.251.22 > 99.226.233.187.65116: Flags [P.], seq 370512:370676, ack 181, win 501, length 164
05:58:47.909738 IP 143.110.210.251.22 > 99.226.233.187.65116: Flags [P.], seq 370676:370840, ack 181, win 501, length 164
05:58:47.909837 IP 143.110.210.251.22 > 99.226.233.187.65116: Flags [P.], seq 370840:371004, ack 181, win 501, length 164
05:58:47.909943 IP 143.110.210.251.22 > 99.226.233.187.65116: Flags [P.], seq 371004:371168, ack 181, win 501, length 164
05:58:47.910071 IP 143.110.210.251.22 > 99.226.233.187.65116: Flags [P.], seq 371168:371332, ack 181, win 501, length 164
05:58:47.910165 IP 143.110.210.251.22 > 99.226.233.187.65116: Flags [P.], seq 371332:371496, ack 181, win 501, length 164
05:58:47.910255 IP 143.110.210.251.22 > 99.226.233.187.65116: Flags [P.], seq 371496:371660, ack 181, win 501, length 164
05:58:47.910338 IP 143.110.210.251.22 > 99.226.233.187.65116: Flags [P.], seq 371660:371824, ack 181, win 501, length 164
05:58:47.910426 IP 143.110.210.251.22 > 99.226.233.187.65116: Flags [P.], seq 371824:371988, ack 181, win 501, length 164
05:58:47.910508 IP 143.110.210.251.22 > 99.226.233.187.65116: Flags [P.], seq 371988:372152, ack 181, win 501, length 164
05:58:47.910591 IP 143.110.210.251.22 > 99.226.233.187.65116: Flags [P.], seq 372152:372316, ack 181, win 501, length 164
05:58:47.910676 IP 143.110.210.251.22 > 99.226.233.187.65116: Flags [P.], seq 372316:372480, ack 181, win 501, length 164
05:58:47.910757 IP 143.110.210.251.22 > 99.226.233.187.65116: Flags [P.], seq 372480:372644, ack 181, win 501, length 164
05:58:47.910840 IP 143.110.210.251.22 > 99.226.233.187.65116: Flags [P.], seq 372644:372808, ack 181, win 501, length 164
05:58:47.910964 IP 143.110.210.251.22 > 99.226.233.187.65116: Flags [P.], seq 372808:372972, ack 181, win 501, length 164
05:58:47.911063 IP 143.110.210.251.22 > 99.226.233.187.65116: Flags [P.], seq 372972:373136, ack 181, win 501, length 164
05:58:47.911148 IP 143.110.210.251.22 > 99.226.233.187.65116: Flags [P.], seq 373136:373300, ack 181, win 501, length 164
05:58:47.911230 IP 143.110.210.251.22 > 99.226.233.187.65116: Flags [P.], seq 373300:373464, ack 181, win 501, length 164
05:58:47.911314 IP 143.110.210.251.22 > 99.226.233.187.65116: Flags [P.], seq 373464:373628, ack 181, win 501, length 164
05:58:47.911396 IP 143.110.210.251.22 > 99.226.233.187.65116: Flags [P.], seq 373628:373792, ack 181, win 501, length 164
05:58:47.911477 IP 143.110.210.251.22 > 99.226.233.187.65116: Flags [P.], seq 373792:373956, ack 181, win 501, length 164
05:58:47.911559 IP 143.110.210.251.22 > 99.226.233.187.65116: Flags [P.], seq 373956:374120, ack 181, win 501, length 164
05:58:47.911643 IP 143.110.210.251.22 > 99.226.233.187.65116: Flags [P.], seq 374120:374284, ack 181, win 501, length 164
05:58:47.911724 IP 143.110.210.251.22 > 99.226.233.187.65116: Flags [P.], seq 374284:374448, ack 181, win 501, length 164
05:58:47.911806 IP 143.110.210.251.22 > 99.226.233.187.65116: Flags [P.], seq 374448:374612, ack 181, win 501, length 164
05:58:47.911887 IP 143.110.210.251.22 > 99.226.233.187.65116: Flags [P.], seq 374612:374776, ack 181, win 501, length 164
05:58:47.911968 IP 143.110.210.251.22 > 99.226.233.187.65116: Flags [P.], seq 374776:374940, ack 181, win 501, length 164
05:58:47.912059 IP 143.110.210.251.22 > 99.226.233.187.65116: Flags [P.], seq 374940:375104, ack 181, win 501, length 164
05:58:47.912143 IP 143.110.210.251.22 > 99.226.233.187.65116: Flags [P.], seq 375104:375268, ack 181, win 501, length 164
05:58:47.912248 IP 143.110.210.251.22 > 99.226.233.187.65116: Flags [P.], seq 375268:375432, ack 181, win 501, length 164
05:58:47.912332 IP 143.110.210.251.22 > 99.226.233.187.65116: Flags [P.], seq 375432:375596, ack 181, win 501, length 164
05:58:47.912423 IP 143.110.210.251.22 > 99.226.233.187.65116: Flags [P.], seq 375596:375760, ack 181, win 501, length 164
