root@lamp-ubuntu-s-1vcpu-1gb-tor1-01:~# tcpdump -r 0001.pcap
reading from file 0001.pcap, link-type EN10MB (Ethernet)
05:54:18.687244 IP lamp-ubuntu-s-1vcpu-1gb-tor1-01.ssh > cpee0dbd127d1d4-cme0dbd127d1d2.cpe.net.cable.rogers.com.65116: Flags [P.], seq 2537395789:2537395833, ack 777883609, win 501, length 44
05:54:18.687378 IP lamp-ubuntu-s-1vcpu-1gb-tor1-01.ssh > cpee0dbd127d1d4-cme0dbd127d1d2.cpe.net.cable.rogers.com.65116: Flags [P.], seq 44:152, ack 1, win 501, length 108
05:54:18.687529 IP lamp-ubuntu-s-1vcpu-1gb-tor1-01.ssh > cpee0dbd127d1d4-cme0dbd127d1d2.cpe.net.cable.rogers.com.65116: Flags [P.], seq 152:188, ack 1, win 501, length 36
05:54:18.693087 IP cpee0dbd127d1d4-cme0dbd127d1d2.cpe.net.cable.rogers.com.65116 > lamp-ubuntu-s-1vcpu-1gb-tor1-01.ssh: Flags [.], ack 188, win 510, length 0
05:54:19.021945 IP 154.92.14.108.58851 > lamp-ubuntu-s-1vcpu-1gb-tor1-01.http: Flags [S], seq 577095612, win 8192, options [mss 1460,nop,nop,sackOK], length 0
05:54:19.022035 IP lamp-ubuntu-s-1vcpu-1gb-tor1-01.http > 154.92.14.108.58851: Flags [S.], seq 1153523900, ack 577095613, win 64240, options [mss 1460,nop,nop,sackOK], length 0
05:54:19.188374 IP lamp-ubuntu-s-1vcpu-1gb-tor1-01.http > 154.221.21.229.393: Flags [S.], seq 1367713952, ack 669587169, win 64240, options [mss 1460,nop,nop,sackOK], length 0
05:54:20.052364 IP lamp-ubuntu-s-1vcpu-1gb-tor1-01.http > 154.92.14.108.58851: Flags [S.], seq 1153523900, ack 577095613, win 64240, options [mss 1460,nop,nop,sackOK], length 0
05:54:22.068387 IP lamp-ubuntu-s-1vcpu-1gb-tor1-01.http > 154.92.14.108.58851: Flags [S.], seq 1153523900, ack 577095613, win 64240, options [mss 1460,nop,nop,sackOK], length 0
05:54:22.260371 IP lamp-ubuntu-s-1vcpu-1gb-tor1-01.http > 202.58.105.162.13880: Flags [S.], seq 4264829885, ack 3670560741, win 64240, options [mss 1460,nop,nop,sackOK], length 0
05:54:23.966639 IP hosting-by.4cloud.mobi.48765 > lamp-ubuntu-s-1vcpu-1gb-tor1-01.62141: Flags [S], seq 2600741253, win 1024, length 0
05:54:25.076362 IP lamp-ubuntu-s-1vcpu-1gb-tor1-01.http > 45.114.13.252.20273: Flags [S.], seq 3331390641, ack 876025680, win 64240, options [mss 1460,nop,nop,sackOK], length 0
05:54:26.100340 IP lamp-ubuntu-s-1vcpu-1gb-tor1-01.http > 154.92.14.108.58851: Flags [S.], seq 1153523900, ack 577095613, win 64240, options [mss 1460,nop,nop,sackOK], length 0
05:54:29.750142 IP 65.47.190.35.bc.googleusercontent.com.http > lamp-ubuntu-s-1vcpu-1gb-tor1-01.40520: Flags [R], seq 1251272746, win 0, length 0
05:54:30.452314 IP lamp-ubuntu-s-1vcpu-1gb-tor1-01.http > 202.58.105.162.13880: Flags [S.], seq 4264829885, ack 3670560741, win 64240, options [mss 1460,nop,nop,sackOK], length 0
05:54:32.157500 IP 45.155.205.44.44924 > lamp-ubuntu-s-1vcpu-1gb-tor1-01.2475: Flags [S], seq 1307419365, win 1024, length 0
05:54:34.292339 IP lamp-ubuntu-s-1vcpu-1gb-tor1-01.http > 154.92.14.108.58851: Flags [S.], seq 1153523900, ack 577095613, win 64240, options [mss 1460,nop,nop,sackOK], length 0
05:54:34.699124 IP 160.20.56.175.38641 > lamp-ubuntu-s-1vcpu-1gb-tor1-01.http: Flags [S], seq 919858200, win 8192, options [mss 1460,nop,nop,sackOK], length 0
05:54:34.699255 IP lamp-ubuntu-s-1vcpu-1gb-tor1-01.http > 160.20.56.175.38641: Flags [S.], seq 1639646881, ack 919858201, win 64240, options [mss 1460,nop,nop,sackOK], length 0
05:54:34.804353 IP lamp-ubuntu-s-1vcpu-1gb-tor1-01.http > 154.83.12.41.6092: Flags [S.], seq 1830100254, ack 3074591073, win 64240, options [mss 1460,nop,nop,sackOK], length 0
05:54:35.700348 IP lamp-ubuntu-s-1vcpu-1gb-tor1-01.http > 160.20.56.175.38641: Flags [S.], seq 1639646881, ack 919858201, win 64240, options [mss 1460,nop,nop,sackOK], length 0
05:54:36.287401 IP 164.155.92.68.61163 > lamp-ubuntu-s-1vcpu-1gb-tor1-01.http: Flags [S], seq 365708300, win 8192, options [mss 1460,nop,nop,sackOK], length 0
05:54:36.287518 IP lamp-ubuntu-s-1vcpu-1gb-tor1-01.http > 164.155.92.68.61163: Flags [S.], seq 667998155, ack 365708301, win 64240, options [mss 1460,nop,nop,sackOK], length 0
05:54:37.300345 IP lamp-ubuntu-s-1vcpu-1gb-tor1-01.http > 164.155.92.68.61163: Flags [S.], seq 667998155, ack 365708301, win 64240, options [mss 1460,nop,nop,sackOK], length 0
05:54:37.716372 IP lamp-ubuntu-s-1vcpu-1gb-tor1-01.http > 160.20.56.175.38641: Flags [S.], seq 1639646881, ack 919858201, win 64240, options [mss 1460,nop,nop,sackOK], length 0
05:54:39.316340 IP lamp-ubuntu-s-1vcpu-1gb-tor1-01.http > 164.155.92.68.61163: Flags [S.], seq 667998155, ack 365708301, win 64240, options [mss 1460,nop,nop,sackOK], length 0
05:54:41.972370 IP lamp-ubuntu-s-1vcpu-1gb-tor1-01.http > 160.20.56.175.38641: Flags [S.], seq 1639646881, ack 919858201, win 64240, options [mss 1460,nop,nop,sackOK], length 0
05:54:43.508350 IP lamp-ubuntu-s-1vcpu-1gb-tor1-01.http > 164.155.92.68.61163: Flags [S.], seq 667998155, ack 365708301, win 64240, options [mss 1460,nop,nop,sackOK], length 0
05:54:44.207522 IP hosting-by.4cloud.mobi.48767 > lamp-ubuntu-s-1vcpu-1gb-tor1-01.5039: Flags [S], seq 4068172834, win 1024, length 0
05:54:46.580348 IP lamp-ubuntu-s-1vcpu-1gb-tor1-01.http > 202.58.105.162.13880: Flags [S.], seq 4264829885, ack 3670560741, win 64240, options [mss 1460,nop,nop,sackOK], length 0
05:54:49.937273 IP node-18pm.pool-101-51.dynamic.totinternet.net.58680 > lamp-ubuntu-s-1vcpu-1gb-tor1-01.microsoft-ds: Flags [S], seq 3101441925, win 8192, options [mss 1452,nop,nop,sackOK], length 0
05:54:50.164349 IP lamp-ubuntu-s-1vcpu-1gb-tor1-01.http > 160.20.56.175.38641: Flags [S.], seq 1639646881, ack 919858201, win 64240, options [mss 1460,nop,nop,sackOK], length 0
05:54:50.391562 IP 185.247.231.242.29253 > lamp-ubuntu-s-1vcpu-1gb-tor1-01.http: Flags [S], seq 2025816648, win 8192, options [mss 1460,nop,nop,sackOK], length 0
05:54:50.391650 IP lamp-ubuntu-s-1vcpu-1gb-tor1-01.http > 185.247.231.242.29253: Flags [S.], seq 4097094118, ack 2025816649, win 64240, options [mss 1460,nop,nop,sackOK], length 0
05:54:50.420350 IP lamp-ubuntu-s-1vcpu-1gb-tor1-01.http > 154.92.14.108.58851: Flags [S.], seq 1153523900, ack 577095613, win 64240, options [mss 1460,nop,nop,sackOK], length 0
05:54:51.412374 IP lamp-ubuntu-s-1vcpu-1gb-tor1-01.http > 185.247.231.242.29253: Flags [S.], seq 4097094118, ack 2025816649, win 64240, options [mss 1460,nop,nop,sackOK], length 0
05:54:51.700351 IP lamp-ubuntu-s-1vcpu-1gb-tor1-01.http > 164.155.92.68.61163: Flags [S.], seq 667998155, ack 365708301, win 64240, options [mss 1460,nop,nop,sackOK], length 0
05:54:52.935967 IP node-18pm.pool-101-51.dynamic.totinternet.net.58680 > lamp-ubuntu-s-1vcpu-1gb-tor1-01.microsoft-ds: Flags [S], seq 3101441925, win 8192, options [mss 1452,nop,nop,sackOK], length 0
05:54:53.428371 IP lamp-ubuntu-s-1vcpu-1gb-tor1-01.http > 185.247.231.242.29253: Flags [S.], seq 4097094118, ack 2025816649, win 64240, options [mss 1460,nop,nop,sackOK], length 0
05:54:56.564368 ARP, Request who-has _gateway tell lamp-ubuntu-s-1vcpu-1gb-tor1-01, length 28
05:54:56.565970 ARP, Reply _gateway is-at fe:00:00:00:01:01 (oui Unknown), length 46
05:54:57.023237 IP 94.232.46.22.59723 > lamp-ubuntu-s-1vcpu-1gb-tor1-01.4146: Flags [S], seq 2290371587, win 1024, length 0
05:54:57.588376 IP lamp-ubuntu-s-1vcpu-1gb-tor1-01.http > 185.247.231.242.29253: Flags [S.], seq 4097094118, ack 2025816649, win 64240, options [mss 1460,nop,nop,sackOK], length 0
05:54:57.595553 IP 164.155.82.229.4762 > lamp-ubuntu-s-1vcpu-1gb-tor1-01.http: Flags [S], seq 2458030957, win 8192, options [mss 1460,nop,nop,sackOK], length 0
05:54:57.595661 IP lamp-ubuntu-s-1vcpu-1gb-tor1-01.http > 164.155.82.229.4762: Flags [S.], seq 511250926, ack 2458030958, win 64240, options [mss 1460,nop,nop,sackOK], length 0
05:54:58.612307 IP lamp-ubuntu-s-1vcpu-1gb-tor1-01.http > 164.155.82.229.4762: Flags [S.], seq 511250926, ack 2458030958, win 64240, options [mss 1460,nop,nop,sackOK], length 0
05:54:59.006989 IP node-18pm.pool-101-51.dynamic.totinternet.net.58680 > lamp-ubuntu-s-1vcpu-1gb-tor1-01.microsoft-ds: Flags [S], seq 3101441925, win 8192, options [mss 1452,nop,nop,sackOK], length 0
^C05:54:59.924181 IP 157.185.156.157 > lamp-ubuntu-s-1vcpu-1gb-tor1-01: ICMP echo request, id 11574, seq 42691, length 32

root@lamp-ubuntu-s-1vcpu-1gb-tor1-01:~#
