root@lamp-ubuntu-s-1vcpu-1gb-tor1-01:~# tcpdump -i eth0 tcp
tcpdump: verbose output suppressed, use -v or -vv for full protocol decode
listening on eth0, link-type EN10MB (Ethernet), capture size 262144 bytes
05:59:18.143511 IP lamp-ubuntu-s-1vcpu-1gb-tor1-01.ssh > cpee0dbd127d1d4-cme0dbd127d1d2.cpe.net.cable.rogers.com.65116: Flags [P.], seq 2539362849:2539362957, ack 777885689, win 501, length 108
05:59:18.143629 IP lamp-ubuntu-s-1vcpu-1gb-tor1-01.ssh > cpee0dbd127d1d4-cme0dbd127d1d2.cpe.net.cable.rogers.com.65116: Flags [P.], seq 108:144, ack 1, win 501, length 36
05:59:18.143737 IP lamp-ubuntu-s-1vcpu-1gb-tor1-01.ssh > cpee0dbd127d1d4-cme0dbd127d1d2.cpe.net.cable.rogers.com.65116: Flags [P.], seq 144:252, ack 1, win 501, length 108
05:59:18.143824 IP lamp-ubuntu-s-1vcpu-1gb-tor1-01.ssh > cpee0dbd127d1d4-cme0dbd127d1d2.cpe.net.cable.rogers.com.65116: Flags [P.], seq 252:288, ack 1, win 501, length 36
05:59:18.150189 IP lamp-ubuntu-s-1vcpu-1gb-tor1-01.ssh > cpee0dbd127d1d4-cme0dbd127d1d2.cpe.net.cable.rogers.com.65116: Flags [P.], seq 288:516, ack 1, win 501, length 228
05:59:18.150309 IP lamp-ubuntu-s-1vcpu-1gb-tor1-01.ssh > cpee0dbd127d1d4-cme0dbd127d1d2.cpe.net.cable.rogers.com.65116: Flags [P.], seq 516:552, ack 1, win 501, length 36
05:59:18.150420 IP lamp-ubuntu-s-1vcpu-1gb-tor1-01.ssh > cpee0dbd127d1d4-cme0dbd127d1d2.cpe.net.cable.rogers.com.65116: Flags [P.], seq 552:756, ack 1, win 501, length 204
05:59:18.150504 IP lamp-ubuntu-s-1vcpu-1gb-tor1-01.ssh > cpee0dbd127d1d4-cme0dbd127d1d2.cpe.net.cable.rogers.com.65116: Flags [P.], seq 756:792, ack 1, win 501, length 36
05:59:18.150613 IP lamp-ubuntu-s-1vcpu-1gb-tor1-01.ssh > cpee0dbd127d1d4-cme0dbd127d1d2.cpe.net.cable.rogers.com.65116: Flags [P.], seq 792:1004, ack 1, win 501, length 212
05:59:18.156297 IP cpee0dbd127d1d4-cme0dbd127d1d2.cpe.net.cable.rogers.com.65116 > lamp-ubuntu-s-1vcpu-1gb-tor1-01.ssh: Flags [.], ack 288, win 508, length 0
05:59:18.156347 IP lamp-ubuntu-s-1vcpu-1gb-tor1-01.ssh > cpee0dbd127d1d4-cme0dbd127d1d2.cpe.net.cable.rogers.com.65116: Flags [P.], seq 1004:2504, ack 1, win 501, length 1500
05:59:18.156504 IP lamp-ubuntu-s-1vcpu-1gb-tor1-01.ssh > cpee0dbd127d1d4-cme0dbd127d1d2.cpe.net.cable.rogers.com.65116: Flags [P.], seq 2504:2700, ack 1, win 501, length 196
05:59:18.156613 IP lamp-ubuntu-s-1vcpu-1gb-tor1-01.ssh > cpee0dbd127d1d4-cme0dbd127d1d2.cpe.net.cable.rogers.com.65116: Flags [P.], seq 2700:2736, ack 1, win 501, length 36
05:59:18.156735 IP lamp-ubuntu-s-1vcpu-1gb-tor1-01.ssh > cpee0dbd127d1d4-cme0dbd127d1d2.cpe.net.cable.rogers.com.65116: Flags [P.], seq 2736:2948, ack 1, win 501, length 212
05:59:18.156818 IP lamp-ubuntu-s-1vcpu-1gb-tor1-01.ssh > cpee0dbd127d1d4-cme0dbd127d1d2.cpe.net.cable.rogers.com.65116: Flags [P.], seq 2948:2984, ack 1, win 501, length 36
05:59:18.156928 IP lamp-ubuntu-s-1vcpu-1gb-tor1-01.ssh > cpee0dbd127d1d4-cme0dbd127d1d2.cpe.net.cable.rogers.com.65116: Flags [P.], seq 2984:3196, ack 1, win 501, length 212
05:59:18.157010 IP lamp-ubuntu-s-1vcpu-1gb-tor1-01.ssh > cpee0dbd127d1d4-cme0dbd127d1d2.cpe.net.cable.rogers.com.65116: Flags [P.], seq 3196:3232, ack 1, win 501, length 36
05:59:18.157119 IP lamp-ubuntu-s-1vcpu-1gb-tor1-01.ssh > cpee0dbd127d1d4-cme0dbd127d1d2.cpe.net.cable.rogers.com.65116: Flags [P.], seq 3232:3444, ack 1, win 501, length 212
05:59:18.157213 IP lamp-ubuntu-s-1vcpu-1gb-tor1-01.ssh > cpee0dbd127d1d4-cme0dbd127d1d2.cpe.net.cable.rogers.com.65116: Flags [P.], seq 3444:3480, ack 1, win 501, length 36
05:59:18.164091 IP cpee0dbd127d1d4-cme0dbd127d1d2.cpe.net.cable.rogers.com.65116 > lamp-ubuntu-s-1vcpu-1gb-tor1-01.ssh: Flags [.], ack 1004, win 513, length 0
05:59:18.164156 IP lamp-ubuntu-s-1vcpu-1gb-tor1-01.ssh > cpee0dbd127d1d4-cme0dbd127d1d2.cpe.net.cable.rogers.com.65116: Flags [P.], seq 3480:4968, ack 1, win 501, length 1488
05:59:18.164375 IP lamp-ubuntu-s-1vcpu-1gb-tor1-01.ssh > cpee0dbd127d1d4-cme0dbd127d1d2.cpe.net.cable.rogers.com.65116: Flags [P.], seq 4968:5164, ack 1, win 501, length 196
05:59:18.164485 IP lamp-ubuntu-s-1vcpu-1gb-tor1-01.ssh > cpee0dbd127d1d4-cme0dbd127d1d2.cpe.net.cable.rogers.com.65116: Flags [P.], seq 5164:5200, ack 1, win 501, length 36
05:59:18.164762 IP lamp-ubuntu-s-1vcpu-1gb-tor1-01.ssh > cpee0dbd127d1d4-cme0dbd127d1d2.cpe.net.cable.rogers.com.65116: Flags [P.], seq 5200:5412, ack 1, win 501, length 212
05:59:18.164878 IP lamp-ubuntu-s-1vcpu-1gb-tor1-01.ssh > cpee0dbd127d1d4-cme0dbd127d1d2.cpe.net.cable.rogers.com.65116: Flags [P.], seq 5412:5448, ack 1, win 501, length 36
05:59:18.164970 IP lamp-ubuntu-s-1vcpu-1gb-tor1-01.ssh > cpee0dbd127d1d4-cme0dbd127d1d2.cpe.net.cable.rogers.com.65116: Flags [P.], seq 5448:5660, ack 1, win 501, length 212
05:59:18.165057 IP lamp-ubuntu-s-1vcpu-1gb-tor1-01.ssh > cpee0dbd127d1d4-cme0dbd127d1d2.cpe.net.cable.rogers.com.65116: Flags [P.], seq 5660:5696, ack 1, win 501, length 36
05:59:18.165174 IP lamp-ubuntu-s-1vcpu-1gb-tor1-01.ssh > cpee0dbd127d1d4-cme0dbd127d1d2.cpe.net.cable.rogers.com.65116: Flags [P.], seq 5696:5908, ack 1, win 501, length 212
05:59:18.165257 IP lamp-ubuntu-s-1vcpu-1gb-tor1-01.ssh > cpee0dbd127d1d4-cme0dbd127d1d2.cpe.net.cable.rogers.com.65116: Flags [P.], seq 5908:5944, ack 1, win 501, length 36
05:59:18.168278 IP cpee0dbd127d1d4-cme0dbd127d1d2.cpe.net.cable.rogers.com.65116 > lamp-ubuntu-s-1vcpu-1gb-tor1-01.ssh: Flags [.], ack 2736, win 512, length 0
05:59:18.168279 IP cpee0dbd127d1d4-cme0dbd127d1d2.cpe.net.cable.rogers.com.65116 > lamp-ubuntu-s-1vcpu-1gb-tor1-01.ssh: Flags [.], ack 3480, win 509, length 0
05:59:18.168327 IP lamp-ubuntu-s-1vcpu-1gb-tor1-01.ssh > cpee0dbd127d1d4-cme0dbd127d1d2.cpe.net.cable.rogers.com.65116: Flags [P.], seq 5944:7432, ack 1, win 501, length 1488
05:59:18.168495 IP lamp-ubuntu-s-1vcpu-1gb-tor1-01.ssh > cpee0dbd127d1d4-cme0dbd127d1d2.cpe.net.cable.rogers.com.65116: Flags [P.], seq 7432:7628, ack 1, win 501, length 196
05:59:18.168651 IP lamp-ubuntu-s-1vcpu-1gb-tor1-01.ssh > cpee0dbd127d1d4-cme0dbd127d1d2.cpe.net.cable.rogers.com.65116: Flags [P.], seq 7628:7664, ack 1, win 501, length 36
05:59:18.168826 IP lamp-ubuntu-s-1vcpu-1gb-tor1-01.ssh > cpee0dbd127d1d4-cme0dbd127d1d2.cpe.net.cable.rogers.com.65116: Flags [P.], seq 7664:7860, ack 1, win 501, length 196
05:59:18.168912 IP lamp-ubuntu-s-1vcpu-1gb-tor1-01.ssh > cpee0dbd127d1d4-cme0dbd127d1d2.cpe.net.cable.rogers.com.65116: Flags [P.], seq 7860:7896, ack 1, win 501, length 36
05:59:18.169039 IP lamp-ubuntu-s-1vcpu-1gb-tor1-01.ssh > cpee0dbd127d1d4-cme0dbd127d1d2.cpe.net.cable.rogers.com.65116: Flags [P.], seq 7896:8108, ack 1, win 501, length 212
05:59:18.169184 IP lamp-ubuntu-s-1vcpu-1gb-tor1-01.ssh > cpee0dbd127d1d4-cme0dbd127d1d2.cpe.net.cable.rogers.com.65116: Flags [P.], seq 8108:8144, ack 1, win 501, length 36
05:59:18.169373 IP lamp-ubuntu-s-1vcpu-1gb-tor1-01.ssh > cpee0dbd127d1d4-cme0dbd127d1d2.cpe.net.cable.rogers.com.65116: Flags [P.], seq 8144:8356, ack 1, win 501, length 212
05:59:18.169520 IP lamp-ubuntu-s-1vcpu-1gb-tor1-01.ssh > cpee0dbd127d1d4-cme0dbd127d1d2.cpe.net.cable.rogers.com.65116: Flags [P.], seq 8356:8392, ack 1, win 501, length 36
05:59:18.169639 IP lamp-ubuntu-s-1vcpu-1gb-tor1-01.ssh > cpee0dbd127d1d4-cme0dbd127d1d2.cpe.net.cable.rogers.com.65116: Flags [P.], seq 8392:8604, ack 1, win 501, length 212
05:59:18.169923 IP lamp-ubuntu-s-1vcpu-1gb-tor1-01.ssh > cpee0dbd127d1d4-cme0dbd127d1d2.cpe.net.cable.rogers.com.65116: Flags [P.], seq 8604:8640, ack 1, win 501, length 36
05:59:18.170134 IP lamp-ubuntu-s-1vcpu-1gb-tor1-01.ssh > cpee0dbd127d1d4-cme0dbd127d1d2.cpe.net.cable.rogers.com.65116: Flags [P.], seq 8640:8852, ack 1, win 501, length 212
05:59:18.170278 IP lamp-ubuntu-s-1vcpu-1gb-tor1-01.ssh > cpee0dbd127d1d4-cme0dbd127d1d2.cpe.net.cable.rogers.com.65116: Flags [P.], seq 8852:8888, ack 1, win 501, length 36
05:59:18.170413 IP lamp-ubuntu-s-1vcpu-1gb-tor1-01.ssh > cpee0dbd127d1d4-cme0dbd127d1d2.cpe.net.cable.rogers.com.65116: Flags [P.], seq 8888:9100, ack 1, win 501, length 212
05:59:18.170513 IP lamp-ubuntu-s-1vcpu-1gb-tor1-01.ssh > cpee0dbd127d1d4-cme0dbd127d1d2.cpe.net.cable.rogers.com.65116: Flags [P.], seq 9100:9136, ack 1, win 501, length 36
05:59:18.170648 IP lamp-ubuntu-s-1vcpu-1gb-tor1-01.ssh > cpee0dbd127d1d4-cme0dbd127d1d2.cpe.net.cable.rogers.com.65116: Flags [P.], seq 9136:9348, ack 1, win 501, length 212
05:59:18.170752 IP lamp-ubuntu-s-1vcpu-1gb-tor1-01.ssh > cpee0dbd127d1d4-cme0dbd127d1d2.cpe.net.cable.rogers.com.65116: Flags [P.], seq 9348:9384, ack 1, win 501, length 36
05:59:18.170883 IP lamp-ubuntu-s-1vcpu-1gb-tor1-01.ssh > cpee0dbd127d1d4-cme0dbd127d1d2.cpe.net.cable.rogers.com.65116: Flags [P.], seq 9384:9596, ack 1, win 501, length 212
05:59:18.170986 IP lamp-ubuntu-s-1vcpu-1gb-tor1-01.ssh > cpee0dbd127d1d4-cme0dbd127d1d2.cpe.net.cable.rogers.com.65116: Flags [P.], seq 9596:9632, ack 1, win 501, length 36
05:59:18.172923 IP cpee0dbd127d1d4-cme0dbd127d1d2.cpe.net.cable.rogers.com.65116 > lamp-ubuntu-s-1vcpu-1gb-tor1-01.ssh: Flags [.], ack 5944, win 509, length 0
05:59:18.172972 IP lamp-ubuntu-s-1vcpu-1gb-tor1-01.ssh > cpee0dbd127d1d4-cme0dbd127d1d2.cpe.net.cable.rogers.com.65116: Flags [P.], seq 9632:12552, ack 1, win 501, length 2920
05:59:18.173004 IP lamp-ubuntu-s-1vcpu-1gb-tor1-01.ssh > cpee0dbd127d1d4-cme0dbd127d1d2.cpe.net.cable.rogers.com.65116: Flags [P.], seq 12552:12608, ack 1, win 501, length 56
05:59:18.173159 IP lamp-ubuntu-s-1vcpu-1gb-tor1-01.ssh > cpee0dbd127d1d4-cme0dbd127d1d2.cpe.net.cable.rogers.com.65116: Flags [P.], seq 12608:12804, ack 1, win 501, length 196
05:59:18.173253 IP lamp-ubuntu-s-1vcpu-1gb-tor1-01.ssh > cpee0dbd127d1d4-cme0dbd127d1d2.cpe.net.cable.rogers.com.65116: Flags [P.], seq 12804:12840, ack 1, win 501, length 36
05:59:18.173365 IP lamp-ubuntu-s-1vcpu-1gb-tor1-01.ssh > cpee0dbd127d1d4-cme0dbd127d1d2.cpe.net.cable.rogers.com.65116: Flags [P.], seq 12840:13052, ack 1, win 501, length 212
05:59:18.173479 IP lamp-ubuntu-s-1vcpu-1gb-tor1-01.ssh > cpee0dbd127d1d4-cme0dbd127d1d2.cpe.net.cable.rogers.com.65116: Flags [P.], seq 13052:13264, ack 1, win 501, length 212
05:59:18.173593 IP lamp-ubuntu-s-1vcpu-1gb-tor1-01.ssh > cpee0dbd127d1d4-cme0dbd127d1d2.cpe.net.cable.rogers.com.65116: Flags [P.], seq 13264:13484, ack 1, win 501, length 220
05:59:18.173815 IP lamp-ubuntu-s-1vcpu-1gb-tor1-01.ssh > cpee0dbd127d1d4-cme0dbd127d1d2.cpe.net.cable.rogers.com.65116: Flags [P.], seq 13484:14224, ack 1, win 501, length 740
05:59:18.173953 IP lamp-ubuntu-s-1vcpu-1gb-tor1-01.ssh > cpee0dbd127d1d4-cme0dbd127d1d2.cpe.net.cable.rogers.com.65116: Flags [P.], seq 14224:14444, ack 1, win 501, length 220
05:59:18.174082 IP lamp-ubuntu-s-1vcpu-1gb-tor1-01.ssh > cpee0dbd127d1d4-cme0dbd127d1d2.cpe.net.cable.rogers.com.65116: Flags [P.], seq 14444:14656, ack 1, win 501, length 212
05:59:18.174211 IP lamp-ubuntu-s-1vcpu-1gb-tor1-01.ssh > cpee0dbd127d1d4-cme0dbd127d1d2.cpe.net.cable.rogers.com.65116: Flags [P.], seq 14656:14868, ack 1, win 501, length 212
05:59:18.174333 IP lamp-ubuntu-s-1vcpu-1gb-tor1-01.ssh > cpee0dbd127d1d4-cme0dbd127d1d2.cpe.net.cable.rogers.com.65116: Flags [P.], seq 14868:15080, ack 1, win 501, length 212
05:59:18.174459 IP lamp-ubuntu-s-1vcpu-1gb-tor1-01.ssh > cpee0dbd127d1d4-cme0dbd127d1d2.cpe.net.cable.rogers.com.65116: Flags [P.], seq 15080:15292, ack 1, win 501, length 212
05:59:18.174586 IP lamp-ubuntu-s-1vcpu-1gb-tor1-01.ssh > cpee0dbd127d1d4-cme0dbd127d1d2.cpe.net.cable.rogers.com.65116: Flags [P.], seq 15292:15504, ack 1, win 501, length 212
05:59:18.174710 IP lamp-ubuntu-s-1vcpu-1gb-tor1-01.ssh > cpee0dbd127d1d4-cme0dbd127d1d2.cpe.net.cable.rogers.com.65116: Flags [P.], seq 15504:15716, ack 1, win 501, length 212
05:59:18.174834 IP lamp-ubuntu-s-1vcpu-1gb-tor1-01.ssh > cpee0dbd127d1d4-cme0dbd127d1d2.cpe.net.cable.rogers.com.65116: Flags [P.], seq 15716:15928, ack 1, win 501, length 212
05:59:18.174960 IP lamp-ubuntu-s-1vcpu-1gb-tor1-01.ssh > cpee0dbd127d1d4-cme0dbd127d1d2.cpe.net.cable.rogers.com.65116: Flags [P.], seq 15928:16140, ack 1, win 501, length 212
05:59:18.175104 IP lamp-ubuntu-s-1vcpu-1gb-tor1-01.ssh > cpee0dbd127d1d4-cme0dbd127d1d2.cpe.net.cable.rogers.com.65116: Flags [P.], seq 16140:16352, ack 1, win 501, length 212
05:59:18.175227 IP lamp-ubuntu-s-1vcpu-1gb-tor1-01.ssh > cpee0dbd127d1d4-cme0dbd127d1d2.cpe.net.cable.rogers.com.65116: Flags [P.], seq 16352:16564, ack 1, win 501, length 212
05:59:18.180271 IP cpee0dbd127d1d4-cme0dbd127d1d2.cpe.net.cable.rogers.com.65116 > lamp-ubuntu-s-1vcpu-1gb-tor1-01.ssh: Flags [.], ack 8356, win 509, length 0
05:59:18.180318 IP lamp-ubuntu-s-1vcpu-1gb-tor1-01.ssh > cpee0dbd127d1d4-cme0dbd127d1d2.cpe.net.cable.rogers.com.65116: Flags [P.], seq 16564:16776, ack 1, win 501, length 212
05:59:18.180553 IP lamp-ubuntu-s-1vcpu-1gb-tor1-01.ssh > cpee0dbd127d1d4-cme0dbd127d1d2.cpe.net.cable.rogers.com.65116: Flags [P.], seq 16776:17148, ack 1, win 501, length 372
05:59:18.180696 IP lamp-ubuntu-s-1vcpu-1gb-tor1-01.ssh > cpee0dbd127d1d4-cme0dbd127d1d2.cpe.net.cable.rogers.com.65116: Flags [P.], seq 17148:17360, ack 1, win 501, length 212
05:59:18.180826 IP lamp-ubuntu-s-1vcpu-1gb-tor1-01.ssh > cpee0dbd127d1d4-cme0dbd127d1d2.cpe.net.cable.rogers.com.65116: Flags [P.], seq 17360:17572, ack 1, win 501, length 212
05:59:18.180972 IP lamp-ubuntu-s-1vcpu-1gb-tor1-01.ssh > cpee0dbd127d1d4-cme0dbd127d1d2.cpe.net.cable.rogers.com.65116: Flags [P.], seq 17572:17784, ack 1, win 501, length 212
05:59:18.181102 IP lamp-ubuntu-s-1vcpu-1gb-tor1-01.ssh > cpee0dbd127d1d4-cme0dbd127d1d2.cpe.net.cable.rogers.com.65116: Flags [P.], seq 17784:17996, ack 1, win 501, length 212
05:59:18.181228 IP lamp-ubuntu-s-1vcpu-1gb-tor1-01.ssh > cpee0dbd127d1d4-cme0dbd127d1d2.cpe.net.cable.rogers.com.65116: Flags [P.], seq 17996:18208, ack 1, win 501, length 212
05:59:18.181350 IP lamp-ubuntu-s-1vcpu-1gb-tor1-01.ssh > cpee0dbd127d1d4-cme0dbd127d1d2.cpe.net.cable.rogers.com.65116: Flags [P.], seq 18208:18420, ack 1, win 501, length 212
05:59:18.181481 IP lamp-ubuntu-s-1vcpu-1gb-tor1-01.ssh > cpee0dbd127d1d4-cme0dbd127d1d2.cpe.net.cable.rogers.com.65116: Flags [P.], seq 18420:18632, ack 1, win 501, length 212
05:59:18.181606 IP lamp-ubuntu-s-1vcpu-1gb-tor1-01.ssh > cpee0dbd127d1d4-cme0dbd127d1d2.cpe.net.cable.rogers.com.65116: Flags [P.], seq 18632:18844, ack 1, win 501, length 212
05:59:18.181729 IP lamp-ubuntu-s-1vcpu-1gb-tor1-01.ssh > cpee0dbd127d1d4-cme0dbd127d1d2.cpe.net.cable.rogers.com.65116: Flags [P.], seq 18844:19056, ack 1, win 501, length 212
05:59:18.181874 IP lamp-ubuntu-s-1vcpu-1gb-tor1-01.ssh > cpee0dbd127d1d4-cme0dbd127d1d2.cpe.net.cable.rogers.com.65116: Flags [P.], seq 19056:19268, ack 1, win 501, length 212
05:59:18.181999 IP lamp-ubuntu-s-1vcpu-1gb-tor1-01.ssh > cpee0dbd127d1d4-cme0dbd127d1d2.cpe.net.cable.rogers.com.65116: Flags [P.], seq 19268:19480, ack 1, win 501, length 212
05:59:18.182121 IP lamp-ubuntu-s-1vcpu-1gb-tor1-01.ssh > cpee0dbd127d1d4-cme0dbd127d1d2.cpe.net.cable.rogers.com.65116: Flags [P.], seq 19480:19692, ack 1, win 501, length 212
05:59:18.182247 IP lamp-ubuntu-s-1vcpu-1gb-tor1-01.ssh > cpee0dbd127d1d4-cme0dbd127d1d2.cpe.net.cable.rogers.com.65116: Flags [P.], seq 19692:19904, ack 1, win 501, length 212
05:59:18.182374 IP lamp-ubuntu-s-1vcpu-1gb-tor1-01.ssh > cpee0dbd127d1d4-cme0dbd127d1d2.cpe.net.cable.rogers.com.65116: Flags [P.], seq 19904:20116, ack 1, win 501, length 212
05:59:18.182498 IP lamp-ubuntu-s-1vcpu-1gb-tor1-01.ssh > cpee0dbd127d1d4-cme0dbd127d1d2.cpe.net.cable.rogers.com.65116: Flags [P.], seq 20116:20328, ack 1, win 501, length 212
05:59:18.182620 IP lamp-ubuntu-s-1vcpu-1gb-tor1-01.ssh > cpee0dbd127d1d4-cme0dbd127d1d2.cpe.net.cable.rogers.com.65116: Flags [P.], seq 20328:20540, ack 1, win 501, length 212
05:59:18.184116 IP cpee0dbd127d1d4-cme0dbd127d1d2.cpe.net.cable.rogers.com.65116 > lamp-ubuntu-s-1vcpu-1gb-tor1-01.ssh: Flags [.], ack 13052, win 513, length 0
05:59:18.184116 IP cpee0dbd127d1d4-cme0dbd127d1d2.cpe.net.cable.rogers.com.65116 > lamp-ubuntu-s-1vcpu-1gb-tor1-01.ssh: Flags [.], ack 16564, win 509, length 0
05:59:18.184172 IP lamp-ubuntu-s-1vcpu-1gb-tor1-01.ssh > cpee0dbd127d1d4-cme0dbd127d1d2.cpe.net.cable.rogers.com.65116: Flags [P.], seq 20540:20752, ack 1, win 501, length 212
05:59:18.184407 IP lamp-ubuntu-s-1vcpu-1gb-tor1-01.ssh > cpee0dbd127d1d4-cme0dbd127d1d2.cpe.net.cable.rogers.com.65116: Flags [P.], seq 20752:21292, ack 1, win 501, length 540
05:59:18.184550 IP lamp-ubuntu-s-1vcpu-1gb-tor1-01.ssh > cpee0dbd127d1d4-cme0dbd127d1d2.cpe.net.cable.rogers.com.65116: Flags [P.], seq 21292:21504, ack 1, win 501, length 212
05:59:18.184682 IP lamp-ubuntu-s-1vcpu-1gb-tor1-01.ssh > cpee0dbd127d1d4-cme0dbd127d1d2.cpe.net.cable.rogers.com.65116: Flags [P.], seq 21504:21716, ack 1, win 501, length 212
05:59:18.184803 IP lamp-ubuntu-s-1vcpu-1gb-tor1-01.ssh > cpee0dbd127d1d4-cme0dbd127d1d2.cpe.net.cable.rogers.com.65116: Flags [P.], seq 21716:21928, ack 1, win 501, length 212
05:59:18.184947 IP lamp-ubuntu-s-1vcpu-1gb-tor1-01.ssh > cpee0dbd127d1d4-cme0dbd127d1d2.cpe.net.cable.rogers.com.65116: Flags [P.], seq 21928:22140, ack 1, win 501, length 212
05:59:18.185123 IP lamp-ubuntu-s-1vcpu-1gb-tor1-01.ssh > cpee0dbd127d1d4-cme0dbd127d1d2.cpe.net.cable.rogers.com.65116: Flags [P.], seq 22140:22352, ack 1, win 501, length 212
05:59:18.185254 IP lamp-ubuntu-s-1vcpu-1gb-tor1-01.ssh > cpee0dbd127d1d4-cme0dbd127d1d2.cpe.net.cable.rogers.com.65116: Flags [P.], seq 22352:22564, ack 1, win 501, length 212
05:59:18.185379 IP lamp-ubuntu-s-1vcpu-1gb-tor1-01.ssh > cpee0dbd127d1d4-cme0dbd127d1d2.cpe.net.cable.rogers.com.65116: Flags [P.], seq 22564:22776, ack 1, win 501, length 212
05:59:18.185496 IP lamp-ubuntu-s-1vcpu-1gb-tor1-01.ssh > cpee0dbd127d1d4-cme0dbd127d1d2.cpe.net.cable.rogers.com.65116: Flags [P.], seq 22776:22988, ack 1, win 501, length 212
05:59:18.185621 IP lamp-ubuntu-s-1vcpu-1gb-tor1-01.ssh > cpee0dbd127d1d4-cme0dbd127d1d2.cpe.net.cable.rogers.com.65116: Flags [P.], seq 22988:23200, ack 1, win 501, length 212
05:59:18.185740 IP lamp-ubuntu-s-1vcpu-1gb-tor1-01.ssh > cpee0dbd127d1d4-cme0dbd127d1d2.cpe.net.cable.rogers.com.65116: Flags [P.], seq 23200:23412, ack 1, win 501, length 212
05:59:18.185884 IP lamp-ubuntu-s-1vcpu-1gb-tor1-01.ssh > cpee0dbd127d1d4-cme0dbd127d1d2.cpe.net.cable.rogers.com.65116: Flags [P.], seq 23412:23624, ack 1, win 501, length 212
05:59:18.186012 IP lamp-ubuntu-s-1vcpu-1gb-tor1-01.ssh > cpee0dbd127d1d4-cme0dbd127d1d2.cpe.net.cable.rogers.com.65116: Flags [P.], seq 23624:23836, ack 1, win 501, length 212
05:59:18.186136 IP lamp-ubuntu-s-1vcpu-1gb-tor1-01.ssh > cpee0dbd127d1d4-cme0dbd127d1d2.cpe.net.cable.rogers.com.65116: Flags [P.], seq 23836:24048, ack 1, win 501, length 212
05:59:18.186274 IP lamp-ubuntu-s-1vcpu-1gb-tor1-01.ssh > cpee0dbd127d1d4-cme0dbd127d1d2.cpe.net.cable.rogers.com.65116: Flags [P.], seq 24048:24260, ack 1, win 501, length 212
05:59:18.186407 IP lamp-ubuntu-s-1vcpu-1gb-tor1-01.ssh > cpee0dbd127d1d4-cme0dbd127d1d2.cpe.net.cable.rogers.com.65116: Flags [P.], seq 24260:24472, ack 1, win 501, length 212
05:59:18.186577 IP lamp-ubuntu-s-1vcpu-1gb-tor1-01.ssh > cpee0dbd127d1d4-cme0dbd127d1d2.cpe.net.cable.rogers.com.65116: Flags [P.], seq 24472:24684, ack 1, win 501, length 212
05:59:18.186710 IP lamp-ubuntu-s-1vcpu-1gb-tor1-01.ssh > cpee0dbd127d1d4-cme0dbd127d1d2.cpe.net.cable.rogers.com.65116: Flags [P.], seq 24684:24896, ack 1, win 501, length 212
05:59:18.186874 IP lamp-ubuntu-s-1vcpu-1gb-tor1-01.ssh > cpee0dbd127d1d4-cme0dbd127d1d2.cpe.net.cable.rogers.com.65116: Flags [P.], seq 24896:25108, ack 1, win 501, length 212
05:59:18.187061 IP lamp-ubuntu-s-1vcpu-1gb-tor1-01.ssh > cpee0dbd127d1d4-cme0dbd127d1d2.cpe.net.cable.rogers.com.65116: Flags [P.], seq 25108:25320, ack 1, win 501, length 212
05:59:18.187194 IP lamp-ubuntu-s-1vcpu-1gb-tor1-01.ssh > cpee0dbd127d1d4-cme0dbd127d1d2.cpe.net.cable.rogers.com.65116: Flags [P.], seq 25320:25532, ack 1, win 501, length 212
05:59:18.187325 IP lamp-ubuntu-s-1vcpu-1gb-tor1-01.ssh > cpee0dbd127d1d4-cme0dbd127d1d2.cpe.net.cable.rogers.com.65116: Flags [P.], seq 25532:25744, ack 1, win 501, length 212
05:59:18.187445 IP lamp-ubuntu-s-1vcpu-1gb-tor1-01.ssh > cpee0dbd127d1d4-cme0dbd127d1d2.cpe.net.cable.rogers.com.65116: Flags [P.], seq 25744:25956, ack 1, win 501, length 212
05:59:18.187572 IP lamp-ubuntu-s-1vcpu-1gb-tor1-01.ssh > cpee0dbd127d1d4-cme0dbd127d1d2.cpe.net.cable.rogers.com.65116: Flags [P.], seq 25956:26168, ack 1, win 501, length 212
05:59:18.187689 IP lamp-ubuntu-s-1vcpu-1gb-tor1-01.ssh > cpee0dbd127d1d4-cme0dbd127d1d2.cpe.net.cable.rogers.com.65116: Flags [P.], seq 26168:26380, ack 1, win 501, length 212
05:59:18.187814 IP lamp-ubuntu-s-1vcpu-1gb-tor1-01.ssh > cpee0dbd127d1d4-cme0dbd127d1d2.cpe.net.cable.rogers.com.65116: Flags [P.], seq 26380:26592, ack 1, win 501, length 212
05:59:18.187936 IP lamp-ubuntu-s-1vcpu-1gb-tor1-01.ssh > cpee0dbd127d1d4-cme0dbd127d1d2.cpe.net.cable.rogers.com.65116: Flags [P.], seq 26592:26804, ack 1, win 501, length 212
05:59:18.188051 IP lamp-ubuntu-s-1vcpu-1gb-tor1-01.ssh > cpee0dbd127d1d4-cme0dbd127d1d2.cpe.net.cable.rogers.com.65116: Flags [P.], seq 26804:27016, ack 1, win 501, length 212
05:59:18.188169 IP lamp-ubuntu-s-1vcpu-1gb-tor1-01.ssh > cpee0dbd127d1d4-cme0dbd127d1d2.cpe.net.cable.rogers.com.65116: Flags [P.], seq 27016:27228, ack 1, win 501, length 212
05:59:18.188313 IP lamp-ubuntu-s-1vcpu-1gb-tor1-01.ssh > cpee0dbd127d1d4-cme0dbd127d1d2.cpe.net.cable.rogers.com.65116: Flags [P.], seq 27228:27440, ack 1, win 501, length 212
05:59:18.188439 IP lamp-ubuntu-s-1vcpu-1gb-tor1-01.ssh > cpee0dbd127d1d4-cme0dbd127d1d2.cpe.net.cable.rogers.com.65116: Flags [P.], seq 27440:27652, ack 1, win 501, length 212
05:59:18.188556 IP lamp-ubuntu-s-1vcpu-1gb-tor1-01.ssh > cpee0dbd127d1d4-cme0dbd127d1d2.cpe.net.cable.rogers.com.65116: Flags [P.], seq 27652:27864, ack 1, win 501, length 212
05:59:18.188684 IP lamp-ubuntu-s-1vcpu-1gb-tor1-01.ssh > cpee0dbd127d1d4-cme0dbd127d1d2.cpe.net.cable.rogers.com.65116: Flags [P.], seq 27864:28076, ack 1, win 501, length 212
05:59:18.188807 IP lamp-ubuntu-s-1vcpu-1gb-tor1-01.ssh > cpee0dbd127d1d4-cme0dbd127d1d2.cpe.net.cable.rogers.com.65116: Flags [P.], seq 28076:28288, ack 1, win 501, length 212
05:59:18.188928 IP lamp-ubuntu-s-1vcpu-1gb-tor1-01.ssh > cpee0dbd127d1d4-cme0dbd127d1d2.cpe.net.cable.rogers.com.65116: Flags [P.], seq 28288:28500, ack 1, win 501, length 212
05:59:18.189084 IP cpee0dbd127d1d4-cme0dbd127d1d2.cpe.net.cable.rogers.com.65116 > lamp-ubuntu-s-1vcpu-1gb-tor1-01.ssh: Flags [.], ack 20116, win 508, length 0
05:59:18.189084 IP cpee0dbd127d1d4-cme0dbd127d1d2.cpe.net.cable.rogers.com.65116 > lamp-ubuntu-s-1vcpu-1gb-tor1-01.ssh: Flags [.], ack 20540, win 513, length 0
05:59:18.189256 IP lamp-ubuntu-s-1vcpu-1gb-tor1-01.ssh > cpee0dbd127d1d4-cme0dbd127d1d2.cpe.net.cable.rogers.com.65116: Flags [P.], seq 28500:28712, ack 1, win 501, length 212
05:59:18.189385 IP lamp-ubuntu-s-1vcpu-1gb-tor1-01.ssh > cpee0dbd127d1d4-cme0dbd127d1d2.cpe.net.cable.rogers.com.65116: Flags [P.], seq 28712:29068, ack 1, win 501, length 356
05:59:18.189556 IP lamp-ubuntu-s-1vcpu-1gb-tor1-01.ssh > cpee0dbd127d1d4-cme0dbd127d1d2.cpe.net.cable.rogers.com.65116: Flags [P.], seq 29068:29280, ack 1, win 501, length 212
05:59:18.189647 IP lamp-ubuntu-s-1vcpu-1gb-tor1-01.ssh > cpee0dbd127d1d4-cme0dbd127d1d2.cpe.net.cable.rogers.com.65116: Flags [P.], seq 29280:29492, ack 1, win 501, length 212
05:59:18.189799 IP lamp-ubuntu-s-1vcpu-1gb-tor1-01.ssh > cpee0dbd127d1d4-cme0dbd127d1d2.cpe.net.cable.rogers.com.65116: Flags [P.], seq 29492:29880, ack 1, win 501, length 388
05:59:18.189973 IP lamp-ubuntu-s-1vcpu-1gb-tor1-01.ssh > cpee0dbd127d1d4-cme0dbd127d1d2.cpe.net.cable.rogers.com.65116: Flags [P.], seq 29880:30092, ack 1, win 501, length 212
05:59:18.190152 IP lamp-ubuntu-s-1vcpu-1gb-tor1-01.ssh > cpee0dbd127d1d4-cme0dbd127d1d2.cpe.net.cable.rogers.com.65116: Flags [P.], seq 30092:30304, ack 1, win 501, length 212
05:59:18.190287 IP lamp-ubuntu-s-1vcpu-1gb-tor1-01.ssh > cpee0dbd127d1d4-cme0dbd127d1d2.cpe.net.cable.rogers.com.65116: Flags [P.], seq 30304:30516, ack 1, win 501, length 212
05:59:18.190417 IP lamp-ubuntu-s-1vcpu-1gb-tor1-01.ssh > cpee0dbd127d1d4-cme0dbd127d1d2.cpe.net.cable.rogers.com.65116: Flags [P.], seq 30516:30728, ack 1, win 501, length 212
05:59:18.190543 IP lamp-ubuntu-s-1vcpu-1gb-tor1-01.ssh > cpee0dbd127d1d4-cme0dbd127d1d2.cpe.net.cable.rogers.com.65116: Flags [P.], seq 30728:30940, ack 1, win 501, length 212
05:59:18.190674 IP lamp-ubuntu-s-1vcpu-1gb-tor1-01.ssh > cpee0dbd127d1d4-cme0dbd127d1d2.cpe.net.cable.rogers.com.65116: Flags [P.], seq 30940:31152, ack 1, win 501, length 212
05:59:18.190793 IP lamp-ubuntu-s-1vcpu-1gb-tor1-01.ssh > cpee0dbd127d1d4-cme0dbd127d1d2.cpe.net.cable.rogers.com.65116: Flags [P.], seq 31152:31364, ack 1, win 501, length 212
05:59:18.190913 IP lamp-ubuntu-s-1vcpu-1gb-tor1-01.ssh > cpee0dbd127d1d4-cme0dbd127d1d2.cpe.net.cable.rogers.com.65116: Flags [P.], seq 31364:31576, ack 1, win 501, length 212
05:59:18.191032 IP lamp-ubuntu-s-1vcpu-1gb-tor1-01.ssh > cpee0dbd127d1d4-cme0dbd127d1d2.cpe.net.cable.rogers.com.65116: Flags [P.], seq 31576:31788, ack 1, win 501, length 212
05:59:18.191147 IP lamp-ubuntu-s-1vcpu-1gb-tor1-01.ssh > cpee0dbd127d1d4-cme0dbd127d1d2.cpe.net.cable.rogers.com.65116: Flags [P.], seq 31788:32000, ack 1, win 501, length 212
05:59:18.191270 IP lamp-ubuntu-s-1vcpu-1gb-tor1-01.ssh > cpee0dbd127d1d4-cme0dbd127d1d2.cpe.net.cable.rogers.com.65116: Flags [P.], seq 32000:32212, ack 1, win 501, length 212
05:59:18.191385 IP lamp-ubuntu-s-1vcpu-1gb-tor1-01.ssh > cpee0dbd127d1d4-cme0dbd127d1d2.cpe.net.cable.rogers.com.65116: Flags [P.], seq 32212:32424, ack 1, win 501, length 212
05:59:18.191527 IP lamp-ubuntu-s-1vcpu-1gb-tor1-01.ssh > cpee0dbd127d1d4-cme0dbd127d1d2.cpe.net.cable.rogers.com.65116: Flags [P.], seq 32424:32636, ack 1, win 501, length 212
05:59:18.191758 IP lamp-ubuntu-s-1vcpu-1gb-tor1-01.ssh > cpee0dbd127d1d4-cme0dbd127d1d2.cpe.net.cable.rogers.com.65116: Flags [P.], seq 32636:32848, ack 1, win 501, length 212
05:59:18.191977 IP lamp-ubuntu-s-1vcpu-1gb-tor1-01.ssh > cpee0dbd127d1d4-cme0dbd127d1d2.cpe.net.cable.rogers.com.65116: Flags [P.], seq 32848:33060, ack 1, win 501, length 212
05:59:18.192106 IP lamp-ubuntu-s-1vcpu-1gb-tor1-01.ssh > cpee0dbd127d1d4-cme0dbd127d1d2.cpe.net.cable.rogers.com.65116: Flags [P.], seq 33060:33272, ack 1, win 501, length 212
05:59:18.192253 IP lamp-ubuntu-s-1vcpu-1gb-tor1-01.ssh > cpee0dbd127d1d4-cme0dbd127d1d2.cpe.net.cable.rogers.com.65116: Flags [P.], seq 33272:33484, ack 1, win 501, length 212
05:59:18.192378 IP lamp-ubuntu-s-1vcpu-1gb-tor1-01.ssh > cpee0dbd127d1d4-cme0dbd127d1d2.cpe.net.cable.rogers.com.65116: Flags [P.], seq 33484:33696, ack 1, win 501, length 212
05:59:18.192499 IP lamp-ubuntu-s-1vcpu-1gb-tor1-01.ssh > cpee0dbd127d1d4-cme0dbd127d1d2.cpe.net.cable.rogers.com.65116: Flags [P.], seq 33696:33908, ack 1, win 501, length 212
05:59:18.192617 IP lamp-ubuntu-s-1vcpu-1gb-tor1-01.ssh > cpee0dbd127d1d4-cme0dbd127d1d2.cpe.net.cable.rogers.com.65116: Flags [P.], seq 33908:34120, ack 1, win 501, length 212
05:59:18.192733 IP lamp-ubuntu-s-1vcpu-1gb-tor1-01.ssh > cpee0dbd127d1d4-cme0dbd127d1d2.cpe.net.cable.rogers.com.65116: Flags [P.], seq 34120:34332, ack 1, win 501, length 212
05:59:18.192914 IP lamp-ubuntu-s-1vcpu-1gb-tor1-01.ssh > cpee0dbd127d1d4-cme0dbd127d1d2.cpe.net.cable.rogers.com.65116: Flags [P.], seq 34332:34544, ack 1, win 501, length 212
05:59:18.193054 IP lamp-ubuntu-s-1vcpu-1gb-tor1-01.ssh > cpee0dbd127d1d4-cme0dbd127d1d2.cpe.net.cable.rogers.com.65116: Flags [P.], seq 34544:34756, ack 1, win 501, length 212
05:59:18.193173 IP lamp-ubuntu-s-1vcpu-1gb-tor1-01.ssh > cpee0dbd127d1d4-cme0dbd127d1d2.cpe.net.cable.rogers.com.65116: Flags [P.], seq 34756:34968, ack 1, win 501, length 212
05:59:18.193292 IP lamp-ubuntu-s-1vcpu-1gb-tor1-01.ssh > cpee0dbd127d1d4-cme0dbd127d1d2.cpe.net.cable.rogers.com.65116: Flags [P.], seq 34968:35180, ack 1, win 501, length 212
05:59:18.193406 IP lamp-ubuntu-s-1vcpu-1gb-tor1-01.ssh > cpee0dbd127d1d4-cme0dbd127d1d2.cpe.net.cable.rogers.com.65116: Flags [P.], seq 35180:35392, ack 1, win 501, length 212
05:59:18.193525 IP lamp-ubuntu-s-1vcpu-1gb-tor1-01.ssh > cpee0dbd127d1d4-cme0dbd127d1d2.cpe.net.cable.rogers.com.65116: Flags [P.], seq 35392:35604, ack 1, win 501, length 212
05:59:18.193715 IP lamp-ubuntu-s-1vcpu-1gb-tor1-01.ssh > cpee0dbd127d1d4-cme0dbd127d1d2.cpe.net.cable.rogers.com.65116: Flags [P.], seq 35604:35816, ack 1, win 501, length 212
05:59:18.193925 IP lamp-ubuntu-s-1vcpu-1gb-tor1-01.ssh > cpee0dbd127d1d4-cme0dbd127d1d2.cpe.net.cable.rogers.com.65116: Flags [P.], seq 35816:36028, ack 1, win 501, length 212
05:59:18.194125 IP lamp-ubuntu-s-1vcpu-1gb-tor1-01.ssh > cpee0dbd127d1d4-cme0dbd127d1d2.cpe.net.cable.rogers.com.65116: Flags [P.], seq 36028:36240, ack 1, win 501, length 212
05:59:18.194317 IP lamp-ubuntu-s-1vcpu-1gb-tor1-01.ssh > cpee0dbd127d1d4-cme0dbd127d1d2.cpe.net.cable.rogers.com.65116: Flags [P.], seq 36240:36452, ack 1, win 501, length 212
05:59:18.194532 IP lamp-ubuntu-s-1vcpu-1gb-tor1-01.ssh > cpee0dbd127d1d4-cme0dbd127d1d2.cpe.net.cable.rogers.com.65116: Flags [P.], seq 36452:36664, ack 1, win 501, length 212
05:59:18.194717 IP lamp-ubuntu-s-1vcpu-1gb-tor1-01.ssh > cpee0dbd127d1d4-cme0dbd127d1d2.cpe.net.cable.rogers.com.65116: Flags [P.], seq 36664:36876, ack 1, win 501, length 212
05:59:18.194845 IP lamp-ubuntu-s-1vcpu-1gb-tor1-01.ssh > cpee0dbd127d1d4-cme0dbd127d1d2.cpe.net.cable.rogers.com.65116: Flags [P.], seq 36876:37088, ack 1, win 501, length 212
05:59:18.194968 IP lamp-ubuntu-s-1vcpu-1gb-tor1-01.ssh > cpee0dbd127d1d4-cme0dbd127d1d2.cpe.net.cable.rogers.com.65116: Flags [P.], seq 37088:37300, ack 1, win 501, length 212
05:59:18.195131 IP lamp-ubuntu-s-1vcpu-1gb-tor1-01.ssh > cpee0dbd127d1d4-cme0dbd127d1d2.cpe.net.cable.rogers.com.65116: Flags [P.], seq 37300:37512, ack 1, win 501, length 212
05:59:18.195299 IP lamp-ubuntu-s-1vcpu-1gb-tor1-01.ssh > cpee0dbd127d1d4-cme0dbd127d1d2.cpe.net.cable.rogers.com.65116: Flags [P.], seq 37512:37724, ack 1, win 501, length 212
05:59:18.195440 IP lamp-ubuntu-s-1vcpu-1gb-tor1-01.ssh > cpee0dbd127d1d4-cme0dbd127d1d2.cpe.net.cable.rogers.com.65116: Flags [P.], seq 37724:37936, ack 1, win 501, length 212
05:59:18.195566 IP lamp-ubuntu-s-1vcpu-1gb-tor1-01.ssh > cpee0dbd127d1d4-cme0dbd127d1d2.cpe.net.cable.rogers.com.65116: Flags [P.], seq 37936:38148, ack 1, win 501, length 212
05:59:18.195682 IP lamp-ubuntu-s-1vcpu-1gb-tor1-01.ssh > cpee0dbd127d1d4-cme0dbd127d1d2.cpe.net.cable.rogers.com.65116: Flags [P.], seq 38148:38360, ack 1, win 501, length 212
05:59:18.195802 IP lamp-ubuntu-s-1vcpu-1gb-tor1-01.ssh > cpee0dbd127d1d4-cme0dbd127d1d2.cpe.net.cable.rogers.com.65116: Flags [P.], seq 38360:38572, ack 1, win 501, length 212
05:59:18.196015 IP lamp-ubuntu-s-1vcpu-1gb-tor1-01.ssh > cpee0dbd127d1d4-cme0dbd127d1d2.cpe.net.cable.rogers.com.65116: Flags [P.], seq 38572:38784, ack 1, win 501, length 212
05:59:18.196154 IP lamp-ubuntu-s-1vcpu-1gb-tor1-01.ssh > cpee0dbd127d1d4-cme0dbd127d1d2.cpe.net.cable.rogers.com.65116: Flags [P.], seq 38784:38996, ack 1, win 501, length 212
05:59:18.196332 IP lamp-ubuntu-s-1vcpu-1gb-tor1-01.ssh > cpee0dbd127d1d4-cme0dbd127d1d2.cpe.net.cable.rogers.com.65116: Flags [P.], seq 38996:39208, ack 1, win 501, length 212
05:59:18.196464 IP lamp-ubuntu-s-1vcpu-1gb-tor1-01.ssh > cpee0dbd127d1d4-cme0dbd127d1d2.cpe.net.cable.rogers.com.65116: Flags [P.], seq 39208:39420, ack 1, win 501, length 212
05:59:18.196592 IP lamp-ubuntu-s-1vcpu-1gb-tor1-01.ssh > cpee0dbd127d1d4-cme0dbd127d1d2.cpe.net.cable.rogers.com.65116: Flags [P.], seq 39420:39632, ack 1, win 501, length 212
05:59:18.196738 IP lamp-ubuntu-s-1vcpu-1gb-tor1-01.ssh > cpee0dbd127d1d4-cme0dbd127d1d2.cpe.net.cable.rogers.com.65116: Flags [P.], seq 39632:39844, ack 1, win 501, length 212
05:59:18.196904 IP lamp-ubuntu-s-1vcpu-1gb-tor1-01.ssh > cpee0dbd127d1d4-cme0dbd127d1d2.cpe.net.cable.rogers.com.65116: Flags [P.], seq 39844:40056, ack 1, win 501, length 212
05:59:18.197112 IP lamp-ubuntu-s-1vcpu-1gb-tor1-01.ssh > cpee0dbd127d1d4-cme0dbd127d1d2.cpe.net.cable.rogers.com.65116: Flags [P.], seq 40056:40268, ack 1, win 501, length 212
05:59:18.197245 IP lamp-ubuntu-s-1vcpu-1gb-tor1-01.ssh > cpee0dbd127d1d4-cme0dbd127d1d2.cpe.net.cable.rogers.com.65116: Flags [P.], seq 40268:40480, ack 1, win 501, length 212
05:59:18.197375 IP lamp-ubuntu-s-1vcpu-1gb-tor1-01.ssh > cpee0dbd127d1d4-cme0dbd127d1d2.cpe.net.cable.rogers.com.65116: Flags [P.], seq 40480:40692, ack 1, win 501, length 212
05:59:18.197490 IP lamp-ubuntu-s-1vcpu-1gb-tor1-01.ssh > cpee0dbd127d1d4-cme0dbd127d1d2.cpe.net.cable.rogers.com.65116: Flags [P.], seq 40692:40904, ack 1, win 501, length 212
05:59:18.197614 IP lamp-ubuntu-s-1vcpu-1gb-tor1-01.ssh > cpee0dbd127d1d4-cme0dbd127d1d2.cpe.net.cable.rogers.com.65116: Flags [P.], seq 40904:41116, ack 1, win 501, length 212
05:59:18.197730 IP lamp-ubuntu-s-1vcpu-1gb-tor1-01.ssh > cpee0dbd127d1d4-cme0dbd127d1d2.cpe.net.cable.rogers.com.65116: Flags [P.], seq 41116:41328, ack 1, win 501, length 212
05:59:18.197870 IP lamp-ubuntu-s-1vcpu-1gb-tor1-01.ssh > cpee0dbd127d1d4-cme0dbd127d1d2.cpe.net.cable.rogers.com.65116: Flags [P.], seq 41328:41540, ack 1, win 501, length 212
05:59:18.197994 IP lamp-ubuntu-s-1vcpu-1gb-tor1-01.ssh > cpee0dbd127d1d4-cme0dbd127d1d2.cpe.net.cable.rogers.com.65116: Flags [P.], seq 41540:41752, ack 1, win 501, length 212
05:59:18.198098 IP cpee0dbd127d1d4-cme0dbd127d1d2.cpe.net.cable.rogers.com.65116 > lamp-ubuntu-s-1vcpu-1gb-tor1-01.ssh: Flags [.], ack 22776, win 511, length 0
05:59:18.198216 IP lamp-ubuntu-s-1vcpu-1gb-tor1-01.ssh > cpee0dbd127d1d4-cme0dbd127d1d2.cpe.net.cable.rogers.com.65116: Flags [P.], seq 41752:42124, ack 1, win 501, length 372
05:59:18.198345 IP lamp-ubuntu-s-1vcpu-1gb-tor1-01.ssh > cpee0dbd127d1d4-cme0dbd127d1d2.cpe.net.cable.rogers.com.65116: Flags [P.], seq 42124:42336, ack 1, win 501, length 212
05:59:18.198465 IP lamp-ubuntu-s-1vcpu-1gb-tor1-01.ssh > cpee0dbd127d1d4-cme0dbd127d1d2.cpe.net.cable.rogers.com.65116: Flags [P.], seq 42336:42548, ack 1, win 501, length 212
05:59:18.198580 IP lamp-ubuntu-s-1vcpu-1gb-tor1-01.ssh > cpee0dbd127d1d4-cme0dbd127d1d2.cpe.net.cable.rogers.com.65116: Flags [P.], seq 42548:42760, ack 1, win 501, length 212
05:59:18.198704 IP lamp-ubuntu-s-1vcpu-1gb-tor1-01.ssh > cpee0dbd127d1d4-cme0dbd127d1d2.cpe.net.cable.rogers.com.65116: Flags [P.], seq 42760:42972, ack 1, win 501, length 212
05:59:18.198819 IP lamp-ubuntu-s-1vcpu-1gb-tor1-01.ssh > cpee0dbd127d1d4-cme0dbd127d1d2.cpe.net.cable.rogers.com.65116: Flags [P.], seq 42972:43184, ack 1, win 501, length 212
05:59:18.198942 IP lamp-ubuntu-s-1vcpu-1gb-tor1-01.ssh > cpee0dbd127d1d4-cme0dbd127d1d2.cpe.net.cable.rogers.com.65116: Flags [P.], seq 43184:43396, ack 1, win 501, length 212
05:59:18.199066 IP lamp-ubuntu-s-1vcpu-1gb-tor1-01.ssh > cpee0dbd127d1d4-cme0dbd127d1d2.cpe.net.cable.rogers.com.65116: Flags [P.], seq 43396:43608, ack 1, win 501, length 212
05:59:18.199183 IP lamp-ubuntu-s-1vcpu-1gb-tor1-01.ssh > cpee0dbd127d1d4-cme0dbd127d1d2.cpe.net.cable.rogers.com.65116: Flags [P.], seq 43608:43820, ack 1, win 501, length 212
05:59:18.199333 IP lamp-ubuntu-s-1vcpu-1gb-tor1-01.ssh > cpee0dbd127d1d4-cme0dbd127d1d2.cpe.net.cable.rogers.com.65116: Flags [P.], seq 43820:44032, ack 1, win 501, length 212
05:59:18.199500 IP lamp-ubuntu-s-1vcpu-1gb-tor1-01.ssh > cpee0dbd127d1d4-cme0dbd127d1d2.cpe.net.cable.rogers.com.65116: Flags [P.], seq 44032:44244, ack 1, win 501, length 212
05:59:18.199633 IP lamp-ubuntu-s-1vcpu-1gb-tor1-01.ssh > cpee0dbd127d1d4-cme0dbd127d1d2.cpe.net.cable.rogers.com.65116: Flags [P.], seq 44244:44456, ack 1, win 501, length 212
05:59:18.199749 IP lamp-ubuntu-s-1vcpu-1gb-tor1-01.ssh > cpee0dbd127d1d4-cme0dbd127d1d2.cpe.net.cable.rogers.com.65116: Flags [P.], seq 44456:44668, ack 1, win 501, length 212
05:59:18.199874 IP lamp-ubuntu-s-1vcpu-1gb-tor1-01.ssh > cpee0dbd127d1d4-cme0dbd127d1d2.cpe.net.cable.rogers.com.65116: Flags [P.], seq 44668:44880, ack 1, win 501, length 212
05:59:18.199993 IP lamp-ubuntu-s-1vcpu-1gb-tor1-01.ssh > cpee0dbd127d1d4-cme0dbd127d1d2.cpe.net.cable.rogers.com.65116: Flags [P.], seq 44880:45092, ack 1, win 501, length 212
05:59:18.200112 IP lamp-ubuntu-s-1vcpu-1gb-tor1-01.ssh > cpee0dbd127d1d4-cme0dbd127d1d2.cpe.net.cable.rogers.com.65116: Flags [P.], seq 45092:45304, ack 1, win 501, length 212
05:59:18.200281 IP lamp-ubuntu-s-1vcpu-1gb-tor1-01.ssh > cpee0dbd127d1d4-cme0dbd127d1d2.cpe.net.cable.rogers.com.65116: Flags [P.], seq 45304:45516, ack 1, win 501, length 212
05:59:18.200402 IP lamp-ubuntu-s-1vcpu-1gb-tor1-01.ssh > cpee0dbd127d1d4-cme0dbd127d1d2.cpe.net.cable.rogers.com.65116: Flags [P.], seq 45516:45728, ack 1, win 501, length 212
05:59:18.200527 IP lamp-ubuntu-s-1vcpu-1gb-tor1-01.ssh > cpee0dbd127d1d4-cme0dbd127d1d2.cpe.net.cable.rogers.com.65116: Flags [P.], seq 45728:45940, ack 1, win 501, length 212
05:59:18.202263 IP cpee0dbd127d1d4-cme0dbd127d1d2.cpe.net.cable.rogers.com.65116 > lamp-ubuntu-s-1vcpu-1gb-tor1-01.ssh: Flags [.], ack 30516, win 512, length 0
05:59:18.202263 IP cpee0dbd127d1d4-cme0dbd127d1d2.cpe.net.cable.rogers.com.65116 > lamp-ubuntu-s-1vcpu-1gb-tor1-01.ssh: Flags [.], ack 36240, win 509, length 0
05:59:18.202263 IP cpee0dbd127d1d4-cme0dbd127d1d2.cpe.net.cable.rogers.com.65116 > lamp-ubuntu-s-1vcpu-1gb-tor1-01.ssh: Flags [.], ack 39208, win 510, length 0
05:59:18.202338 IP lamp-ubuntu-s-1vcpu-1gb-tor1-01.ssh > cpee0dbd127d1d4-cme0dbd127d1d2.cpe.net.cable.rogers.com.65116: Flags [P.], seq 45940:46152, ack 1, win 501, length 212
05:59:18.202607 IP lamp-ubuntu-s-1vcpu-1gb-tor1-01.ssh > cpee0dbd127d1d4-cme0dbd127d1d2.cpe.net.cable.rogers.com.65116: Flags [P.], seq 46152:46852, ack 1, win 501, length 700
05:59:18.202807 IP lamp-ubuntu-s-1vcpu-1gb-tor1-01.ssh > cpee0dbd127d1d4-cme0dbd127d1d2.cpe.net.cable.rogers.com.65116: Flags [P.], seq 46852:47064, ack 1, win 501, length 212
05:59:18.202963 IP lamp-ubuntu-s-1vcpu-1gb-tor1-01.ssh > cpee0dbd127d1d4-cme0dbd127d1d2.cpe.net.cable.rogers.com.65116: Flags [P.], seq 47064:47276, ack 1, win 501, length 212
05:59:18.203098 IP lamp-ubuntu-s-1vcpu-1gb-tor1-01.ssh > cpee0dbd127d1d4-cme0dbd127d1d2.cpe.net.cable.rogers.com.65116: Flags [P.], seq 47276:47488, ack 1, win 501, length 212
05:59:18.203225 IP lamp-ubuntu-s-1vcpu-1gb-tor1-01.ssh > cpee0dbd127d1d4-cme0dbd127d1d2.cpe.net.cable.rogers.com.65116: Flags [P.], seq 47488:47700, ack 1, win 501, length 212
05:59:18.203409 IP lamp-ubuntu-s-1vcpu-1gb-tor1-01.ssh > cpee0dbd127d1d4-cme0dbd127d1d2.cpe.net.cable.rogers.com.65116: Flags [P.], seq 47700:47912, ack 1, win 501, length 212
05:59:18.203581 IP lamp-ubuntu-s-1vcpu-1gb-tor1-01.ssh > cpee0dbd127d1d4-cme0dbd127d1d2.cpe.net.cable.rogers.com.65116: Flags [P.], seq 47912:48124, ack 1, win 501, length 212
05:59:18.203709 IP lamp-ubuntu-s-1vcpu-1gb-tor1-01.ssh > cpee0dbd127d1d4-cme0dbd127d1d2.cpe.net.cable.rogers.com.65116: Flags [P.], seq 48124:48336, ack 1, win 501, length 212
05:59:18.203831 IP lamp-ubuntu-s-1vcpu-1gb-tor1-01.ssh > cpee0dbd127d1d4-cme0dbd127d1d2.cpe.net.cable.rogers.com.65116: Flags [P.], seq 48336:48548, ack 1, win 501, length 212
05:59:18.203954 IP lamp-ubuntu-s-1vcpu-1gb-tor1-01.ssh > cpee0dbd127d1d4-cme0dbd127d1d2.cpe.net.cable.rogers.com.65116: Flags [P.], seq 48548:48760, ack 1, win 501, length 212
05:59:18.204071 IP lamp-ubuntu-s-1vcpu-1gb-tor1-01.ssh > cpee0dbd127d1d4-cme0dbd127d1d2.cpe.net.cable.rogers.com.65116: Flags [P.], seq 48760:48972, ack 1, win 501, length 212
05:59:18.204189 IP lamp-ubuntu-s-1vcpu-1gb-tor1-01.ssh > cpee0dbd127d1d4-cme0dbd127d1d2.cpe.net.cable.rogers.com.65116: Flags [P.], seq 48972:49184, ack 1, win 501, length 212
05:59:18.204339 IP lamp-ubuntu-s-1vcpu-1gb-tor1-01.ssh > cpee0dbd127d1d4-cme0dbd127d1d2.cpe.net.cable.rogers.com.65116: Flags [P.], seq 49184:49396, ack 1, win 501, length 212
05:59:18.204513 IP lamp-ubuntu-s-1vcpu-1gb-tor1-01.ssh > cpee0dbd127d1d4-cme0dbd127d1d2.cpe.net.cable.rogers.com.65116: Flags [P.], seq 49396:49608, ack 1, win 501, length 212
