root@lamp-ubuntu-s-1vcpu-1gb-tor1-01:~# tcpdump -i eth0
tcpdump: verbose output suppressed, use -v or -vv for full protocol decode
listening on eth0, link-type EN10MB (Ethernet), capture size 262144 bytes
05:37:57.435217 IP lamp-ubuntu-s-1vcpu-1gb-tor1-01.ssh > cpee0dbd127d1d4-cme0dbd127d1d2.cpe.net.cable.rogers.com.65116: Flags [P.], seq 2528627281:2528627389, ack 777875997, win 501, length 108
05:37:57.435364 IP lamp-ubuntu-s-1vcpu-1gb-tor1-01.ssh > cpee0dbd127d1d4-cme0dbd127d1d2.cpe.net.cable.rogers.com.65116: Flags [P.], seq 108:144, ack 1, win 501, length 36
05:37:57.435466 IP lamp-ubuntu-s-1vcpu-1gb-tor1-01.ssh > cpee0dbd127d1d4-cme0dbd127d1d2.cpe.net.cable.rogers.com.65116: Flags [P.], seq 144:252, ack 1, win 501, length 108
05:37:57.435547 IP lamp-ubuntu-s-1vcpu-1gb-tor1-01.ssh > cpee0dbd127d1d4-cme0dbd127d1d2.cpe.net.cable.rogers.com.65116: Flags [P.], seq 252:288, ack 1, win 501, length 36
05:37:57.436814 IP lamp-ubuntu-s-1vcpu-1gb-tor1-01.46791 > 67.207.67.2.domain: 60336+ [1au] PTR? 187.233.226.99.in-addr.arpa. (56)
05:37:57.436935 IP lamp-ubuntu-s-1vcpu-1gb-tor1-01.34189 > 67.207.67.2.domain: 12265+ [1au] PTR? 187.233.226.99.in-addr.arpa. (56)
05:37:57.437856 IP lamp-ubuntu-s-1vcpu-1gb-tor1-01.57206 > 67.207.67.2.domain: 61015+ [1au] PTR? 251.210.110.143.in-addr.arpa. (57)
05:37:57.438076 IP lamp-ubuntu-s-1vcpu-1gb-tor1-01.46233 > 67.207.67.2.domain: 3054+ [1au] PTR? 251.210.110.143.in-addr.arpa. (57)
05:37:57.438293 IP lamp-ubuntu-s-1vcpu-1gb-tor1-01.58195 > 67.207.67.2.domain: 30238+ [1au] PTR? 251.210.110.143.in-addr.arpa. (57)
05:37:57.438491 IP 67.207.67.2.domain > lamp-ubuntu-s-1vcpu-1gb-tor1-01.46791: 60336 1/0/1 PTR cpee0dbd127d1d4-cme0dbd127d1d2.cpe.net.cable.rogers.com. (125)
05:37:57.438536 IP lamp-ubuntu-s-1vcpu-1gb-tor1-01 > 67.207.67.2: ICMP lamp-ubuntu-s-1vcpu-1gb-tor1-01 udp port 46791 unreachable, length 161
05:37:57.438793 IP 67.207.67.2.domain > lamp-ubuntu-s-1vcpu-1gb-tor1-01.34189: 12265 1/0/1 PTR cpee0dbd127d1d4-cme0dbd127d1d2.cpe.net.cable.rogers.com. (125)
05:37:57.438794 IP 67.207.67.2.domain > lamp-ubuntu-s-1vcpu-1gb-tor1-01.46233: 3054 NXDomain 0/1/1 (124)
05:37:57.438794 IP 67.207.67.2.domain > lamp-ubuntu-s-1vcpu-1gb-tor1-01.57206: 61015 NXDomain 0/1/1 (124)
05:37:57.438794 IP 67.207.67.2.domain > lamp-ubuntu-s-1vcpu-1gb-tor1-01.58195: 30238 NXDomain 0/1/1 (124)
05:37:57.438819 IP lamp-ubuntu-s-1vcpu-1gb-tor1-01 > 67.207.67.2: ICMP lamp-ubuntu-s-1vcpu-1gb-tor1-01 udp port 34189 unreachable, length 161
05:37:57.438967 IP lamp-ubuntu-s-1vcpu-1gb-tor1-01.46233 > 67.207.67.2.domain: 3054+ PTR? 251.210.110.143.in-addr.arpa. (46)
05:37:57.439093 IP lamp-ubuntu-s-1vcpu-1gb-tor1-01.58195 > 67.207.67.2.domain: 30238+ PTR? 251.210.110.143.in-addr.arpa. (46)
05:37:57.439275 IP lamp-ubuntu-s-1vcpu-1gb-tor1-01.57206 > 67.207.67.2.domain: 61015+ PTR? 251.210.110.143.in-addr.arpa. (46)
05:37:57.439528 IP 67.207.67.2.domain > lamp-ubuntu-s-1vcpu-1gb-tor1-01.46233: 3054 NXDomain 0/1/0 (113)
05:37:57.439666 IP 67.207.67.2.domain > lamp-ubuntu-s-1vcpu-1gb-tor1-01.58195: 30238 NXDomain 0/1/0 (113)
05:37:57.439869 IP 67.207.67.2.domain > lamp-ubuntu-s-1vcpu-1gb-tor1-01.57206: 61015 NXDomain 0/1/0 (113)
05:37:57.440632 IP lamp-ubuntu-s-1vcpu-1gb-tor1-01.ssh > cpee0dbd127d1d4-cme0dbd127d1d2.cpe.net.cable.rogers.com.65116: Flags [P.], seq 288:516, ack 1, win 501, length 228
05:37:57.440786 IP lamp-ubuntu-s-1vcpu-1gb-tor1-01.ssh > cpee0dbd127d1d4-cme0dbd127d1d2.cpe.net.cable.rogers.com.65116: Flags [P.], seq 516:552, ack 1, win 501, length 36
05:37:57.440982 IP lamp-ubuntu-s-1vcpu-1gb-tor1-01.ssh > cpee0dbd127d1d4-cme0dbd127d1d2.cpe.net.cable.rogers.com.65116: Flags [P.], seq 552:756, ack 1, win 501, length 204
05:37:57.441131 IP lamp-ubuntu-s-1vcpu-1gb-tor1-01.ssh > cpee0dbd127d1d4-cme0dbd127d1d2.cpe.net.cable.rogers.com.65116: Flags [P.], seq 756:792, ack 1, win 501, length 36
05:37:57.441266 IP lamp-ubuntu-s-1vcpu-1gb-tor1-01.ssh > cpee0dbd127d1d4-cme0dbd127d1d2.cpe.net.cable.rogers.com.65116: Flags [P.], seq 792:1004, ack 1, win 501, length 212
05:37:57.441996 IP lamp-ubuntu-s-1vcpu-1gb-tor1-01.51650 > 67.207.67.2.domain: 29689+ [1au] PTR? 2.67.207.67.in-addr.arpa. (53)
05:37:57.442132 IP lamp-ubuntu-s-1vcpu-1gb-tor1-01.48163 > 67.207.67.2.domain: 22068+ [1au] PTR? 2.67.207.67.in-addr.arpa. (53)
05:37:57.442246 IP lamp-ubuntu-s-1vcpu-1gb-tor1-01.33639 > 67.207.67.2.domain: 64211+ [1au] PTR? 2.67.207.67.in-addr.arpa. (53)
05:37:57.442593 IP 67.207.67.2.domain > lamp-ubuntu-s-1vcpu-1gb-tor1-01.51650: 29689 NXDomain 0/1/1 (120)
05:37:57.442685 IP 67.207.67.2.domain > lamp-ubuntu-s-1vcpu-1gb-tor1-01.48163: 22068 NXDomain 0/1/1 (120)
05:37:57.442887 IP lamp-ubuntu-s-1vcpu-1gb-tor1-01.51650 > 67.207.67.2.domain: 29689+ PTR? 2.67.207.67.in-addr.arpa. (42)
05:37:57.442907 IP 67.207.67.2.domain > lamp-ubuntu-s-1vcpu-1gb-tor1-01.33639: 64211 NXDomain 0/1/1 (120)
05:37:57.443018 IP lamp-ubuntu-s-1vcpu-1gb-tor1-01.48163 > 67.207.67.2.domain: 22068+ PTR? 2.67.207.67.in-addr.arpa. (42)
05:37:57.443109 IP cpee0dbd127d1d4-cme0dbd127d1d2.cpe.net.cable.rogers.com.65116 > lamp-ubuntu-s-1vcpu-1gb-tor1-01.ssh: Flags [.], ack 288, win 507, length 0
05:37:57.444626 IP lamp-ubuntu-s-1vcpu-1gb-tor1-01.ssh > cpee0dbd127d1d4-cme0dbd127d1d2.cpe.net.cable.rogers.com.65116: Flags [P.], seq 1480:1644, ack 1, win 501, length 164
05:37:57.445337 IP lamp-ubuntu-s-1vcpu-1gb-tor1-01.ssh > cpee0dbd127d1d4-cme0dbd127d1d2.cpe.net.cable.rogers.com.65116: Flags [P.], seq 1680:1852, ack 1, win 501, length 172
05:37:57.445473 IP lamp-ubuntu-s-1vcpu-1gb-tor1-01.ssh > cpee0dbd127d1d4-cme0dbd127d1d2.cpe.net.cable.rogers.com.65116: Flags [P.], seq 1852:1888, ack 1, win 501, length 36
05:37:57.445769 IP lamp-ubuntu-s-1vcpu-1gb-tor1-01.ssh > cpee0dbd127d1d4-cme0dbd127d1d2.cpe.net.cable.rogers.com.65116: Flags [P.], seq 2088:2260, ack 1, win 501, length 172
05:37:57.448586 IP cpee0dbd127d1d4-cme0dbd127d1d2.cpe.net.cable.rogers.com.65116 > lamp-ubuntu-s-1vcpu-1gb-tor1-01.ssh: Flags [.], ack 1004, win 511, length 0
05:37:57.448626 IP lamp-ubuntu-s-1vcpu-1gb-tor1-01.ssh > cpee0dbd127d1d4-cme0dbd127d1d2.cpe.net.cable.rogers.com.65116: Flags [P.], seq 2260:5180, ack 1, win 501, length 2920
05:37:57.448647 IP lamp-ubuntu-s-1vcpu-1gb-tor1-01.ssh > cpee0dbd127d1d4-cme0dbd127d1d2.cpe.net.cable.rogers.com.65116: Flags [P.], seq 5180:8100, ack 1, win 501, length 2920
05:37:57.448755 IP lamp-ubuntu-s-1vcpu-1gb-tor1-01.ssh > cpee0dbd127d1d4-cme0dbd127d1d2.cpe.net.cable.rogers.com.65116: Flags [P.], seq 8100:8808, ack 1, win 501, length 708
05:37:57.448879 IP lamp-ubuntu-s-1vcpu-1gb-tor1-01.ssh > cpee0dbd127d1d4-cme0dbd127d1d2.cpe.net.cable.rogers.com.65116: Flags [P.], seq 8808:9004, ack 1, win 501, length 196
05:37:57.449028 IP lamp-ubuntu-s-1vcpu-1gb-tor1-01.ssh > cpee0dbd127d1d4-cme0dbd127d1d2.cpe.net.cable.rogers.com.65116: Flags [P.], seq 9004:9040, ack 1, win 501, length 36
05:37:57.449208 IP lamp-ubuntu-s-1vcpu-1gb-tor1-01.ssh > cpee0dbd127d1d4-cme0dbd127d1d2.cpe.net.cable.rogers.com.65116: Flags [P.], seq 9040:9252, ack 1, win 501, length 212
05:37:57.449349 IP lamp-ubuntu-s-1vcpu-1gb-tor1-01.ssh > cpee0dbd127d1d4-cme0dbd127d1d2.cpe.net.cable.rogers.com.65116: Flags [P.], seq 9252:9288, ack 1, win 501, length 36
05:37:57.449543 IP lamp-ubuntu-s-1vcpu-1gb-tor1-01.ssh > cpee0dbd127d1d4-cme0dbd127d1d2.cpe.net.cable.rogers.com.65116: Flags [P.], seq 9288:9500, ack 1, win 501, length 212
05:37:57.456266 IP cpee0dbd127d1d4-cme0dbd127d1d2.cpe.net.cable.rogers.com.65116 > lamp-ubuntu-s-1vcpu-1gb-tor1-01.ssh: Flags [.], ack 2260, win 513, length 0
05:37:57.456318 IP lamp-ubuntu-s-1vcpu-1gb-tor1-01.ssh > cpee0dbd127d1d4-cme0dbd127d1d2.cpe.net.cable.rogers.com.65116: Flags [P.], seq 9500:11024, ack 1, win 501, length 1524
05:37:57.456493 IP lamp-ubuntu-s-1vcpu-1gb-tor1-01.ssh > cpee0dbd127d1d4-cme0dbd127d1d2.cpe.net.cable.rogers.com.65116: Flags [P.], seq 11024:11220, ack 1, win 501, length 196
05:37:57.456651 IP lamp-ubuntu-s-1vcpu-1gb-tor1-01.ssh > cpee0dbd127d1d4-cme0dbd127d1d2.cpe.net.cable.rogers.com.65116: Flags [P.], seq 11220:11256, ack 1, win 501, length 36
05:37:57.456840 IP lamp-ubuntu-s-1vcpu-1gb-tor1-01.ssh > cpee0dbd127d1d4-cme0dbd127d1d2.cpe.net.cable.rogers.com.65116: Flags [P.], seq 11256:11468, ack 1, win 501, length 212
05:37:57.456999 IP lamp-ubuntu-s-1vcpu-1gb-tor1-01.ssh > cpee0dbd127d1d4-cme0dbd127d1d2.cpe.net.cable.rogers.com.65116: Flags [P.], seq 11468:11504, ack 1, win 501, length 36
05:37:57.457185 IP lamp-ubuntu-s-1vcpu-1gb-tor1-01.ssh > cpee0dbd127d1d4-cme0dbd127d1d2.cpe.net.cable.rogers.com.65116: Flags [P.], seq 11504:11716, ack 1, win 501, length 212
05:37:57.457281 IP lamp-ubuntu-s-1vcpu-1gb-tor1-01.ssh > cpee0dbd127d1d4-cme0dbd127d1d2.cpe.net.cable.rogers.com.65116: Flags [P.], seq 11716:11752, ack 1, win 501, length 36
05:37:57.457394 IP lamp-ubuntu-s-1vcpu-1gb-tor1-01.ssh > cpee0dbd127d1d4-cme0dbd127d1d2.cpe.net.cable.rogers.com.65116: Flags [P.], seq 11752:11964, ack 1, win 501, length 212
05:37:57.457554 IP lamp-ubuntu-s-1vcpu-1gb-tor1-01.ssh > cpee0dbd127d1d4-cme0dbd127d1d2.cpe.net.cable.rogers.com.65116: Flags [P.], seq 11964:12000, ack 1, win 501, length 36
05:37:57.457740 IP lamp-ubuntu-s-1vcpu-1gb-tor1-01.ssh > cpee0dbd127d1d4-cme0dbd127d1d2.cpe.net.cable.rogers.com.65116: Flags [P.], seq 12000:12212, ack 1, win 501, length 212
05:37:57.457902 IP lamp-ubuntu-s-1vcpu-1gb-tor1-01.ssh > cpee0dbd127d1d4-cme0dbd127d1d2.cpe.net.cable.rogers.com.65116: Flags [P.], seq 12212:12248, ack 1, win 501, length 36
05:37:57.458101 IP lamp-ubuntu-s-1vcpu-1gb-tor1-01.ssh > cpee0dbd127d1d4-cme0dbd127d1d2.cpe.net.cable.rogers.com.65116: Flags [P.], seq 12248:12460, ack 1, win 501, length 212
05:37:57.458263 IP lamp-ubuntu-s-1vcpu-1gb-tor1-01.ssh > cpee0dbd127d1d4-cme0dbd127d1d2.cpe.net.cable.rogers.com.65116: Flags [P.], seq 12460:12496, ack 1, win 501, length 36
05:37:57.458451 IP lamp-ubuntu-s-1vcpu-1gb-tor1-01.ssh > cpee0dbd127d1d4-cme0dbd127d1d2.cpe.net.cable.rogers.com.65116: Flags [P.], seq 12496:12708, ack 1, win 501, length 212
05:37:57.458598 IP lamp-ubuntu-s-1vcpu-1gb-tor1-01.ssh > cpee0dbd127d1d4-cme0dbd127d1d2.cpe.net.cable.rogers.com.65116: Flags [P.], seq 12708:12744, ack 1, win 501, length 36
05:37:57.458788 IP lamp-ubuntu-s-1vcpu-1gb-tor1-01.ssh > cpee0dbd127d1d4-cme0dbd127d1d2.cpe.net.cable.rogers.com.65116: Flags [P.], seq 12744:12956, ack 1, win 501, length 212
05:37:57.459036 IP lamp-ubuntu-s-1vcpu-1gb-tor1-01.ssh > cpee0dbd127d1d4-cme0dbd127d1d2.cpe.net.cable.rogers.com.65116: Flags [P.], seq 12956:13352, ack 1, win 501, length 396
05:37:57.459333 IP lamp-ubuntu-s-1vcpu-1gb-tor1-01.ssh > cpee0dbd127d1d4-cme0dbd127d1d2.cpe.net.cable.rogers.com.65116: Flags [P.], seq 13352:14092, ack 1, win 501, length 740
05:37:57.459604 IP lamp-ubuntu-s-1vcpu-1gb-tor1-01.ssh > cpee0dbd127d1d4-cme0dbd127d1d2.cpe.net.cable.rogers.com.65116: Flags [P.], seq 14092:14840, ack 1, win 501, length 748
05:37:57.460603 IP cpee0dbd127d1d4-cme0dbd127d1d2.cpe.net.cable.rogers.com.65116 > lamp-ubuntu-s-1vcpu-1gb-tor1-01.ssh: Flags [.], ack 9500, win 511, length 0
05:37:57.460650 IP lamp-ubuntu-s-1vcpu-1gb-tor1-01.ssh > cpee0dbd127d1d4-cme0dbd127d1d2.cpe.net.cable.rogers.com.65116: Flags [P.], seq 14840:15228, ack 1, win 501, length 388
05:37:57.460809 IP lamp-ubuntu-s-1vcpu-1gb-tor1-01.ssh > cpee0dbd127d1d4-cme0dbd127d1d2.cpe.net.cable.rogers.com.65116: Flags [P.], seq 15228:15424, ack 1, win 501, length 196
05:37:57.460946 IP lamp-ubuntu-s-1vcpu-1gb-tor1-01.ssh > cpee0dbd127d1d4-cme0dbd127d1d2.cpe.net.cable.rogers.com.65116: Flags [P.], seq 15424:15636, ack 1, win 501, length 212
05:37:57.461103 IP lamp-ubuntu-s-1vcpu-1gb-tor1-01.ssh > cpee0dbd127d1d4-cme0dbd127d1d2.cpe.net.cable.rogers.com.65116: Flags [P.], seq 15636:16032, ack 1, win 501, length 396
05:37:57.461240 IP lamp-ubuntu-s-1vcpu-1gb-tor1-01.ssh > cpee0dbd127d1d4-cme0dbd127d1d2.cpe.net.cable.rogers.com.65116: Flags [P.], seq 16032:16244, ack 1, win 501, length 212
05:37:57.461371 IP lamp-ubuntu-s-1vcpu-1gb-tor1-01.ssh > cpee0dbd127d1d4-cme0dbd127d1d2.cpe.net.cable.rogers.com.65116: Flags [P.], seq 16244:16456, ack 1, win 501, length 212
05:37:57.461494 IP lamp-ubuntu-s-1vcpu-1gb-tor1-01.ssh > cpee0dbd127d1d4-cme0dbd127d1d2.cpe.net.cable.rogers.com.65116: Flags [P.], seq 16456:16668, ack 1, win 501, length 212
05:37:57.461693 IP lamp-ubuntu-s-1vcpu-1gb-tor1-01.ssh > cpee0dbd127d1d4-cme0dbd127d1d2.cpe.net.cable.rogers.com.65116: Flags [P.], seq 16668:16880, ack 1, win 501, length 212
05:37:57.461842 IP lamp-ubuntu-s-1vcpu-1gb-tor1-01.ssh > cpee0dbd127d1d4-cme0dbd127d1d2.cpe.net.cable.rogers.com.65116: Flags [P.], seq 16880:17092, ack 1, win 501, length 212
05:37:57.461987 IP lamp-ubuntu-s-1vcpu-1gb-tor1-01.ssh > cpee0dbd127d1d4-cme0dbd127d1d2.cpe.net.cable.rogers.com.65116: Flags [P.], seq 17092:17304, ack 1, win 501, length 212
05:37:57.462171 IP lamp-ubuntu-s-1vcpu-1gb-tor1-01.ssh > cpee0dbd127d1d4-cme0dbd127d1d2.cpe.net.cable.rogers.com.65116: Flags [P.], seq 17304:17516, ack 1, win 501, length 212
05:37:57.462315 IP lamp-ubuntu-s-1vcpu-1gb-tor1-01.ssh > cpee0dbd127d1d4-cme0dbd127d1d2.cpe.net.cable.rogers.com.65116: Flags [P.], seq 17516:17728, ack 1, win 501, length 212
05:37:57.462442 IP lamp-ubuntu-s-1vcpu-1gb-tor1-01.ssh > cpee0dbd127d1d4-cme0dbd127d1d2.cpe.net.cable.rogers.com.65116: Flags [P.], seq 17728:17940, ack 1, win 501, length 212
05:37:57.462579 IP lamp-ubuntu-s-1vcpu-1gb-tor1-01.ssh > cpee0dbd127d1d4-cme0dbd127d1d2.cpe.net.cable.rogers.com.65116: Flags [P.], seq 17940:18152, ack 1, win 501, length 212
05:37:57.462786 IP lamp-ubuntu-s-1vcpu-1gb-tor1-01.ssh > cpee0dbd127d1d4-cme0dbd127d1d2.cpe.net.cable.rogers.com.65116: Flags [P.], seq 18152:18364, ack 1, win 501, length 212
05:37:57.462928 IP lamp-ubuntu-s-1vcpu-1gb-tor1-01.ssh > cpee0dbd127d1d4-cme0dbd127d1d2.cpe.net.cable.rogers.com.65116: Flags [P.], seq 18364:18576, ack 1, win 501, length 212
05:37:57.463062 IP lamp-ubuntu-s-1vcpu-1gb-tor1-01.ssh > cpee0dbd127d1d4-cme0dbd127d1d2.cpe.net.cable.rogers.com.65116: Flags [P.], seq 18576:18788, ack 1, win 501, length 212
05:37:57.463189 IP lamp-ubuntu-s-1vcpu-1gb-tor1-01.ssh > cpee0dbd127d1d4-cme0dbd127d1d2.cpe.net.cable.rogers.com.65116: Flags [P.], seq 18788:19000, ack 1, win 501, length 212
05:37:57.463316 IP lamp-ubuntu-s-1vcpu-1gb-tor1-01.ssh > cpee0dbd127d1d4-cme0dbd127d1d2.cpe.net.cable.rogers.com.65116: Flags [P.], seq 19000:19212, ack 1, win 501, length 212
05:37:57.463438 IP lamp-ubuntu-s-1vcpu-1gb-tor1-01.ssh > cpee0dbd127d1d4-cme0dbd127d1d2.cpe.net.cable.rogers.com.65116: Flags [P.], seq 19212:19424, ack 1, win 501, length 212
05:37:57.472180 IP cpee0dbd127d1d4-cme0dbd127d1d2.cpe.net.cable.rogers.com.65116 > lamp-ubuntu-s-1vcpu-1gb-tor1-01.ssh: Flags [.], ack 19424, win 512, length 0
05:37:57.472292 IP lamp-ubuntu-s-1vcpu-1gb-tor1-01.ssh > cpee0dbd127d1d4-cme0dbd127d1d2.cpe.net.cable.rogers.com.65116: Flags [P.], seq 19424:19636, ack 1, win 501, length 212
05:37:57.472591 IP lamp-ubuntu-s-1vcpu-1gb-tor1-01.ssh > cpee0dbd127d1d4-cme0dbd127d1d2.cpe.net.cable.rogers.com.65116: Flags [P.], seq 19636:20008, ack 1, win 501, length 372
05:37:57.472814 IP lamp-ubuntu-s-1vcpu-1gb-tor1-01.ssh > cpee0dbd127d1d4-cme0dbd127d1d2.cpe.net.cable.rogers.com.65116: Flags [P.], seq 20008:20220, ack 1, win 501, length 212
05:37:57.472987 IP lamp-ubuntu-s-1vcpu-1gb-tor1-01.ssh > cpee0dbd127d1d4-cme0dbd127d1d2.cpe.net.cable.rogers.com.65116: Flags [P.], seq 20220:20432, ack 1, win 501, length 212
05:37:57.473154 IP lamp-ubuntu-s-1vcpu-1gb-tor1-01.ssh > cpee0dbd127d1d4-cme0dbd127d1d2.cpe.net.cable.rogers.com.65116: Flags [P.], seq 20432:20644, ack 1, win 501, length 212
05:37:57.473327 IP lamp-ubuntu-s-1vcpu-1gb-tor1-01.ssh > cpee0dbd127d1d4-cme0dbd127d1d2.cpe.net.cable.rogers.com.65116: Flags [P.], seq 20644:20856, ack 1, win 501, length 212
05:37:57.473574 IP lamp-ubuntu-s-1vcpu-1gb-tor1-01.ssh > cpee0dbd127d1d4-cme0dbd127d1d2.cpe.net.cable.rogers.com.65116: Flags [P.], seq 20856:21068, ack 1, win 501, length 212
05:37:57.473782 IP lamp-ubuntu-s-1vcpu-1gb-tor1-01.ssh > cpee0dbd127d1d4-cme0dbd127d1d2.cpe.net.cable.rogers.com.65116: Flags [P.], seq 21068:21280, ack 1, win 501, length 212
05:37:57.473920 IP lamp-ubuntu-s-1vcpu-1gb-tor1-01.ssh > cpee0dbd127d1d4-cme0dbd127d1d2.cpe.net.cable.rogers.com.65116: Flags [P.], seq 21280:21492, ack 1, win 501, length 212
05:37:57.474047 IP lamp-ubuntu-s-1vcpu-1gb-tor1-01.ssh > cpee0dbd127d1d4-cme0dbd127d1d2.cpe.net.cable.rogers.com.65116: Flags [P.], seq 21492:21704, ack 1, win 501, length 212
05:37:57.474175 IP lamp-ubuntu-s-1vcpu-1gb-tor1-01.ssh > cpee0dbd127d1d4-cme0dbd127d1d2.cpe.net.cable.rogers.com.65116: Flags [P.], seq 21704:21916, ack 1, win 501, length 212
05:37:57.474299 IP lamp-ubuntu-s-1vcpu-1gb-tor1-01.ssh > cpee0dbd127d1d4-cme0dbd127d1d2.cpe.net.cable.rogers.com.65116: Flags [P.], seq 21916:22128, ack 1, win 501, length 212
05:37:57.474421 IP lamp-ubuntu-s-1vcpu-1gb-tor1-01.ssh > cpee0dbd127d1d4-cme0dbd127d1d2.cpe.net.cable.rogers.com.65116: Flags [P.], seq 22128:22340, ack 1, win 501, length 212
05:37:57.474547 IP lamp-ubuntu-s-1vcpu-1gb-tor1-01.ssh > cpee0dbd127d1d4-cme0dbd127d1d2.cpe.net.cable.rogers.com.65116: Flags [P.], seq 22340:22552, ack 1, win 501, length 212
05:37:57.474670 IP lamp-ubuntu-s-1vcpu-1gb-tor1-01.ssh > cpee0dbd127d1d4-cme0dbd127d1d2.cpe.net.cable.rogers.com.65116: Flags [P.], seq 22552:22764, ack 1, win 501, length 212
05:37:57.474798 IP lamp-ubuntu-s-1vcpu-1gb-tor1-01.ssh > cpee0dbd127d1d4-cme0dbd127d1d2.cpe.net.cable.rogers.com.65116: Flags [P.], seq 22764:22976, ack 1, win 501, length 212
05:37:57.474921 IP lamp-ubuntu-s-1vcpu-1gb-tor1-01.ssh > cpee0dbd127d1d4-cme0dbd127d1d2.cpe.net.cable.rogers.com.65116: Flags [P.], seq 22976:23188, ack 1, win 501, length 212
05:37:57.475037 IP lamp-ubuntu-s-1vcpu-1gb-tor1-01.ssh > cpee0dbd127d1d4-cme0dbd127d1d2.cpe.net.cable.rogers.com.65116: Flags [P.], seq 23188:23400, ack 1, win 501, length 212
05:37:57.475159 IP lamp-ubuntu-s-1vcpu-1gb-tor1-01.ssh > cpee0dbd127d1d4-cme0dbd127d1d2.cpe.net.cable.rogers.com.65116: Flags [P.], seq 23400:23612, ack 1, win 501, length 212
05:37:57.475275 IP lamp-ubuntu-s-1vcpu-1gb-tor1-01.ssh > cpee0dbd127d1d4-cme0dbd127d1d2.cpe.net.cable.rogers.com.65116: Flags [P.], seq 23612:23824, ack 1, win 501, length 212
05:37:57.475396 IP lamp-ubuntu-s-1vcpu-1gb-tor1-01.ssh > cpee0dbd127d1d4-cme0dbd127d1d2.cpe.net.cable.rogers.com.65116: Flags [P.], seq 23824:24036, ack 1, win 501, length 212
05:37:57.475511 IP lamp-ubuntu-s-1vcpu-1gb-tor1-01.ssh > cpee0dbd127d1d4-cme0dbd127d1d2.cpe.net.cable.rogers.com.65116: Flags [P.], seq 24036:24248, ack 1, win 501, length 212
05:37:57.475640 IP lamp-ubuntu-s-1vcpu-1gb-tor1-01.ssh > cpee0dbd127d1d4-cme0dbd127d1d2.cpe.net.cable.rogers.com.65116: Flags [P.], seq 24248:24460, ack 1, win 501, length 212
05:37:57.475768 IP lamp-ubuntu-s-1vcpu-1gb-tor1-01.ssh > cpee0dbd127d1d4-cme0dbd127d1d2.cpe.net.cable.rogers.com.65116: Flags [P.], seq 24460:24672, ack 1, win 501, length 212
05:37:57.475889 IP lamp-ubuntu-s-1vcpu-1gb-tor1-01.ssh > cpee0dbd127d1d4-cme0dbd127d1d2.cpe.net.cable.rogers.com.65116: Flags [P.], seq 24672:24884, ack 1, win 501, length 212
05:37:57.476004 IP lamp-ubuntu-s-1vcpu-1gb-tor1-01.ssh > cpee0dbd127d1d4-cme0dbd127d1d2.cpe.net.cable.rogers.com.65116: Flags [P.], seq 24884:25096, ack 1, win 501, length 212
05:37:57.476149 IP lamp-ubuntu-s-1vcpu-1gb-tor1-01.ssh > cpee0dbd127d1d4-cme0dbd127d1d2.cpe.net.cable.rogers.com.65116: Flags [P.], seq 25096:25308, ack 1, win 501, length 212
05:37:57.476299 IP lamp-ubuntu-s-1vcpu-1gb-tor1-01.ssh > cpee0dbd127d1d4-cme0dbd127d1d2.cpe.net.cable.rogers.com.65116: Flags [P.], seq 25308:25520, ack 1, win 501, length 212
05:37:57.476418 IP lamp-ubuntu-s-1vcpu-1gb-tor1-01.ssh > cpee0dbd127d1d4-cme0dbd127d1d2.cpe.net.cable.rogers.com.65116: Flags [P.], seq 25520:25732, ack 1, win 501, length 212
05:37:57.476538 IP lamp-ubuntu-s-1vcpu-1gb-tor1-01.ssh > cpee0dbd127d1d4-cme0dbd127d1d2.cpe.net.cable.rogers.com.65116: Flags [P.], seq 25732:25944, ack 1, win 501, length 212
05:37:57.476656 IP lamp-ubuntu-s-1vcpu-1gb-tor1-01.ssh > cpee0dbd127d1d4-cme0dbd127d1d2.cpe.net.cable.rogers.com.65116: Flags [P.], seq 25944:26156, ack 1, win 501, length 212
05:37:57.476778 IP lamp-ubuntu-s-1vcpu-1gb-tor1-01.ssh > cpee0dbd127d1d4-cme0dbd127d1d2.cpe.net.cable.rogers.com.65116: Flags [P.], seq 26156:26368, ack 1, win 501, length 212
05:37:57.476894 IP lamp-ubuntu-s-1vcpu-1gb-tor1-01.ssh > cpee0dbd127d1d4-cme0dbd127d1d2.cpe.net.cable.rogers.com.65116: Flags [P.], seq 26368:26580, ack 1, win 501, length 212
05:37:57.477013 IP lamp-ubuntu-s-1vcpu-1gb-tor1-01.ssh > cpee0dbd127d1d4-cme0dbd127d1d2.cpe.net.cable.rogers.com.65116: Flags [P.], seq 26580:26792, ack 1, win 501, length 212
05:37:57.477132 IP lamp-ubuntu-s-1vcpu-1gb-tor1-01.ssh > cpee0dbd127d1d4-cme0dbd127d1d2.cpe.net.cable.rogers.com.65116: Flags [P.], seq 26792:27004, ack 1, win 501, length 212
05:37:57.477274 IP lamp-ubuntu-s-1vcpu-1gb-tor1-01.ssh > cpee0dbd127d1d4-cme0dbd127d1d2.cpe.net.cable.rogers.com.65116: Flags [P.], seq 27004:27216, ack 1, win 501, length 212
05:37:57.477399 IP lamp-ubuntu-s-1vcpu-1gb-tor1-01.ssh > cpee0dbd127d1d4-cme0dbd127d1d2.cpe.net.cable.rogers.com.65116: Flags [P.], seq 27216:27428, ack 1, win 501, length 212
05:37:57.477515 IP lamp-ubuntu-s-1vcpu-1gb-tor1-01.ssh > cpee0dbd127d1d4-cme0dbd127d1d2.cpe.net.cable.rogers.com.65116: Flags [P.], seq 27428:27640, ack 1, win 501, length 212
05:37:57.477662 IP lamp-ubuntu-s-1vcpu-1gb-tor1-01.ssh > cpee0dbd127d1d4-cme0dbd127d1d2.cpe.net.cable.rogers.com.65116: Flags [P.], seq 27640:27852, ack 1, win 501, length 212
05:37:57.477789 IP lamp-ubuntu-s-1vcpu-1gb-tor1-01.ssh > cpee0dbd127d1d4-cme0dbd127d1d2.cpe.net.cable.rogers.com.65116: Flags [P.], seq 27852:28064, ack 1, win 501, length 212
05:37:57.477910 IP lamp-ubuntu-s-1vcpu-1gb-tor1-01.ssh > cpee0dbd127d1d4-cme0dbd127d1d2.cpe.net.cable.rogers.com.65116: Flags [P.], seq 28064:28276, ack 1, win 501, length 212
05:37:57.478027 IP lamp-ubuntu-s-1vcpu-1gb-tor1-01.ssh > cpee0dbd127d1d4-cme0dbd127d1d2.cpe.net.cable.rogers.com.65116: Flags [P.], seq 28276:28488, ack 1, win 501, length 212
05:37:57.478148 IP lamp-ubuntu-s-1vcpu-1gb-tor1-01.ssh > cpee0dbd127d1d4-cme0dbd127d1d2.cpe.net.cable.rogers.com.65116: Flags [P.], seq 28488:28700, ack 1, win 501, length 212
05:37:57.478272 IP lamp-ubuntu-s-1vcpu-1gb-tor1-01.ssh > cpee0dbd127d1d4-cme0dbd127d1d2.cpe.net.cable.rogers.com.65116: Flags [P.], seq 28700:28912, ack 1, win 501, length 212
05:37:57.478386 IP lamp-ubuntu-s-1vcpu-1gb-tor1-01.ssh > cpee0dbd127d1d4-cme0dbd127d1d2.cpe.net.cable.rogers.com.65116: Flags [P.], seq 28912:29124, ack 1, win 501, length 212
05:37:57.478508 IP lamp-ubuntu-s-1vcpu-1gb-tor1-01.ssh > cpee0dbd127d1d4-cme0dbd127d1d2.cpe.net.cable.rogers.com.65116: Flags [P.], seq 29124:29336, ack 1, win 501, length 212
05:37:57.478652 IP lamp-ubuntu-s-1vcpu-1gb-tor1-01.ssh > cpee0dbd127d1d4-cme0dbd127d1d2.cpe.net.cable.rogers.com.65116: Flags [P.], seq 29336:29548, ack 1, win 501, length 212
05:37:57.478876 IP lamp-ubuntu-s-1vcpu-1gb-tor1-01.ssh > cpee0dbd127d1d4-cme0dbd127d1d2.cpe.net.cable.rogers.com.65116: Flags [P.], seq 29548:29760, ack 1, win 501, length 212
05:37:57.479053 IP lamp-ubuntu-s-1vcpu-1gb-tor1-01.ssh > cpee0dbd127d1d4-cme0dbd127d1d2.cpe.net.cable.rogers.com.65116: Flags [P.], seq 29760:29972, ack 1, win 501, length 212
05:37:57.479187 IP lamp-ubuntu-s-1vcpu-1gb-tor1-01.ssh > cpee0dbd127d1d4-cme0dbd127d1d2.cpe.net.cable.rogers.com.65116: Flags [P.], seq 29972:30184, ack 1, win 501, length 212
05:37:57.479307 IP lamp-ubuntu-s-1vcpu-1gb-tor1-01.ssh > cpee0dbd127d1d4-cme0dbd127d1d2.cpe.net.cable.rogers.com.65116: Flags [P.], seq 30184:30396, ack 1, win 501, length 212
05:37:57.479434 IP lamp-ubuntu-s-1vcpu-1gb-tor1-01.ssh > cpee0dbd127d1d4-cme0dbd127d1d2.cpe.net.cable.rogers.com.65116: Flags [P.], seq 30396:30608, ack 1, win 501, length 212
05:37:57.479551 IP lamp-ubuntu-s-1vcpu-1gb-tor1-01.ssh > cpee0dbd127d1d4-cme0dbd127d1d2.cpe.net.cable.rogers.com.65116: Flags [P.], seq 30608:30820, ack 1, win 501, length 212
05:37:57.479667 IP lamp-ubuntu-s-1vcpu-1gb-tor1-01.ssh > cpee0dbd127d1d4-cme0dbd127d1d2.cpe.net.cable.rogers.com.65116: Flags [P.], seq 30820:31032, ack 1, win 501, length 212
05:37:57.479784 IP lamp-ubuntu-s-1vcpu-1gb-tor1-01.ssh > cpee0dbd127d1d4-cme0dbd127d1d2.cpe.net.cable.rogers.com.65116: Flags [P.], seq 31032:31244, ack 1, win 501, length 212
05:37:57.479914 IP lamp-ubuntu-s-1vcpu-1gb-tor1-01.ssh > cpee0dbd127d1d4-cme0dbd127d1d2.cpe.net.cable.rogers.com.65116: Flags [P.], seq 31244:31456, ack 1, win 501, length 212
05:37:57.480050 IP lamp-ubuntu-s-1vcpu-1gb-tor1-01.ssh > cpee0dbd127d1d4-cme0dbd127d1d2.cpe.net.cable.rogers.com.65116: Flags [P.], seq 31456:31668, ack 1, win 501, length 212
05:37:57.480177 IP lamp-ubuntu-s-1vcpu-1gb-tor1-01.ssh > cpee0dbd127d1d4-cme0dbd127d1d2.cpe.net.cable.rogers.com.65116: Flags [P.], seq 31668:31880, ack 1, win 501, length 212
05:37:57.480326 IP lamp-ubuntu-s-1vcpu-1gb-tor1-01.ssh > cpee0dbd127d1d4-cme0dbd127d1d2.cpe.net.cable.rogers.com.65116: Flags [P.], seq 31880:32092, ack 1, win 501, length 212
05:37:57.480448 IP lamp-ubuntu-s-1vcpu-1gb-tor1-01.ssh > cpee0dbd127d1d4-cme0dbd127d1d2.cpe.net.cable.rogers.com.65116: Flags [P.], seq 32092:32304, ack 1, win 501, length 212
05:37:57.480563 IP lamp-ubuntu-s-1vcpu-1gb-tor1-01.ssh > cpee0dbd127d1d4-cme0dbd127d1d2.cpe.net.cable.rogers.com.65116: Flags [P.], seq 32304:32516, ack 1, win 501, length 212
05:37:57.480689 IP lamp-ubuntu-s-1vcpu-1gb-tor1-01.ssh > cpee0dbd127d1d4-cme0dbd127d1d2.cpe.net.cable.rogers.com.65116: Flags [P.], seq 32516:32728, ack 1, win 501, length 212
05:37:57.480821 IP lamp-ubuntu-s-1vcpu-1gb-tor1-01.ssh > cpee0dbd127d1d4-cme0dbd127d1d2.cpe.net.cable.rogers.com.65116: Flags [P.], seq 32728:32940, ack 1, win 501, length 212
05:37:57.480941 IP lamp-ubuntu-s-1vcpu-1gb-tor1-01.ssh > cpee0dbd127d1d4-cme0dbd127d1d2.cpe.net.cable.rogers.com.65116: Flags [P.], seq 32940:33152, ack 1, win 501, length 212
05:37:57.481057 IP lamp-ubuntu-s-1vcpu-1gb-tor1-01.ssh > cpee0dbd127d1d4-cme0dbd127d1d2.cpe.net.cable.rogers.com.65116: Flags [P.], seq 33152:33364, ack 1, win 501, length 212
05:37:57.481181 IP lamp-ubuntu-s-1vcpu-1gb-tor1-01.ssh > cpee0dbd127d1d4-cme0dbd127d1d2.cpe.net.cable.rogers.com.65116: Flags [P.], seq 33364:33576, ack 1, win 501, length 212
05:37:57.481296 IP lamp-ubuntu-s-1vcpu-1gb-tor1-01.ssh > cpee0dbd127d1d4-cme0dbd127d1d2.cpe.net.cable.rogers.com.65116: Flags [P.], seq 33576:33788, ack 1, win 501, length 212
05:37:57.481416 IP lamp-ubuntu-s-1vcpu-1gb-tor1-01.ssh > cpee0dbd127d1d4-cme0dbd127d1d2.cpe.net.cable.rogers.com.65116: Flags [P.], seq 33788:34000, ack 1, win 501, length 212
05:37:57.481563 IP lamp-ubuntu-s-1vcpu-1gb-tor1-01.ssh > cpee0dbd127d1d4-cme0dbd127d1d2.cpe.net.cable.rogers.com.65116: Flags [P.], seq 34000:34212, ack 1, win 501, length 212
05:37:57.481682 IP lamp-ubuntu-s-1vcpu-1gb-tor1-01.ssh > cpee0dbd127d1d4-cme0dbd127d1d2.cpe.net.cable.rogers.com.65116: Flags [P.], seq 34212:34424, ack 1, win 501, length 212
05:37:57.481810 IP lamp-ubuntu-s-1vcpu-1gb-tor1-01.ssh > cpee0dbd127d1d4-cme0dbd127d1d2.cpe.net.cable.rogers.com.65116: Flags [P.], seq 34424:34636, ack 1, win 501, length 212
05:37:57.481930 IP lamp-ubuntu-s-1vcpu-1gb-tor1-01.ssh > cpee0dbd127d1d4-cme0dbd127d1d2.cpe.net.cable.rogers.com.65116: Flags [P.], seq 34636:34848, ack 1, win 501, length 212
05:37:57.482046 IP lamp-ubuntu-s-1vcpu-1gb-tor1-01.ssh > cpee0dbd127d1d4-cme0dbd127d1d2.cpe.net.cable.rogers.com.65116: Flags [P.], seq 34848:35060, ack 1, win 501, length 212
05:37:57.482175 IP lamp-ubuntu-s-1vcpu-1gb-tor1-01.ssh > cpee0dbd127d1d4-cme0dbd127d1d2.cpe.net.cable.rogers.com.65116: Flags [P.], seq 35060:35272, ack 1, win 501, length 212
05:37:57.482291 IP lamp-ubuntu-s-1vcpu-1gb-tor1-01.ssh > cpee0dbd127d1d4-cme0dbd127d1d2.cpe.net.cable.rogers.com.65116: Flags [P.], seq 35272:35484, ack 1, win 501, length 212
05:37:57.482412 IP lamp-ubuntu-s-1vcpu-1gb-tor1-01.ssh > cpee0dbd127d1d4-cme0dbd127d1d2.cpe.net.cable.rogers.com.65116: Flags [P.], seq 35484:35696, ack 1, win 501, length 212
05:37:57.482528 IP lamp-ubuntu-s-1vcpu-1gb-tor1-01.ssh > cpee0dbd127d1d4-cme0dbd127d1d2.cpe.net.cable.rogers.com.65116: Flags [P.], seq 35696:35908, ack 1, win 501, length 212
05:37:57.482644 IP lamp-ubuntu-s-1vcpu-1gb-tor1-01.ssh > cpee0dbd127d1d4-cme0dbd127d1d2.cpe.net.cable.rogers.com.65116: Flags [P.], seq 35908:36120, ack 1, win 501, length 212
05:37:57.482768 IP lamp-ubuntu-s-1vcpu-1gb-tor1-01.ssh > cpee0dbd127d1d4-cme0dbd127d1d2.cpe.net.cable.rogers.com.65116: Flags [P.], seq 36120:36332, ack 1, win 501, length 212
05:37:57.482887 IP lamp-ubuntu-s-1vcpu-1gb-tor1-01.ssh > cpee0dbd127d1d4-cme0dbd127d1d2.cpe.net.cable.rogers.com.65116: Flags [P.], seq 36332:36544, ack 1, win 501, length 212
05:37:57.486595 IP cpee0dbd127d1d4-cme0dbd127d1d2.cpe.net.cable.rogers.com.65116 > lamp-ubuntu-s-1vcpu-1gb-tor1-01.ssh: Flags [.], ack 24036, win 511, length 0
05:37:57.486596 IP cpee0dbd127d1d4-cme0dbd127d1d2.cpe.net.cable.rogers.com.65116 > lamp-ubuntu-s-1vcpu-1gb-tor1-01.ssh: Flags [.], ack 31456, win 508, length 0
05:37:57.486596 IP cpee0dbd127d1d4-cme0dbd127d1d2.cpe.net.cable.rogers.com.65116 > lamp-ubuntu-s-1vcpu-1gb-tor1-01.ssh: Flags [.], ack 32304, win 513, length 0
05:37:57.486672 IP lamp-ubuntu-s-1vcpu-1gb-tor1-01.ssh > cpee0dbd127d1d4-cme0dbd127d1d2.cpe.net.cable.rogers.com.65116: Flags [P.], seq 36544:36756, ack 1, win 501, length 212
05:37:57.486961 IP lamp-ubuntu-s-1vcpu-1gb-tor1-01.ssh > cpee0dbd127d1d4-cme0dbd127d1d2.cpe.net.cable.rogers.com.65116: Flags [P.], seq 36756:37456, ack 1, win 501, length 700
05:37:57.487109 IP lamp-ubuntu-s-1vcpu-1gb-tor1-01.ssh > cpee0dbd127d1d4-cme0dbd127d1d2.cpe.net.cable.rogers.com.65116: Flags [P.], seq 37456:37668, ack 1, win 501, length 212
05:37:57.487236 IP lamp-ubuntu-s-1vcpu-1gb-tor1-01.ssh > cpee0dbd127d1d4-cme0dbd127d1d2.cpe.net.cable.rogers.com.65116: Flags [P.], seq 37668:37880, ack 1, win 501, length 212
05:37:57.487359 IP lamp-ubuntu-s-1vcpu-1gb-tor1-01.ssh > cpee0dbd127d1d4-cme0dbd127d1d2.cpe.net.cable.rogers.com.65116: Flags [P.], seq 37880:38092, ack 1, win 501, length 212
05:37:57.487481 IP lamp-ubuntu-s-1vcpu-1gb-tor1-01.ssh > cpee0dbd127d1d4-cme0dbd127d1d2.cpe.net.cable.rogers.com.65116: Flags [P.], seq 38092:38304, ack 1, win 501, length 212
05:37:57.487607 IP lamp-ubuntu-s-1vcpu-1gb-tor1-01.ssh > cpee0dbd127d1d4-cme0dbd127d1d2.cpe.net.cable.rogers.com.65116: Flags [P.], seq 38304:38516, ack 1, win 501, length 212
05:37:57.487806 IP lamp-ubuntu-s-1vcpu-1gb-tor1-01.ssh > cpee0dbd127d1d4-cme0dbd127d1d2.cpe.net.cable.rogers.com.65116: Flags [P.], seq 38516:38728, ack 1, win 501, length 212
05:37:57.487999 IP lamp-ubuntu-s-1vcpu-1gb-tor1-01.ssh > cpee0dbd127d1d4-cme0dbd127d1d2.cpe.net.cable.rogers.com.65116: Flags [P.], seq 38728:38940, ack 1, win 501, length 212
05:37:57.488139 IP lamp-ubuntu-s-1vcpu-1gb-tor1-01.ssh > cpee0dbd127d1d4-cme0dbd127d1d2.cpe.net.cable.rogers.com.65116: Flags [P.], seq 38940:39152, ack 1, win 501, length 212
05:37:57.488298 IP lamp-ubuntu-s-1vcpu-1gb-tor1-01.ssh > cpee0dbd127d1d4-cme0dbd127d1d2.cpe.net.cable.rogers.com.65116: Flags [P.], seq 39152:39364, ack 1, win 501, length 212
05:37:57.488427 IP lamp-ubuntu-s-1vcpu-1gb-tor1-01.ssh > cpee0dbd127d1d4-cme0dbd127d1d2.cpe.net.cable.rogers.com.65116: Flags [P.], seq 39364:39576, ack 1, win 501, length 212
05:37:57.488630 IP lamp-ubuntu-s-1vcpu-1gb-tor1-01.ssh > cpee0dbd127d1d4-cme0dbd127d1d2.cpe.net.cable.rogers.com.65116: Flags [P.], seq 39576:39788, ack 1, win 501, length 212
05:37:57.488814 IP lamp-ubuntu-s-1vcpu-1gb-tor1-01.ssh > cpee0dbd127d1d4-cme0dbd127d1d2.cpe.net.cable.rogers.com.65116: Flags [P.], seq 39788:40000, ack 1, win 501, length 212
05:37:57.489013 IP lamp-ubuntu-s-1vcpu-1gb-tor1-01.ssh > cpee0dbd127d1d4-cme0dbd127d1d2.cpe.net.cable.rogers.com.65116: Flags [P.], seq 40000:40212, ack 1, win 501, length 212
05:37:57.489196 IP lamp-ubuntu-s-1vcpu-1gb-tor1-01.ssh > cpee0dbd127d1d4-cme0dbd127d1d2.cpe.net.cable.rogers.com.65116: Flags [P.], seq 40212:40424, ack 1, win 501, length 212
05:37:57.489449 IP lamp-ubuntu-s-1vcpu-1gb-tor1-01.ssh > cpee0dbd127d1d4-cme0dbd127d1d2.cpe.net.cable.rogers.com.65116: Flags [P.], seq 40424:40636, ack 1, win 501, length 212
05:37:57.489724 IP lamp-ubuntu-s-1vcpu-1gb-tor1-01.ssh > cpee0dbd127d1d4-cme0dbd127d1d2.cpe.net.cable.rogers.com.65116: Flags [P.], seq 40636:40848, ack 1, win 501, length 212
05:37:57.489890 IP lamp-ubuntu-s-1vcpu-1gb-tor1-01.ssh > cpee0dbd127d1d4-cme0dbd127d1d2.cpe.net.cable.rogers.com.65116: Flags [P.], seq 40848:41060, ack 1, win 501, length 212
05:37:57.490049 IP lamp-ubuntu-s-1vcpu-1gb-tor1-01.ssh > cpee0dbd127d1d4-cme0dbd127d1d2.cpe.net.cable.rogers.com.65116: Flags [P.], seq 41060:41272, ack 1, win 501, length 212
05:37:57.490174 IP lamp-ubuntu-s-1vcpu-1gb-tor1-01.ssh > cpee0dbd127d1d4-cme0dbd127d1d2.cpe.net.cable.rogers.com.65116: Flags [P.], seq 41272:41484, ack 1, win 501, length 212
05:37:57.490207 IP cpee0dbd127d1d4-cme0dbd127d1d2.cpe.net.cable.rogers.com.65116 > lamp-ubuntu-s-1vcpu-1gb-tor1-01.ssh: Flags [.], ack 36544, win 508, length 0
05:37:57.490370 IP lamp-ubuntu-s-1vcpu-1gb-tor1-01.ssh > cpee0dbd127d1d4-cme0dbd127d1d2.cpe.net.cable.rogers.com.65116: Flags [P.], seq 41484:41856, ack 1, win 501, length 372
05:37:57.490496 IP lamp-ubuntu-s-1vcpu-1gb-tor1-01.ssh > cpee0dbd127d1d4-cme0dbd127d1d2.cpe.net.cable.rogers.com.65116: Flags [P.], seq 41856:42068, ack 1, win 501, length 212
05:37:57.490618 IP lamp-ubuntu-s-1vcpu-1gb-tor1-01.ssh > cpee0dbd127d1d4-cme0dbd127d1d2.cpe.net.cable.rogers.com.65116: Flags [P.], seq 42068:42280, ack 1, win 501, length 212
05:37:57.490740 IP lamp-ubuntu-s-1vcpu-1gb-tor1-01.ssh > cpee0dbd127d1d4-cme0dbd127d1d2.cpe.net.cable.rogers.com.65116: Flags [P.], seq 42280:42492, ack 1, win 501, length 212
05:37:57.490856 IP lamp-ubuntu-s-1vcpu-1gb-tor1-01.ssh > cpee0dbd127d1d4-cme0dbd127d1d2.cpe.net.cable.rogers.com.65116: Flags [P.], seq 42492:42704, ack 1, win 501, length 212
05:37:57.490975 IP lamp-ubuntu-s-1vcpu-1gb-tor1-01.ssh > cpee0dbd127d1d4-cme0dbd127d1d2.cpe.net.cable.rogers.com.65116: Flags [P.], seq 42704:42916, ack 1, win 501, length 212
05:37:57.491103 IP lamp-ubuntu-s-1vcpu-1gb-tor1-01.ssh > cpee0dbd127d1d4-cme0dbd127d1d2.cpe.net.cable.rogers.com.65116: Flags [P.], seq 42916:43128, ack 1, win 501, length 212
05:37:57.491290 IP lamp-ubuntu-s-1vcpu-1gb-tor1-01.ssh > cpee0dbd127d1d4-cme0dbd127d1d2.cpe.net.cable.rogers.com.65116: Flags [P.], seq 43128:43340, ack 1, win 501, length 212
05:37:57.491455 IP lamp-ubuntu-s-1vcpu-1gb-tor1-01.ssh > cpee0dbd127d1d4-cme0dbd127d1d2.cpe.net.cable.rogers.com.65116: Flags [P.], seq 43340:43552, ack 1, win 501, length 212
05:37:57.491595 IP lamp-ubuntu-s-1vcpu-1gb-tor1-01.ssh > cpee0dbd127d1d4-cme0dbd127d1d2.cpe.net.cable.rogers.com.65116: Flags [P.], seq 43552:43764, ack 1, win 501, length 212
05:37:57.491770 IP lamp-ubuntu-s-1vcpu-1gb-tor1-01.ssh > cpee0dbd127d1d4-cme0dbd127d1d2.cpe.net.cable.rogers.com.65116: Flags [P.], seq 43764:43976, ack 1, win 501, length 212
05:37:57.491943 IP lamp-ubuntu-s-1vcpu-1gb-tor1-01.ssh > cpee0dbd127d1d4-cme0dbd127d1d2.cpe.net.cable.rogers.com.65116: Flags [P.], seq 43976:44188, ack 1, win 501, length 212
05:37:57.492100 IP lamp-ubuntu-s-1vcpu-1gb-tor1-01.ssh > cpee0dbd127d1d4-cme0dbd127d1d2.cpe.net.cable.rogers.com.65116: Flags [P.], seq 44188:44400, ack 1, win 501, length 212
05:37:57.492271 IP lamp-ubuntu-s-1vcpu-1gb-tor1-01.ssh > cpee0dbd127d1d4-cme0dbd127d1d2.cpe.net.cable.rogers.com.65116: Flags [P.], seq 44400:44612, ack 1, win 501, length 212
05:37:57.492394 IP lamp-ubuntu-s-1vcpu-1gb-tor1-01.ssh > cpee0dbd127d1d4-cme0dbd127d1d2.cpe.net.cable.rogers.com.65116: Flags [P.], seq 44612:44824, ack 1, win 501, length 212
05:37:57.492521 IP lamp-ubuntu-s-1vcpu-1gb-tor1-01.ssh > cpee0dbd127d1d4-cme0dbd127d1d2.cpe.net.cable.rogers.com.65116: Flags [P.], seq 44824:45036, ack 1, win 501, length 212
05:37:57.492708 IP lamp-ubuntu-s-1vcpu-1gb-tor1-01.ssh > cpee0dbd127d1d4-cme0dbd127d1d2.cpe.net.cable.rogers.com.65116: Flags [P.], seq 45036:45248, ack 1, win 501, length 212
05:37:57.492890 IP lamp-ubuntu-s-1vcpu-1gb-tor1-01.ssh > cpee0dbd127d1d4-cme0dbd127d1d2.cpe.net.cable.rogers.com.65116: Flags [P.], seq 45248:45460, ack 1, win 501, length 212
05:37:57.493067 IP lamp-ubuntu-s-1vcpu-1gb-tor1-01.ssh > cpee0dbd127d1d4-cme0dbd127d1d2.cpe.net.cable.rogers.com.65116: Flags [P.], seq 45460:45672, ack 1, win 501, length 212
05:37:57.493195 IP lamp-ubuntu-s-1vcpu-1gb-tor1-01.ssh > cpee0dbd127d1d4-cme0dbd127d1d2.cpe.net.cable.rogers.com.65116: Flags [P.], seq 45672:45884, ack 1, win 501, length 212
05:37:57.493321 IP lamp-ubuntu-s-1vcpu-1gb-tor1-01.ssh > cpee0dbd127d1d4-cme0dbd127d1d2.cpe.net.cable.rogers.com.65116: Flags [P.], seq 45884:46096, ack 1, win 501, length 212
05:37:57.493442 IP lamp-ubuntu-s-1vcpu-1gb-tor1-01.ssh > cpee0dbd127d1d4-cme0dbd127d1d2.cpe.net.cable.rogers.com.65116: Flags [P.], seq 46096:46308, ack 1, win 501, length 212
05:37:57.493595 IP lamp-ubuntu-s-1vcpu-1gb-tor1-01.ssh > cpee0dbd127d1d4-cme0dbd127d1d2.cpe.net.cable.rogers.com.65116: Flags [P.], seq 46308:46520, ack 1, win 501, length 212
05:37:57.493714 IP lamp-ubuntu-s-1vcpu-1gb-tor1-01.ssh > cpee0dbd127d1d4-cme0dbd127d1d2.cpe.net.cable.rogers.com.65116: Flags [P.], seq 46520:46732, ack 1, win 501, length 212
05:37:57.493836 IP lamp-ubuntu-s-1vcpu-1gb-tor1-01.ssh > cpee0dbd127d1d4-cme0dbd127d1d2.cpe.net.cable.rogers.com.65116: Flags [P.], seq 46732:46944, ack 1, win 501, length 212
05:37:57.493957 IP lamp-ubuntu-s-1vcpu-1gb-tor1-01.ssh > cpee0dbd127d1d4-cme0dbd127d1d2.cpe.net.cable.rogers.com.65116: Flags [P.], seq 46944:47156, ack 1, win 501, length 212
05:37:57.494079 IP lamp-ubuntu-s-1vcpu-1gb-tor1-01.ssh > cpee0dbd127d1d4-cme0dbd127d1d2.cpe.net.cable.rogers.com.65116: Flags [P.], seq 47156:47368, ack 1, win 501, length 212
05:37:57.494196 IP lamp-ubuntu-s-1vcpu-1gb-tor1-01.ssh > cpee0dbd127d1d4-cme0dbd127d1d2.cpe.net.cable.rogers.com.65116: Flags [P.], seq 47368:47580, ack 1, win 501, length 212
05:37:57.494419 IP cpee0dbd127d1d4-cme0dbd127d1d2.cpe.net.cable.rogers.com.65116 > lamp-ubuntu-s-1vcpu-1gb-tor1-01.ssh: Flags [P.], seq 1:37, ack 32304, win 513, length 36
05:37:57.494420 IP cpee0dbd127d1d4-cme0dbd127d1d2.cpe.net.cable.rogers.com.65116 > lamp-ubuntu-s-1vcpu-1gb-tor1-01.ssh: Flags [.], ack 39576, win 509, length 0
05:37:57.494602 IP lamp-ubuntu-s-1vcpu-1gb-tor1-01.ssh > cpee0dbd127d1d4-cme0dbd127d1d2.cpe.net.cable.rogers.com.65116: Flags [P.], seq 47580:47792, ack 37, win 501, length 212
05:37:57.494753 IP lamp-ubuntu-s-1vcpu-1gb-tor1-01.ssh > cpee0dbd127d1d4-cme0dbd127d1d2.cpe.net.cable.rogers.com.65116: Flags [P.], seq 47792:48164, ack 37, win 501, length 372
05:37:57.494969 IP lamp-ubuntu-s-1vcpu-1gb-tor1-01.ssh > cpee0dbd127d1d4-cme0dbd127d1d2.cpe.net.cable.rogers.com.65116: Flags [P.], seq 48164:48560, ack 37, win 501, length 396
05:37:57.495148 IP lamp-ubuntu-s-1vcpu-1gb-tor1-01.ssh > cpee0dbd127d1d4-cme0dbd127d1d2.cpe.net.cable.rogers.com.65116: Flags [P.], seq 48560:48772, ack 37, win 501, length 212
05:37:57.495341 IP lamp-ubuntu-s-1vcpu-1gb-tor1-01.ssh > cpee0dbd127d1d4-cme0dbd127d1d2.cpe.net.cable.rogers.com.65116: Flags [P.], seq 48772:48984, ack 37, win 501, length 212
05:37:57.495509 IP lamp-ubuntu-s-1vcpu-1gb-tor1-01.ssh > cpee0dbd127d1d4-cme0dbd127d1d2.cpe.net.cable.rogers.com.65116: Flags [P.], seq 48984:49196, ack 37, win 501, length 212
05:37:57.495653 IP lamp-ubuntu-s-1vcpu-1gb-tor1-01.ssh > cpee0dbd127d1d4-cme0dbd127d1d2.cpe.net.cable.rogers.com.65116: Flags [P.], seq 49196:49408, ack 37, win 501, length 212
05:37:57.495783 IP lamp-ubuntu-s-1vcpu-1gb-tor1-01.ssh > cpee0dbd127d1d4-cme0dbd127d1d2.cpe.net.cable.rogers.com.65116: Flags [P.], seq 49408:49620, ack 37, win 501, length 212
05:37:57.495910 IP lamp-ubuntu-s-1vcpu-1gb-tor1-01.ssh > cpee0dbd127d1d4-cme0dbd127d1d2.cpe.net.cable.rogers.com.65116: Flags [P.], seq 49620:49832, ack 37, win 501, length 212
